"No.","Time","Source","Destination","Protocol","Length","Info"
"3","1.418386","10.0.2.15","149.154.167.99","TLSv1.2","221","Application Data"
"4","1.418785","149.154.167.99","10.0.2.15","TCP","60","443  >  52862 [ACK] Seq=1 Ack=168 Win=65535 Len=0"
"5","1.523770","149.154.167.99","10.0.2.15","TLSv1.2","167","Application Data"
"6","1.523798","10.0.2.15","149.154.167.99","TCP","54","52862  >  443 [ACK] Seq=168 Ack=114 Win=65535 Len=0"
"11","2.564240","10.0.2.15","149.154.167.99","TLSv1.2","237","Application Data"
"12","2.564627","149.154.167.99","10.0.2.15","TCP","60","443  >  52862 [ACK] Seq=114 Ack=351 Win=65535 Len=0"
"13","2.647373","149.154.167.99","10.0.2.15","TLSv1.2","167","Application Data"
"14","2.647400","10.0.2.15","149.154.167.99","TCP","54","52862  >  443 [ACK] Seq=351 Ack=227 Win=65535 Len=0"
"63","4.356231","10.0.2.15","149.154.167.99","TLSv1.2","82","Application Data"
"64","4.356512","149.154.167.99","10.0.2.15","TCP","60","443  >  58608 [ACK] Seq=1 Ack=29 Win=65535 Len=0"
"68","4.426635","149.154.167.99","10.0.2.15","TLSv1.2","92","Application Data"
"69","4.426647","10.0.2.15","149.154.167.99","TCP","54","58608  >  443 [ACK] Seq=29 Ack=39 Win=62780 Len=0"
"70","4.427812","149.154.167.99","10.0.2.15","TLSv1.2","78","Application Data"
"71","4.427829","10.0.2.15","149.154.167.99","TCP","54","58608  >  443 [ACK] Seq=29 Ack=63 Win=62780 Len=0"
"72","4.427813","149.154.167.99","10.0.2.15","TCP","60","443  >  58608 [FIN, ACK] Seq=63 Ack=29 Win=65535 Len=0"
"73","4.427996","10.0.2.15","149.154.167.99","TLSv1.2","78","Application Data"
"74","4.428013","10.0.2.15","149.154.167.99","TCP","54","58608  >  443 [FIN, ACK] Seq=53 Ack=64 Win=62780 Len=0"
"75","4.428179","149.154.167.99","10.0.2.15","TCP","60","443  >  58608 [ACK] Seq=64 Ack=53 Win=65535 Len=0"
"76","4.428179","149.154.167.99","10.0.2.15","TCP","60","443  >  58608 [ACK] Seq=64 Ack=54 Win=65535 Len=0"
"77","4.445646","10.0.2.15","149.154.167.99","TLSv1.2","525","Application Data"
"78","4.445940","149.154.167.99","10.0.2.15","TCP","60","443  >  52862 [ACK] Seq=227 Ack=822 Win=65535 Len=0"
"79","4.556312","149.154.167.99","10.0.2.15","TLSv1.2","233","Application Data"
"80","4.556345","10.0.2.15","149.154.167.99","TCP","54","52862  >  443 [ACK] Seq=822 Ack=406 Win=65535 Len=0"
"86","5.651786","10.0.2.15","149.154.167.99","TLSv1.2","237","Application Data"
"87","5.652204","149.154.167.99","10.0.2.15","TCP","60","443  >  52862 [ACK] Seq=406 Ack=1005 Win=65535 Len=0"
"88","5.730593","149.154.167.99","10.0.2.15","TLSv1.2","167","Application Data"
"89","5.730690","10.0.2.15","149.154.167.99","TCP","54","52862  >  443 [ACK] Seq=1005 Ack=519 Win=65535 Len=0"
"94","8.738514","10.0.2.15","149.154.167.99","TLSv1.2","237","Application Data"
"95","8.738961","149.154.167.99","10.0.2.15","TCP","60","443  >  52862 [ACK] Seq=519 Ack=1188 Win=65535 Len=0"
"96","8.872683","149.154.167.99","10.0.2.15","TLSv1.2","167","Application Data"
"97","8.872709","10.0.2.15","149.154.167.99","TCP","54","52862  >  443 [ACK] Seq=1188 Ack=632 Win=65535 Len=0"
"102","11.880119","10.0.2.15","149.154.167.99","TLSv1.2","237","Application Data"
"103","11.880453","149.154.167.99","10.0.2.15","TCP","60","443  >  52862 [ACK] Seq=632 Ack=1371 Win=65535 Len=0"
"104","11.961935","149.154.167.99","10.0.2.15","TLSv1.2","167","Application Data"
"105","11.961969","10.0.2.15","149.154.167.99","TCP","54","52862  >  443 [ACK] Seq=1371 Ack=745 Win=65535 Len=0"
"110","14.969736","10.0.2.15","149.154.167.99","TLSv1.2","237","Application Data"
"111","14.969969","149.154.167.99","10.0.2.15","TCP","60","443  >  52862 [ACK] Seq=745 Ack=1554 Win=65535 Len=0"
"114","15.062868","149.154.167.99","10.0.2.15","TLSv1.2","167","Application Data"
"115","15.062902","10.0.2.15","149.154.167.99","TCP","54","52862  >  443 [ACK] Seq=1554 Ack=858 Win=65535 Len=0"
"116","16.063210","10.0.2.15","149.154.167.99","TLSv1.2","93","Application Data"
"117","16.063602","149.154.167.99","10.0.2.15","TCP","60","443  >  58620 [ACK] Seq=1 Ack=40 Win=65535 Len=0"
"118","16.135148","149.154.167.99","10.0.2.15","TLSv1.2","93","Application Data"
"119","16.175971","10.0.2.15","149.154.167.99","TCP","54","58620  >  443 [ACK] Seq=40 Ack=40 Win=63986 Len=0"
"120","18.070507","10.0.2.15","149.154.167.99","TLSv1.2","237","Application Data"
"121","18.071022","149.154.167.99","10.0.2.15","TCP","60","443  >  52862 [ACK] Seq=858 Ack=1737 Win=65535 Len=0"
"122","18.163944","149.154.167.99","10.0.2.15","TLSv1.2","167","Application Data"
"123","18.163975","10.0.2.15","149.154.167.99","TCP","54","52862  >  443 [ACK] Seq=1737 Ack=971 Win=65535 Len=0"
"128","19.447835","10.0.2.15","149.154.167.99","TLSv1.2","525","Application Data"
"129","19.448208","149.154.167.99","10.0.2.15","TCP","60","443  >  52862 [ACK] Seq=971 Ack=2208 Win=65535 Len=0"
"130","19.577920","149.154.167.99","10.0.2.15","TLSv1.2","233","Application Data"
"131","19.577948","10.0.2.15","149.154.167.99","TCP","54","52862  >  443 [ACK] Seq=2208 Ack=1150 Win=65535 Len=0"
"134","21.170438","10.0.2.15","149.154.167.99","TLSv1.2","237","Application Data"
"135","21.170858","149.154.167.99","10.0.2.15","TCP","60","443  >  52862 [ACK] Seq=1150 Ack=2391 Win=65535 Len=0"
"136","21.249801","149.154.167.99","10.0.2.15","TLSv1.2","167","Application Data"
"137","21.249829","10.0.2.15","149.154.167.99","TCP","54","52862  >  443 [ACK] Seq=2391 Ack=1263 Win=65535 Len=0"
"142","24.256491","10.0.2.15","149.154.167.99","TLSv1.2","237","Application Data"
"143","24.256976","149.154.167.99","10.0.2.15","TCP","60","443  >  52862 [ACK] Seq=1263 Ack=2574 Win=65535 Len=0"
"144","24.337087","149.154.167.99","10.0.2.15","TLSv1.2","167","Application Data"
"145","24.337114","10.0.2.15","149.154.167.99","TCP","54","52862  >  443 [ACK] Seq=2574 Ack=1376 Win=65535 Len=0"
"218","27.344329","10.0.2.15","149.154.167.99","TLSv1.2","237","Application Data"
"219","27.344818","149.154.167.99","10.0.2.15","TCP","60","443  >  52862 [ACK] Seq=1376 Ack=2757 Win=65535 Len=0"
"220","27.470843","149.154.167.99","10.0.2.15","TLSv1.2","167","Application Data"
"221","27.470872","10.0.2.15","149.154.167.99","TCP","54","52862  >  443 [ACK] Seq=2757 Ack=1489 Win=65535 Len=0"
"232","30.483628","10.0.2.15","149.154.167.99","TLSv1.2","237","Application Data"
"233","30.484026","149.154.167.99","10.0.2.15","TCP","60","443  >  52862 [ACK] Seq=1489 Ack=2940 Win=65535 Len=0"
"234","30.562312","149.154.167.99","10.0.2.15","TLSv1.2","167","Application Data"
"235","30.562348","10.0.2.15","149.154.167.99","TCP","54","52862  >  443 [ACK] Seq=2940 Ack=1602 Win=65535 Len=0"
"238","33.572673","10.0.2.15","149.154.167.99","TLSv1.2","237","Application Data"
"239","33.573029","149.154.167.99","10.0.2.15","TCP","60","443  >  52862 [ACK] Seq=1602 Ack=3123 Win=65535 Len=0"
"240","33.651330","149.154.167.99","10.0.2.15","TLSv1.2","167","Application Data"
"241","33.651358","10.0.2.15","149.154.167.99","TCP","54","52862  >  443 [ACK] Seq=3123 Ack=1715 Win=65535 Len=0"
"242","34.099157","149.154.167.99","10.0.2.15","TLSv1.2","393","Application Data"
"243","34.099190","10.0.2.15","149.154.167.99","TCP","54","52862  >  443 [ACK] Seq=3123 Ack=2054 Win=65535 Len=0"
"250","34.445378","10.0.2.15","149.154.167.99","TLSv1.2","525","Application Data"
"251","34.445780","149.154.167.99","10.0.2.15","TCP","60","443  >  52862 [ACK] Seq=2054 Ack=3594 Win=65535 Len=0"
"257","34.560940","149.154.167.99","10.0.2.15","TLSv1.2","233","Application Data"
"258","34.560965","10.0.2.15","149.154.167.99","TCP","54","52862  >  443 [ACK] Seq=3594 Ack=2233 Win=65535 Len=0"
"259","34.846722","10.0.2.15","149.154.167.99","TLSv1.2","253","Application Data"
"260","34.847050","149.154.167.99","10.0.2.15","TCP","60","443  >  52862 [ACK] Seq=2233 Ack=3793 Win=65535 Len=0"
"261","34.962458","149.154.167.99","10.0.2.15","TLSv1.2","167","Application Data"
"262","34.962484","10.0.2.15","149.154.167.99","TCP","54","52862  >  443 [ACK] Seq=3793 Ack=2346 Win=65535 Len=0"
"265","34.966740","10.0.2.15","149.154.167.99","TLSv1.2","253","Application Data"
"266","34.967023","149.154.167.99","10.0.2.15","TCP","60","443  >  52862 [ACK] Seq=2346 Ack=3992 Win=65535 Len=0"
"271","35.074279","149.154.167.99","10.0.2.15","TLSv1.2","473","Application Data"
"272","35.115386","10.0.2.15","149.154.167.99","TCP","54","52862  >  443 [ACK] Seq=3992 Ack=2765 Win=65535 Len=0"
"273","35.377378","10.0.2.15","149.154.167.99","TLSv1.2","253","Application Data"
"274","35.377877","149.154.167.99","10.0.2.15","TCP","60","443  >  52862 [ACK] Seq=2765 Ack=4191 Win=65535 Len=0"
"275","35.478629","149.154.167.99","10.0.2.15","TLSv1.2","199","Application Data"
"276","35.478672","10.0.2.15","149.154.167.99","TCP","54","52862  >  443 [ACK] Seq=4191 Ack=2910 Win=65535 Len=0"
"277","35.904520","149.154.167.99","10.0.2.15","TLSv1.2","393","Application Data"
"278","35.904577","10.0.2.15","149.154.167.99","TCP","54","52862  >  443 [ACK] Seq=4191 Ack=3249 Win=65535 Len=0"
"291","36.659309","10.0.2.15","149.154.167.99","TLSv1.2","237","Application Data"
"292","36.659692","149.154.167.99","10.0.2.15","TCP","60","443  >  52862 [ACK] Seq=3249 Ack=4374 Win=65535 Len=0"
"293","36.702451","10.0.2.15","149.154.167.99","TLSv1.2","187","Application Data"
"294","36.702846","149.154.167.99","10.0.2.15","TCP","60","443  >  52862 [ACK] Seq=3249 Ack=4507 Win=65535 Len=0"
"295","36.735354","149.154.167.99","10.0.2.15","TLSv1.2","167","Application Data"
"296","36.735393","10.0.2.15","149.154.167.99","TCP","54","52862  >  443 [ACK] Seq=4507 Ack=3362 Win=65535 Len=0"
"297","36.809492","149.154.167.99","10.0.2.15","TLSv1.2","457","Application Data"
"298","36.809519","10.0.2.15","149.154.167.99","TCP","54","52862  >  443 [ACK] Seq=4507 Ack=3765 Win=65535 Len=0"
"301","36.824976","149.154.167.99","10.0.2.15","TLSv1.2","167","Application Data"
"302","36.825009","10.0.2.15","149.154.167.99","TCP","54","52862  >  443 [ACK] Seq=4507 Ack=3878 Win=65535 Len=0"
"308","36.885625","10.0.2.15","149.154.167.99","TLSv1.2","285","Application Data"
"309","36.886052","149.154.167.99","10.0.2.15","TCP","60","443  >  52862 [ACK] Seq=3878 Ack=4738 Win=65535 Len=0"
"311","36.990281","149.154.167.99","10.0.2.15","TLSv1.2","473","Application Data"
"312","36.990328","10.0.2.15","149.154.167.99","TCP","54","52862  >  443 [ACK] Seq=4738 Ack=4297 Win=65535 Len=0"
"317","37.260733","10.0.2.15","149.154.167.99","TLSv1.2","269","Application Data"
"318","37.261142","149.154.167.99","10.0.2.15","TCP","60","443  >  52862 [ACK] Seq=4297 Ack=4953 Win=65535 Len=0"
"319","37.354575","10.0.2.15","149.154.167.99","TLSv1.2","171","Application Data"
"320","37.354937","149.154.167.99","10.0.2.15","TCP","60","443  >  52862 [ACK] Seq=4297 Ack=5070 Win=65535 Len=0"
"321","37.434648","149.154.167.99","10.0.2.15","TLSv1.2","217","Application Data"
"322","37.434698","10.0.2.15","149.154.167.99","TCP","54","52862  >  443 [ACK] Seq=5070 Ack=4460 Win=65535 Len=0"
"323","37.484702","149.154.167.99","10.0.2.15","TLSv1.2","167","Application Data"
"324","37.484730","10.0.2.15","149.154.167.99","TCP","54","52862  >  443 [ACK] Seq=5070 Ack=4573 Win=65535 Len=0"
"329","37.589118","10.0.2.15","149.154.167.99","TLSv1.2","253","Application Data"
"330","37.589470","149.154.167.99","10.0.2.15","TCP","60","443  >  52862 [ACK] Seq=4573 Ack=5269 Win=65535 Len=0"
"331","37.717218","149.154.167.99","10.0.2.15","TLSv1.2","167","Application Data"
"332","37.717249","10.0.2.15","149.154.167.99","TCP","54","52862  >  443 [ACK] Seq=5269 Ack=4686 Win=65535 Len=0"
"333","37.719851","10.0.2.15","149.154.167.99","TLSv1.2","253","Application Data"
"334","37.720128","149.154.167.99","10.0.2.15","TCP","60","443  >  52862 [ACK] Seq=4686 Ack=5468 Win=65535 Len=0"
"341","37.872088","149.154.167.99","10.0.2.15","TLSv1.2","457","Application Data"
"342","37.915995","10.0.2.15","149.154.167.99","TCP","54","52862  >  443 [ACK] Seq=5468 Ack=5089 Win=65535 Len=0"
"345","38.299196","149.154.167.99","10.0.2.15","TLSv1.2","409","Application Data"
"346","38.299235","10.0.2.15","149.154.167.99","TCP","54","52862  >  443 [ACK] Seq=5468 Ack=5444 Win=65535 Len=0"
"425","39.382673","149.154.167.99","10.0.2.15","TLSv1.2","393","Application Data"
"426","39.382742","10.0.2.15","149.154.167.99","TCP","54","52862  >  443 [ACK] Seq=5468 Ack=5783 Win=65535 Len=0"
"434","39.750605","10.0.2.15","149.154.167.99","TLSv1.2","253","Application Data"
"435","39.750956","149.154.167.99","10.0.2.15","TCP","60","443  >  52862 [ACK] Seq=5783 Ack=5667 Win=65535 Len=0"
"436","39.839306","149.154.167.99","10.0.2.15","TLSv1.2","167","Application Data"
"437","39.839353","10.0.2.15","149.154.167.99","TCP","54","52862  >  443 [ACK] Seq=5667 Ack=5896 Win=65535 Len=0"
"445","40.697592","149.154.167.99","10.0.2.15","TLSv1.2","409","Application Data"
"446","40.697645","10.0.2.15","149.154.167.99","TCP","54","52862  >  443 [ACK] Seq=5667 Ack=6251 Win=65535 Len=0"
"454","41.759854","149.154.167.99","10.0.2.15","TLSv1.2","393","Application Data"
"455","41.759885","10.0.2.15","149.154.167.99","TCP","54","52862  >  443 [ACK] Seq=5667 Ack=6590 Win=65535 Len=0"
"465","42.845609","10.0.2.15","149.154.167.99","TLSv1.2","253","Application Data"
"466","42.845996","149.154.167.99","10.0.2.15","TCP","60","443  >  52862 [ACK] Seq=6590 Ack=5866 Win=65535 Len=0"
"467","42.922892","149.154.167.99","10.0.2.15","TLSv1.2","167","Application Data"
"468","42.922933","10.0.2.15","149.154.167.99","TCP","54","52862  >  443 [ACK] Seq=5866 Ack=6703 Win=65535 Len=0"
"476","45.932329","10.0.2.15","149.154.167.99","TLSv1.2","237","Application Data"
"477","45.932639","149.154.167.99","10.0.2.15","TCP","60","443  >  52862 [ACK] Seq=6703 Ack=6049 Win=65535 Len=0"
"478","46.057078","149.154.167.99","10.0.2.15","TLSv1.2","167","Application Data"
"479","46.057111","10.0.2.15","149.154.167.99","TCP","54","52862  >  443 [ACK] Seq=6049 Ack=6816 Win=65535 Len=0"
"484","49.063877","10.0.2.15","149.154.167.99","TLSv1.2","237","Application Data"
"485","49.064283","149.154.167.99","10.0.2.15","TCP","60","443  >  52862 [ACK] Seq=6816 Ack=6232 Win=65535 Len=0"
"486","49.143650","149.154.167.99","10.0.2.15","TLSv1.2","167","Application Data"
"487","49.143695","10.0.2.15","149.154.167.99","TCP","54","52862  >  443 [ACK] Seq=6232 Ack=6929 Win=65535 Len=0"
"490","49.449629","10.0.2.15","149.154.167.99","TLSv1.2","541","Application Data"
"491","49.450021","149.154.167.99","10.0.2.15","TCP","60","443  >  52862 [ACK] Seq=6929 Ack=6719 Win=65535 Len=0"
"492","49.566401","149.154.167.99","10.0.2.15","TLSv1.2","233","Application Data"
"493","49.566432","10.0.2.15","149.154.167.99","TCP","54","52862  >  443 [ACK] Seq=6719 Ack=7108 Win=65535 Len=0"
"494","49.746870","149.154.167.99","10.0.2.15","TLSv1.2","652","Application Data"
"495","49.746912","10.0.2.15","149.154.167.99","TCP","54","52862  >  443 [ACK] Seq=6719 Ack=7706 Win=65535 Len=0"
"509","50.099835","10.0.2.15","149.154.167.99","TCP","74","49342  >  443 [SYN] Seq=0 Win=64240 Len=0 MSS=1460 SACK_PERM=1 TSval=4092963563 TSecr=0 WS=128"
"510","50.169934","149.154.167.99","10.0.2.15","TCP","60","443  >  49342 [SYN, ACK] Seq=0 Ack=1 Win=65535 Len=0 MSS=1460"
"511","50.169976","10.0.2.15","149.154.167.99","TCP","54","49342  >  443 [ACK] Seq=1 Ack=1 Win=64240 Len=0"
"512","50.171617","10.0.2.15","149.154.167.99","TLSv1.3","755","Client Hello"
"513","50.171930","149.154.167.99","10.0.2.15","TCP","60","443  >  49342 [ACK] Seq=1 Ack=702 Win=65535 Len=0"
"514","50.247135","149.154.167.99","10.0.2.15","TLSv1.3","308","Server Hello, Change Cipher Spec, Application Data, Application Data"
"515","50.247193","10.0.2.15","149.154.167.99","TCP","54","49342  >  443 [ACK] Seq=702 Ack=255 Win=63986 Len=0"
"516","50.247817","10.0.2.15","149.154.167.99","TLSv1.3","134","Change Cipher Spec, Application Data"
"517","50.248055","10.0.2.15","149.154.167.99","TLSv1.3","224","Application Data"
"518","50.248118","149.154.167.99","10.0.2.15","TCP","60","443  >  49342 [ACK] Seq=255 Ack=782 Win=65535 Len=0"
"519","50.248208","149.154.167.99","10.0.2.15","TCP","60","443  >  49342 [ACK] Seq=255 Ack=952 Win=65535 Len=0"
"520","50.320098","149.154.167.99","10.0.2.15","TLSv1.3","428","Application Data, Application Data"
"521","50.320459","10.0.2.15","149.154.167.99","TLSv1.3","85","Application Data"
"522","50.320732","10.0.2.15","149.154.167.99","TCP","74","49358  >  443 [SYN] Seq=0 Win=64240 Len=0 MSS=1460 SACK_PERM=1 TSval=4092963784 TSecr=0 WS=128"
"523","50.320803","149.154.167.99","10.0.2.15","TCP","60","443  >  49342 [ACK] Seq=629 Ack=983 Win=65535 Len=0"
"524","50.391252","149.154.167.99","10.0.2.15","TCP","60","443  >  49358 [SYN, ACK] Seq=0 Ack=1 Win=65535 Len=0 MSS=1460"
"525","50.391299","10.0.2.15","149.154.167.99","TCP","54","49358  >  443 [ACK] Seq=1 Ack=1 Win=64240 Len=0"
"526","50.392864","10.0.2.15","149.154.167.99","TLSv1.3","752","Client Hello"
"527","50.393365","149.154.167.99","10.0.2.15","TCP","60","443  >  49358 [ACK] Seq=1 Ack=699 Win=65535 Len=0"
"528","50.465750","149.154.167.99","10.0.2.15","TLSv1.3","1294","Server Hello, Change Cipher Spec, Application Data"
"529","50.465785","10.0.2.15","149.154.167.99","TCP","54","49358  >  443 [ACK] Seq=699 Ack=1241 Win=63240 Len=0"
"530","50.466371","149.154.167.99","10.0.2.15","TCP","2910","443  >  49358 [PSH, ACK] Seq=1241 Ack=699 Win=65535 Len=2856 [TCP segment of a reassembled PDU]"
"531","50.466390","10.0.2.15","149.154.167.99","TCP","54","49358  >  443 [ACK] Seq=699 Ack=4097 Win=63240 Len=0"
"532","50.467086","149.154.167.99","10.0.2.15","TLSv1.3","1660","Application Data, Application Data, Application Data"
"533","50.467098","10.0.2.15","149.154.167.99","TCP","54","49358  >  443 [ACK] Seq=699 Ack=5703 Win=63240 Len=0"
"534","50.468958","10.0.2.15","149.154.167.99","TLSv1.3","134","Change Cipher Spec, Application Data"
"535","50.469119","10.0.2.15","149.154.167.99","TLSv1.3","665","Application Data"
"536","50.469161","149.154.167.99","10.0.2.15","TCP","60","443  >  49358 [ACK] Seq=5703 Ack=779 Win=65535 Len=0"
"537","50.469211","149.154.167.99","10.0.2.15","TCP","60","443  >  49358 [ACK] Seq=5703 Ack=1390 Win=65535 Len=0"
"538","50.541378","149.154.167.99","10.0.2.15","TLSv1.3","660","Application Data, Application Data"
"539","50.543061","149.154.167.99","10.0.2.15","TLSv1.3","296","Application Data"
"540","50.543106","10.0.2.15","149.154.167.99","TCP","54","49358  >  443 [ACK] Seq=1390 Ack=6551 Win=63240 Len=0"
"541","50.545115","10.0.2.15","149.154.167.99","TLSv1.3","146","Application Data"
"542","50.545485","149.154.167.99","10.0.2.15","TCP","60","443  >  49358 [ACK] Seq=6551 Ack=1482 Win=65535 Len=0"
"543","50.547130","10.0.2.15","149.154.167.99","TLSv1.3","237","Application Data"
"544","50.547458","149.154.167.99","10.0.2.15","TCP","60","443  >  49358 [ACK] Seq=6551 Ack=1665 Win=65535 Len=0"
"545","50.617062","149.154.167.99","10.0.2.15","TLSv1.3","183","Application Data"
"546","50.620093","10.0.2.15","149.154.167.99","TLSv1.3","301","Application Data"
"547","50.620450","149.154.167.99","10.0.2.15","TCP","60","443  >  49358 [ACK] Seq=6680 Ack=1912 Win=65535 Len=0"
"548","50.702827","149.154.167.99","10.0.2.15","TLSv1.3","249","Application Data"
"549","50.718951","149.154.167.99","10.0.2.15","TCP","1294","443  >  49358 [PSH, ACK] Seq=6875 Ack=1912 Win=65535 Len=1240 [TCP segment of a reassembled PDU]"
"550","50.719104","10.0.2.15","149.154.167.99","TCP","54","49358  >  443 [ACK] Seq=1912 Ack=8115 Win=63240 Len=0"
"551","50.719312","149.154.167.99","10.0.2.15","TCP","1294","443  >  49358 [PSH, ACK] Seq=8115 Ack=1912 Win=65535 Len=1240 [TCP segment of a reassembled PDU]"
"552","50.720080","149.154.167.99","10.0.2.15","TCP","2534","443  >  49358 [PSH, ACK] Seq=9355 Ack=1912 Win=65535 Len=2480 [TCP segment of a reassembled PDU]"
"553","50.720104","10.0.2.15","149.154.167.99","TCP","54","49358  >  443 [ACK] Seq=1912 Ack=11835 Win=63240 Len=0"
"554","50.720160","149.154.167.99","10.0.2.15","TCP","2534","443  >  49358 [PSH, ACK] Seq=11835 Ack=1912 Win=65535 Len=2480 [TCP segment of a reassembled PDU]"
"555","50.720165","10.0.2.15","149.154.167.99","TCP","54","49358  >  443 [ACK] Seq=1912 Ack=14315 Win=63240 Len=0"
"556","50.720539","149.154.167.99","10.0.2.15","TCP","2534","443  >  49358 [PSH, ACK] Seq=14315 Ack=1912 Win=65535 Len=2480 [TCP segment of a reassembled PDU]"
"557","50.720546","10.0.2.15","149.154.167.99","TCP","54","49358  >  443 [ACK] Seq=1912 Ack=16795 Win=63240 Len=0"
"558","50.720580","149.154.167.99","10.0.2.15","TCP","1294","443  >  49358 [PSH, ACK] Seq=16795 Ack=1912 Win=65535 Len=1240 [TCP segment of a reassembled PDU]"
"559","50.721172","149.154.167.99","10.0.2.15","TCP","3774","443  >  49358 [PSH, ACK] Seq=18035 Ack=1912 Win=65535 Len=3720 [TCP segment of a reassembled PDU]"
"560","50.721198","10.0.2.15","149.154.167.99","TCP","54","49358  >  443 [ACK] Seq=1912 Ack=21755 Win=63240 Len=0"
"561","50.730426","149.154.167.99","10.0.2.15","TLSv1.3","2820","Application Data [TCP segment of a reassembled PDU]"
"562","50.730465","10.0.2.15","149.154.167.99","TCP","54","49358  >  443 [ACK] Seq=1912 Ack=24521 Win=63240 Len=0"
"563","50.795407","149.154.167.99","10.0.2.15","TLSv1.3","836","Application Data"
"564","50.839511","10.0.2.15","149.154.167.99","TCP","54","49358  >  443 [ACK] Seq=1912 Ack=25303 Win=63240 Len=0"
"569","52.151315","10.0.2.15","149.154.167.99","TLSv1.2","237","Application Data"
"570","52.151796","149.154.167.99","10.0.2.15","TCP","60","443  >  52862 [ACK] Seq=7706 Ack=6902 Win=65535 Len=0"
"571","52.218973","149.154.167.99","10.0.2.15","TLSv1.2","393","Application Data"
"572","52.219000","10.0.2.15","149.154.167.99","TCP","54","52862  >  443 [ACK] Seq=6902 Ack=8045 Win=65535 Len=0"
"577","52.233843","149.154.167.99","10.0.2.15","TLSv1.2","167","Application Data"
"578","52.233899","10.0.2.15","149.154.167.99","TCP","54","52862  >  443 [ACK] Seq=6902 Ack=8158 Win=65535 Len=0"
"584","53.505552","149.154.167.99","10.0.2.15","TLSv1.2","393","Application Data"
"585","53.505587","10.0.2.15","149.154.167.99","TCP","54","52862  >  443 [ACK] Seq=6902 Ack=8497 Win=65535 Len=0"
"595","54.696951","149.154.167.99","10.0.2.15","TLSv1.2","393","Application Data"
"596","54.696983","10.0.2.15","149.154.167.99","TCP","54","52862  >  443 [ACK] Seq=6902 Ack=8836 Win=65535 Len=0"
"606","55.280464","10.0.2.15","149.154.167.99","TLSv1.2","253","Application Data"
"607","55.280766","149.154.167.99","10.0.2.15","TCP","60","443  >  52862 [ACK] Seq=8836 Ack=7101 Win=65535 Len=0"
"608","55.386408","149.154.167.99","10.0.2.15","TLSv1.2","167","Application Data"
"609","55.386438","10.0.2.15","149.154.167.99","TCP","54","52862  >  443 [ACK] Seq=7101 Ack=8949 Win=65535 Len=0"
"632","58.396882","10.0.2.15","149.154.167.99","TLSv1.2","237","Application Data"
"633","58.397411","149.154.167.99","10.0.2.15","TCP","60","443  >  52862 [ACK] Seq=8949 Ack=7149 Win=65535 Len=0"
"634","58.397411","149.154.167.99","10.0.2.15","TCP","60","443  >  52862 [ACK] Seq=8949 Ack=7197 Win=65535 Len=0"
"635","58.397411","149.154.167.99","10.0.2.15","TCP","60","443  >  52862 [ACK] Seq=8949 Ack=7245 Win=65535 Len=0"
"636","58.397411","149.154.167.99","10.0.2.15","TCP","60","443  >  52862 [ACK] Seq=8949 Ack=7284 Win=65535 Len=0"
"637","58.479678","149.154.167.99","10.0.2.15","TLSv1.2","167","Application Data"
"638","58.479719","10.0.2.15","149.154.167.99","TCP","54","52862  >  443 [ACK] Seq=7284 Ack=9062 Win=65535 Len=0"
"639","59.141078","149.154.167.99","10.0.2.15","TLSv1.2","393","Application Data"
"640","59.141121","10.0.2.15","149.154.167.99","TCP","54","52862  >  443 [ACK] Seq=7284 Ack=9401 Win=65535 Len=0"
"659","60.158062","10.0.2.15","149.154.167.99","TLSv1.2","237","Application Data"
"660","60.158469","149.154.167.99","10.0.2.15","TCP","60","443  >  52862 [ACK] Seq=9401 Ack=7467 Win=65535 Len=0"
"661","60.256985","149.154.167.99","10.0.2.15","TLSv1.2","167","Application Data"
"662","60.257019","10.0.2.15","149.154.167.99","TCP","54","52862  >  443 [ACK] Seq=7467 Ack=9514 Win=65535 Len=0"
"666","60.260668","149.154.167.99","10.0.2.15","TLSv1.2","393","Application Data"
"667","60.260684","10.0.2.15","149.154.167.99","TCP","54","52862  >  443 [ACK] Seq=7467 Ack=9853 Win=65535 Len=0"
"674","60.585842","10.0.2.15","149.154.167.99","TLSv1.2","253","Application Data"
"675","60.586825","149.154.167.99","10.0.2.15","TCP","60","443  >  52862 [ACK] Seq=9853 Ack=7666 Win=65535 Len=0"
"676","60.700693","149.154.167.99","10.0.2.15","TLSv1.2","167","Application Data"
"677","60.700728","10.0.2.15","149.154.167.99","TCP","54","52862  >  443 [ACK] Seq=7666 Ack=9966 Win=65535 Len=0"
"682","60.826324","10.0.2.15","149.154.167.99","TLSv1.2","253","Application Data"
"683","60.826726","149.154.167.99","10.0.2.15","TCP","60","443  >  52862 [ACK] Seq=9966 Ack=7865 Win=65535 Len=0"
"684","60.959666","149.154.167.99","10.0.2.15","TLSv1.2","457","Application Data"
"685","60.959701","10.0.2.15","149.154.167.99","TCP","54","52862  >  443 [ACK] Seq=7865 Ack=10369 Win=65535 Len=0"
"686","61.150031","10.0.2.15","149.154.167.99","TLSv1.2","301","Application Data"
"687","61.150434","149.154.167.99","10.0.2.15","TCP","60","443  >  52862 [ACK] Seq=10369 Ack=8112 Win=65535 Len=0"
"688","61.151854","10.0.2.15","149.154.167.99","TLSv1.2","187","Application Data"
"689","61.152094","149.154.167.99","10.0.2.15","TCP","60","443  >  52862 [ACK] Seq=10369 Ack=8245 Win=65535 Len=0"
"690","61.252286","149.154.167.99","10.0.2.15","TLSv1.2","233","Application Data"
"691","61.252316","10.0.2.15","149.154.167.99","TCP","54","52862  >  443 [ACK] Seq=8245 Ack=10548 Win=65535 Len=0"
"694","61.268782","149.154.167.99","10.0.2.15","TLSv1.2","313","Application Data"
"695","61.268815","10.0.2.15","149.154.167.99","TCP","54","52862  >  443 [ACK] Seq=8245 Ack=10807 Win=65535 Len=0"
"696","61.271210","10.0.2.15","149.154.167.99","TLSv1.2","269","Application Data"
"697","61.271597","149.154.167.99","10.0.2.15","TCP","60","443  >  52862 [ACK] Seq=10807 Ack=8460 Win=65535 Len=0"
"700","61.386425","149.154.167.99","10.0.2.15","TLSv1.2","457","Application Data"
"701","61.427537","10.0.2.15","149.154.167.99","TCP","54","52862  >  443 [ACK] Seq=8460 Ack=11210 Win=65535 Len=0"
"702","61.506123","10.0.2.15","149.154.167.99","TLSv1.2","237","Application Data"
"703","61.506432","149.154.167.99","10.0.2.15","TCP","60","443  >  52862 [ACK] Seq=11210 Ack=8643 Win=65535 Len=0"
"704","61.584811","149.154.167.99","10.0.2.15","TLSv1.2","167","Application Data"
"705","61.584855","10.0.2.15","149.154.167.99","TCP","54","52862  >  443 [ACK] Seq=8643 Ack=11323 Win=65535 Len=0"
"710","61.691634","149.154.167.99","10.0.2.15","TLSv1.2","393","Application Data"
"711","61.691675","10.0.2.15","149.154.167.99","TCP","54","52862  >  443 [ACK] Seq=8643 Ack=11662 Win=65535 Len=0"
"712","61.767821","10.0.2.15","149.154.167.99","TLSv1.2","285","Application Data"
"713","61.768269","149.154.167.99","10.0.2.15","TCP","60","443  >  52862 [ACK] Seq=11662 Ack=8874 Win=65535 Len=0"
"714","61.915305","149.154.167.99","10.0.2.15","TLSv1.2","844","Application Data"
"715","61.915369","10.0.2.15","149.154.167.99","TCP","54","52862  >  443 [ACK] Seq=8874 Ack=12452 Win=65535 Len=0"
"723","63.390890","149.154.167.99","10.0.2.15","TLSv1.2","393","Application Data"
"724","63.390909","10.0.2.15","149.154.167.99","TCP","54","52862  >  443 [ACK] Seq=8874 Ack=12791 Win=65535 Len=0"
"732","64.220809","10.0.2.15","149.154.167.99","TLSv1.2","253","Application Data"
"733","64.221187","149.154.167.99","10.0.2.15","TCP","60","443  >  52862 [ACK] Seq=12791 Ack=9073 Win=65535 Len=0"
"734","64.374414","149.154.167.99","10.0.2.15","TLSv1.2","167","Application Data"
"735","64.374444","10.0.2.15","149.154.167.99","TCP","54","52862  >  443 [ACK] Seq=9073 Ack=12904 Win=65535 Len=0"
"736","64.378102","10.0.2.15","149.154.167.99","TLSv1.2","253","Application Data"
"737","64.378474","149.154.167.99","10.0.2.15","TCP","60","443  >  52862 [ACK] Seq=12904 Ack=9272 Win=65535 Len=0"
"742","64.448389","10.0.2.15","149.154.167.99","TLSv1.2","445","Application Data"
"743","64.448750","149.154.167.99","10.0.2.15","TCP","60","443  >  52862 [ACK] Seq=12904 Ack=9663 Win=65535 Len=0"
"744","64.545176","149.154.167.99","10.0.2.15","TLSv1.2","521","Application Data"
"745","64.587356","10.0.2.15","149.154.167.99","TCP","54","52862  >  443 [ACK] Seq=9663 Ack=13371 Win=65535 Len=0"
"746","64.588254","149.154.167.99","10.0.2.15","TLSv1.2","233","Application Data"
"747","64.588275","10.0.2.15","149.154.167.99","TCP","54","52862  >  443 [ACK] Seq=9663 Ack=13550 Win=65535 Len=0"
"748","64.594314","10.0.2.15","149.154.167.99","TLSv1.2","237","Application Data"
"749","64.594618","149.154.167.99","10.0.2.15","TCP","60","443  >  52862 [ACK] Seq=13550 Ack=9846 Win=65535 Len=0"
"750","64.674976","149.154.167.99","10.0.2.15","TLSv1.2","167","Application Data"
"751","64.715600","10.0.2.15","149.154.167.99","TCP","54","52862  >  443 [ACK] Seq=9846 Ack=13663 Win=65535 Len=0"
"752","64.716649","10.0.2.15","149.154.167.99","TLSv1.2","269","Application Data"
"753","64.717039","149.154.167.99","10.0.2.15","TCP","60","443  >  52862 [ACK] Seq=13663 Ack=10061 Win=65535 Len=0"
"754","64.910081","149.154.167.99","10.0.2.15","TLSv1.2","217","Application Data"
"755","64.910113","10.0.2.15","149.154.167.99","TCP","54","52862  >  443 [ACK] Seq=10061 Ack=13826 Win=65535 Len=0"
"758","65.552476","149.154.167.99","10.0.2.15","TLSv1.2","409","Application Data"
"759","65.552513","10.0.2.15","149.154.167.99","TCP","54","52862  >  443 [ACK] Seq=10061 Ack=14181 Win=65535 Len=0"
"767","66.324676","10.0.2.15","149.154.167.99","TLSv1.2","253","Application Data"
"768","66.325077","149.154.167.99","10.0.2.15","TCP","60","443  >  52862 [ACK] Seq=14181 Ack=10260 Win=65535 Len=0"
"769","66.432715","149.154.167.99","10.0.2.15","TLSv1.2","167","Application Data"
"770","66.432742","10.0.2.15","149.154.167.99","TCP","54","52862  >  443 [ACK] Seq=10260 Ack=14294 Win=65535 Len=0"
"775","66.436350","10.0.2.15","149.154.167.99","TLSv1.2","253","Application Data"
"776","66.436573","149.154.167.99","10.0.2.15","TCP","60","443  >  52862 [ACK] Seq=14294 Ack=10459 Win=65535 Len=0"
"777","66.532301","149.154.167.99","10.0.2.15","TLSv1.2","473","Application Data"
"778","66.575500","10.0.2.15","149.154.167.99","TCP","54","52862  >  443 [ACK] Seq=10459 Ack=14713 Win=65535 Len=0"
"782","66.835651","10.0.2.15","149.154.167.99","TLSv1.2","253","Application Data"
"783","66.836120","149.154.167.99","10.0.2.15","TCP","60","443  >  52862 [ACK] Seq=14713 Ack=10658 Win=65535 Len=0"
"784","66.950698","149.154.167.99","10.0.2.15","TLSv1.2","199","Application Data"
"785","66.950762","10.0.2.15","149.154.167.99","TCP","54","52862  >  443 [ACK] Seq=10658 Ack=14858 Win=65535 Len=0"
"786","67.694775","10.0.2.15","149.154.167.99","TLSv1.2","237","Application Data"
"787","67.695229","149.154.167.99","10.0.2.15","TCP","60","443  >  52862 [ACK] Seq=14858 Ack=10841 Win=65535 Len=0"
"788","67.776793","149.154.167.99","10.0.2.15","TLSv1.2","167","Application Data"
"789","67.776820","10.0.2.15","149.154.167.99","TCP","54","52862  >  443 [ACK] Seq=10841 Ack=14971 Win=65535 Len=0"
"796","70.785506","10.0.2.15","149.154.167.99","TLSv1.2","237","Application Data"
"797","70.785944","149.154.167.99","10.0.2.15","TCP","60","443  >  52862 [ACK] Seq=14971 Ack=11024 Win=65535 Len=0"
"798","70.868511","149.154.167.99","10.0.2.15","TLSv1.2","167","Application Data"
"799","70.868542","10.0.2.15","149.154.167.99","TCP","54","52862  >  443 [ACK] Seq=11024 Ack=15084 Win=65535 Len=0"
"846","73.900029","10.0.2.15","149.154.167.99","TLSv1.2","237","Application Data"
"847","73.900385","149.154.167.99","10.0.2.15","TCP","60","443  >  52862 [ACK] Seq=15084 Ack=11207 Win=65535 Len=0"
"848","73.992933","149.154.167.99","10.0.2.15","TLSv1.2","167","Application Data"
"849","73.992971","10.0.2.15","149.154.167.99","TCP","54","52862  >  443 [ACK] Seq=11207 Ack=15197 Win=65535 Len=0"
"860","75.100115","10.0.2.15","149.154.167.99","TLSv1.2","93","Application Data"
"861","75.100497","149.154.167.99","10.0.2.15","TCP","60","443  >  58620 [ACK] Seq=40 Ack=79 Win=65535 Len=0"
"862","75.177833","149.154.167.99","10.0.2.15","TLSv1.2","93","Application Data"
"863","75.177935","10.0.2.15","149.154.167.99","TCP","54","58620  >  443 [ACK] Seq=79 Ack=79 Win=63986 Len=0"
"866","76.939274","10.0.2.15","149.154.167.99","TCP","294","49342  >  443 [PSH, ACK] Seq=983 Ack=629 Win=63986 Len=240 [TCP segment of a reassembled PDU]"
"867","76.939302","10.0.2.15","149.154.167.99","TLSv1.3","83","Application Data"
"868","76.939615","149.154.167.99","10.0.2.15","TCP","60","443  >  49342 [ACK] Seq=629 Ack=1031 Win=65535 Len=0"
"869","76.939615","149.154.167.99","10.0.2.15","TCP","60","443  >  49342 [ACK] Seq=629 Ack=1079 Win=65535 Len=0"
"870","76.939615","149.154.167.99","10.0.2.15","TCP","60","443  >  49342 [ACK] Seq=629 Ack=1127 Win=65535 Len=0"
"871","76.939703","149.154.167.99","10.0.2.15","TCP","60","443  >  49342 [ACK] Seq=629 Ack=1175 Win=65535 Len=0"
"872","76.939703","149.154.167.99","10.0.2.15","TCP","60","443  >  49342 [ACK] Seq=629 Ack=1223 Win=65535 Len=0"
"873","76.939703","149.154.167.99","10.0.2.15","TCP","60","443  >  49342 [ACK] Seq=629 Ack=1252 Win=65535 Len=0"
"874","77.002410","10.0.2.15","149.154.167.99","TLSv1.2","237","Application Data"
"875","77.002834","149.154.167.99","10.0.2.15","TCP","60","443  >  52862 [ACK] Seq=15197 Ack=11390 Win=65535 Len=0"
"876","77.017316","149.154.167.99","10.0.2.15","TLSv1.3","274","Application Data"
"877","77.060231","10.0.2.15","149.154.167.99","TCP","54","49342  >  443 [ACK] Seq=1252 Ack=849 Win=63986 Len=0"
"878","77.082415","149.154.167.99","10.0.2.15","TLSv1.2","167","Application Data"
"879","77.082442","10.0.2.15","149.154.167.99","TCP","54","52862  >  443 [ACK] Seq=11390 Ack=15310 Win=65535 Len=0"
"886","79.452971","10.0.2.15","149.154.167.99","TLSv1.2","509","Application Data"
"887","79.453451","149.154.167.99","10.0.2.15","TCP","60","443  >  52862 [ACK] Seq=15310 Ack=11845 Win=65535 Len=0"
"888","79.545147","149.154.167.99","10.0.2.15","TLSv1.2","217","Application Data"
"889","79.545192","10.0.2.15","149.154.167.99","TCP","54","52862  >  443 [ACK] Seq=11845 Ack=15473 Win=65535 Len=0"
"892","80.094149","10.0.2.15","149.154.167.99","TLSv1.2","237","Application Data"
"893","80.094461","149.154.167.99","10.0.2.15","TCP","60","443  >  52862 [ACK] Seq=15473 Ack=12028 Win=65535 Len=0"
"894","80.173473","149.154.167.99","10.0.2.15","TLSv1.2","167","Application Data"
"895","80.173500","10.0.2.15","149.154.167.99","TCP","54","52862  >  443 [ACK] Seq=12028 Ack=15586 Win=65535 Len=0"
"896","80.805195","10.0.2.15","149.154.167.99","TLSv1.3","82","Application Data"
"897","80.805592","149.154.167.99","10.0.2.15","TCP","60","443  >  49358 [ACK] Seq=25303 Ack=1940 Win=65535 Len=0"
"898","80.873700","149.154.167.99","10.0.2.15","TLSv1.3","116","Application Data, Application Data"
"899","80.873740","10.0.2.15","149.154.167.99","TCP","54","49358  >  443 [ACK] Seq=1940 Ack=25365 Win=63240 Len=0"
"900","80.873823","149.154.167.99","10.0.2.15","TCP","60","443  >  49358 [FIN, ACK] Seq=25365 Ack=1940 Win=65535 Len=0"
"901","80.873940","10.0.2.15","149.154.167.99","TLSv1.3","78","Application Data"
"902","80.873959","10.0.2.15","149.154.167.99","TCP","54","49358  >  443 [FIN, ACK] Seq=1964 Ack=25366 Win=63240 Len=0"
"903","80.874195","149.154.167.99","10.0.2.15","TCP","60","443  >  49358 [ACK] Seq=25366 Ack=1964 Win=65535 Len=0"
"904","80.874195","149.154.167.99","10.0.2.15","TCP","60","443  >  49358 [ACK] Seq=25366 Ack=1965 Win=65535 Len=0"
"907","82.532989","149.154.167.99","10.0.2.15","TLSv1.2","764","Application Data"
"908","82.533029","10.0.2.15","149.154.167.99","TCP","54","52862  >  443 [ACK] Seq=12028 Ack=16296 Win=65535 Len=0"
"914","82.955156","10.0.2.15","149.154.167.99","TCP","74","60374  >  443 [SYN] Seq=0 Win=64240 Len=0 MSS=1460 SACK_PERM=1 TSval=4092996419 TSecr=0 WS=128"
"915","83.031520","149.154.167.99","10.0.2.15","TCP","60","443  >  60374 [SYN, ACK] Seq=0 Ack=1 Win=65535 Len=0 MSS=1460"
"916","83.031603","10.0.2.15","149.154.167.99","TCP","54","60374  >  443 [ACK] Seq=1 Ack=1 Win=64240 Len=0"
"917","83.033191","10.0.2.15","149.154.167.99","TLSv1.3","752","Client Hello"
"918","83.033501","149.154.167.99","10.0.2.15","TCP","60","443  >  60374 [ACK] Seq=1 Ack=699 Win=65535 Len=0"
"919","83.113395","149.154.167.99","10.0.2.15","TLSv1.3","1294","Server Hello, Change Cipher Spec, Application Data"
"920","83.113461","10.0.2.15","149.154.167.99","TCP","54","60374  >  443 [ACK] Seq=699 Ack=1241 Win=63240 Len=0"
"921","83.114300","149.154.167.99","10.0.2.15","TCP","2534","443  >  60374 [PSH, ACK] Seq=1241 Ack=699 Win=65535 Len=2480 [TCP segment of a reassembled PDU]"
"922","83.114340","10.0.2.15","149.154.167.99","TCP","54","60374  >  443 [ACK] Seq=699 Ack=3721 Win=63240 Len=0"
"923","83.114393","149.154.167.99","10.0.2.15","TCP","430","443  >  60374 [PSH, ACK] Seq=3721 Ack=699 Win=65535 Len=376 [TCP segment of a reassembled PDU]"
"924","83.114399","10.0.2.15","149.154.167.99","TCP","54","60374  >  443 [ACK] Seq=699 Ack=4097 Win=63240 Len=0"
"925","83.115275","149.154.167.99","10.0.2.15","TLSv1.3","1660","Application Data, Application Data, Application Data"
"926","83.115288","10.0.2.15","149.154.167.99","TCP","54","60374  >  443 [ACK] Seq=699 Ack=5703 Win=63240 Len=0"
"927","83.116913","10.0.2.15","149.154.167.99","TLSv1.3","134","Change Cipher Spec, Application Data"
"928","83.117022","10.0.2.15","149.154.167.99","TLSv1.3","665","Application Data"
"929","83.117050","149.154.167.99","10.0.2.15","TCP","60","443  >  60374 [ACK] Seq=5703 Ack=779 Win=65535 Len=0"
"930","83.117089","149.154.167.99","10.0.2.15","TCP","60","443  >  60374 [ACK] Seq=5703 Ack=1390 Win=65535 Len=0"
"931","83.178285","10.0.2.15","149.154.167.99","TLSv1.2","237","Application Data"
"932","83.178953","149.154.167.99","10.0.2.15","TCP","60","443  >  52862 [ACK] Seq=16296 Ack=12211 Win=65535 Len=0"
"933","83.196250","149.154.167.99","10.0.2.15","TLSv1.3","660","Application Data, Application Data"
"934","83.200107","149.154.167.99","10.0.2.15","TLSv1.3","296","Application Data"
"935","83.200195","10.0.2.15","149.154.167.99","TCP","54","60374  >  443 [ACK] Seq=1390 Ack=6551 Win=63240 Len=0"
"936","83.203601","10.0.2.15","149.154.167.99","TLSv1.3","146","Application Data"
"937","83.203948","149.154.167.99","10.0.2.15","TCP","60","443  >  60374 [ACK] Seq=6551 Ack=1482 Win=65535 Len=0"
"938","83.204153","10.0.2.15","149.154.167.99","TLSv1.3","237","Application Data"
"939","83.204406","149.154.167.99","10.0.2.15","TCP","60","443  >  60374 [ACK] Seq=6551 Ack=1665 Win=65535 Len=0"
"940","83.259342","149.154.167.99","10.0.2.15","TLSv1.2","167","Application Data"
"941","83.259369","10.0.2.15","149.154.167.99","TCP","54","52862  >  443 [ACK] Seq=12211 Ack=16409 Win=65535 Len=0"
"942","83.294228","149.154.167.99","10.0.2.15","TLSv1.3","183","Application Data"
"943","83.298010","10.0.2.15","149.154.167.99","TLSv1.3","301","Application Data"
"944","83.298440","149.154.167.99","10.0.2.15","TCP","60","443  >  60374 [ACK] Seq=6680 Ack=1912 Win=65535 Len=0"
"947","83.353720","10.0.2.15","149.154.167.99","TLSv1.2","253","Application Data"
"948","83.354172","149.154.167.99","10.0.2.15","TCP","60","443  >  52862 [ACK] Seq=16409 Ack=12410 Win=65535 Len=0"
"949","83.381914","149.154.167.99","10.0.2.15","TLSv1.3","249","Application Data"
"950","83.396417","149.154.167.99","10.0.2.15","TCP","1294","443  >  60374 [PSH, ACK] Seq=6875 Ack=1912 Win=65535 Len=1240 [TCP segment of a reassembled PDU]"
"951","83.396532","10.0.2.15","149.154.167.99","TCP","54","60374  >  443 [ACK] Seq=1912 Ack=8115 Win=63240 Len=0"
"952","83.396878","149.154.167.99","10.0.2.15","TCP","2534","443  >  60374 [PSH, ACK] Seq=8115 Ack=1912 Win=65535 Len=2480 [TCP segment of a reassembled PDU]"
"953","83.396894","10.0.2.15","149.154.167.99","TCP","54","60374  >  443 [ACK] Seq=1912 Ack=10595 Win=63240 Len=0"
"954","83.397314","149.154.167.99","10.0.2.15","TCP","3774","443  >  60374 [PSH, ACK] Seq=10595 Ack=1912 Win=65535 Len=3720 [TCP segment of a reassembled PDU]"
"955","83.397346","10.0.2.15","149.154.167.99","TCP","54","60374  >  443 [ACK] Seq=1912 Ack=14315 Win=63240 Len=0"
"956","83.397712","149.154.167.99","10.0.2.15","TCP","2534","443  >  60374 [PSH, ACK] Seq=14315 Ack=1912 Win=65535 Len=2480 [TCP segment of a reassembled PDU]"
"957","83.397719","10.0.2.15","149.154.167.99","TCP","54","60374  >  443 [ACK] Seq=1912 Ack=16795 Win=63240 Len=0"
"958","83.397756","149.154.167.99","10.0.2.15","TCP","1294","443  >  60374 [PSH, ACK] Seq=16795 Ack=1912 Win=65535 Len=1240 [TCP segment of a reassembled PDU]"
"959","83.398242","149.154.167.99","10.0.2.15","TCP","2534","443  >  60374 [PSH, ACK] Seq=18035 Ack=1912 Win=65535 Len=2480 [TCP segment of a reassembled PDU]"
"960","83.398250","10.0.2.15","149.154.167.99","TCP","54","60374  >  443 [ACK] Seq=1912 Ack=20515 Win=63240 Len=0"
"961","83.398512","149.154.167.99","10.0.2.15","TCP","1294","443  >  60374 [PSH, ACK] Seq=20515 Ack=1912 Win=65535 Len=1240 [TCP segment of a reassembled PDU]"
"962","83.439364","10.0.2.15","149.154.167.99","TCP","54","60374  >  443 [ACK] Seq=1912 Ack=21755 Win=63240 Len=0"
"963","83.478884","149.154.167.99","10.0.2.15","TLSv1.3","2534","Application Data [TCP segment of a reassembled PDU]"
"964","83.479044","10.0.2.15","149.154.167.99","TCP","54","60374  >  443 [ACK] Seq=1912 Ack=24235 Win=63240 Len=0"
"965","83.478885","149.154.167.99","10.0.2.15","TCP","2534","443  >  60374 [PSH, ACK] Seq=24235 Ack=1912 Win=65535 Len=2480 [TCP segment of a reassembled PDU]"
"966","83.479282","10.0.2.15","149.154.167.99","TCP","54","60374  >  443 [ACK] Seq=1912 Ack=26715 Win=61320 Len=0"
"967","83.479386","149.154.167.99","10.0.2.15","TCP","2534","443  >  60374 [PSH, ACK] Seq=26715 Ack=1912 Win=65535 Len=2480 [TCP segment of a reassembled PDU]"
"968","83.479412","10.0.2.15","149.154.167.99","TCP","54","60374  >  443 [ACK] Seq=1912 Ack=29195 Win=58840 Len=0"
"969","83.479706","149.154.167.99","10.0.2.15","TCP","2534","443  >  60374 [PSH, ACK] Seq=29195 Ack=1912 Win=65535 Len=2480 [TCP segment of a reassembled PDU]"
"970","83.479715","10.0.2.15","149.154.167.99","TCP","54","60374  >  443 [ACK] Seq=1912 Ack=31675 Win=62780 Len=0"
"971","83.479706","149.154.167.99","10.0.2.15","TLSv1.2","167","Application Data"
"972","83.479760","10.0.2.15","149.154.167.99","TCP","54","52862  >  443 [ACK] Seq=12410 Ack=16522 Win=65535 Len=0"
"973","83.479706","149.154.167.99","10.0.2.15","TLSv1.3","130","Application Data"
"974","83.479857","10.0.2.15","149.154.167.99","TCP","54","60374  >  443 [ACK] Seq=1912 Ack=31751 Win=62780 Len=0"
"977","83.506787","10.0.2.15","149.154.167.99","TLSv1.2","253","Application Data"
"978","83.507213","149.154.167.99","10.0.2.15","TCP","60","443  >  52862 [ACK] Seq=16522 Ack=12609 Win=65535 Len=0"
"979","83.604075","149.154.167.99","10.0.2.15","TLSv1.2","860","Application Data"
"980","83.647993","10.0.2.15","149.154.167.99","TCP","54","52862  >  443 [ACK] Seq=12609 Ack=17328 Win=65535 Len=0"
"981","83.866709","10.0.2.15","149.154.167.99","TLSv1.2","253","Application Data"
"982","83.867147","149.154.167.99","10.0.2.15","TCP","60","443  >  52862 [ACK] Seq=17328 Ack=12808 Win=65535 Len=0"
"983","84.002249","149.154.167.99","10.0.2.15","TLSv1.2","199","Application Data"
"984","84.002279","10.0.2.15","149.154.167.99","TCP","54","52862  >  443 [ACK] Seq=12808 Ack=17473 Win=65535 Len=0"
"989","86.267389","10.0.2.15","149.154.167.99","TLSv1.2","237","Application Data"
"990","86.267879","149.154.167.99","10.0.2.15","TCP","60","443  >  52862 [ACK] Seq=17473 Ack=12991 Win=65535 Len=0"
"991","86.347624","149.154.167.99","10.0.2.15","TLSv1.2","167","Application Data"
"992","86.347651","10.0.2.15","149.154.167.99","TCP","54","52862  >  443 [ACK] Seq=12991 Ack=17586 Win=65535 Len=0"
"993","86.457458","149.154.167.99","10.0.2.15","TLSv1.2","393","Application Data"
"994","86.457508","10.0.2.15","149.154.167.99","TCP","54","52862  >  443 [ACK] Seq=12991 Ack=17925 Win=65535 Len=0"
"1000","87.226921","10.0.2.15","149.154.167.99","TLSv1.2","253","Application Data"
"1001","87.227281","149.154.167.99","10.0.2.15","TCP","60","443  >  52862 [ACK] Seq=17925 Ack=13190 Win=65535 Len=0"
"1002","87.408131","149.154.167.99","10.0.2.15","TLSv1.2","167","Application Data"
"1003","87.408160","10.0.2.15","149.154.167.99","TCP","54","52862  >  443 [ACK] Seq=13190 Ack=18038 Win=65535 Len=0"
"1006","87.412133","10.0.2.15","149.154.167.99","TLSv1.2","253","Application Data"
"1007","87.412577","149.154.167.99","10.0.2.15","TCP","60","443  >  52862 [ACK] Seq=18038 Ack=13389 Win=65535 Len=0"
"1008","87.547972","149.154.167.99","10.0.2.15","TLSv1.2","457","Application Data"
"1009","87.596819","10.0.2.15","149.154.167.99","TCP","54","52862  >  443 [ACK] Seq=13389 Ack=18441 Win=65535 Len=0"
"1010","87.740088","10.0.2.15","149.154.167.99","TLSv1.2","253","Application Data"
"1011","87.740674","149.154.167.99","10.0.2.15","TCP","60","443  >  52862 [ACK] Seq=18441 Ack=13588 Win=65535 Len=0"
"1012","87.922908","149.154.167.99","10.0.2.15","TLSv1.2","199","Application Data"
"1013","87.922936","10.0.2.15","149.154.167.99","TCP","54","52862  >  443 [ACK] Seq=13588 Ack=18586 Win=65535 Len=0"
"1018","88.044815","149.154.167.99","10.0.2.15","TLSv1.2","393","Application Data"
"1019","88.044859","10.0.2.15","149.154.167.99","TCP","54","52862  >  443 [ACK] Seq=13588 Ack=18925 Win=65535 Len=0"
"1029","88.821254","10.0.2.15","149.154.167.99","TLSv1.2","253","Application Data"
"1030","88.821670","149.154.167.99","10.0.2.15","TCP","60","443  >  52862 [ACK] Seq=18925 Ack=13787 Win=65535 Len=0"
"1031","88.984478","149.154.167.99","10.0.2.15","TLSv1.2","167","Application Data"
"1032","88.984506","10.0.2.15","149.154.167.99","TCP","54","52862  >  443 [ACK] Seq=13787 Ack=19038 Win=65535 Len=0"
"1033","88.988469","10.0.2.15","149.154.167.99","TLSv1.2","253","Application Data"
"1034","88.988848","149.154.167.99","10.0.2.15","TCP","60","443  >  52862 [ACK] Seq=19038 Ack=13986 Win=65535 Len=0"
"1037","89.086616","149.154.167.99","10.0.2.15","TLSv1.2","473","Application Data"
"1038","89.128319","10.0.2.15","149.154.167.99","TCP","54","52862  >  443 [ACK] Seq=13986 Ack=19457 Win=65535 Len=0"
"1041","89.265531","149.154.167.99","10.0.2.15","TLSv1.2","393","Application Data"
"1042","89.265569","10.0.2.15","149.154.167.99","TCP","54","52862  >  443 [ACK] Seq=13986 Ack=19796 Win=65535 Len=0"
"1045","89.329736","10.0.2.15","149.154.167.99","TLSv1.2","269","Application Data"
"1046","89.330125","149.154.167.99","10.0.2.15","TCP","60","443  >  52862 [ACK] Seq=19796 Ack=14201 Win=65535 Len=0"
"1047","89.356919","10.0.2.15","149.154.167.99","TLSv1.2","171","Application Data"
"1048","89.357483","149.154.167.99","10.0.2.15","TCP","60","443  >  52862 [ACK] Seq=19796 Ack=14318 Win=65535 Len=0"
"1049","89.428281","149.154.167.99","10.0.2.15","TLSv1.2","199","Application Data"
"1050","89.428313","10.0.2.15","149.154.167.99","TCP","54","52862  >  443 [ACK] Seq=14318 Ack=19941 Win=65535 Len=0"
"1051","89.449567","149.154.167.99","10.0.2.15","TLSv1.2","167","Application Data"
"1052","89.449597","10.0.2.15","149.154.167.99","TCP","54","52862  >  443 [ACK] Seq=14318 Ack=20054 Win=65535 Len=0"
"1060","90.028970","10.0.2.15","149.154.167.99","TLSv1.2","253","Application Data"
"1061","90.029273","149.154.167.99","10.0.2.15","TCP","60","443  >  52862 [ACK] Seq=20054 Ack=14517 Win=65535 Len=0"
"1062","90.133712","149.154.167.99","10.0.2.15","TLSv1.2","167","Application Data"
"1063","90.133740","10.0.2.15","149.154.167.99","TCP","54","52862  >  443 [ACK] Seq=14517 Ack=20167 Win=65535 Len=0"
"1066","90.138203","10.0.2.15","149.154.167.99","TLSv1.2","253","Application Data"
"1067","90.138437","149.154.167.99","10.0.2.15","TCP","60","443  >  52862 [ACK] Seq=20167 Ack=14716 Win=65535 Len=0"
"1068","90.238818","149.154.167.99","10.0.2.15","TLSv1.2","457","Application Data"
"1069","90.279337","10.0.2.15","149.154.167.99","TCP","54","52862  >  443 [ACK] Seq=14716 Ack=20570 Win=65535 Len=0"
"1070","90.528594","10.0.2.15","149.154.167.99","TLSv1.2","253","Application Data"
"1071","90.529056","149.154.167.99","10.0.2.15","TCP","60","443  >  52862 [ACK] Seq=20570 Ack=14915 Win=65535 Len=0"
"1072","90.636811","149.154.167.99","10.0.2.15","TLSv1.2","199","Application Data"
"1073","90.636840","10.0.2.15","149.154.167.99","TCP","54","52862  >  443 [ACK] Seq=14915 Ack=20715 Win=65535 Len=0"
"1074","90.749437","149.154.167.99","10.0.2.15","TLSv1.2","409","Application Data"
"1075","90.749479","10.0.2.15","149.154.167.99","TCP","54","52862  >  443 [ACK] Seq=14915 Ack=21070 Win=65535 Len=0"
"1081","91.520502","10.0.2.15","149.154.167.99","TLSv1.2","253","Application Data"
"1082","91.520819","149.154.167.99","10.0.2.15","TCP","60","443  >  52862 [ACK] Seq=21070 Ack=15114 Win=65535 Len=0"
"1083","91.694831","149.154.167.99","10.0.2.15","TLSv1.2","167","Application Data"
"1084","91.694858","10.0.2.15","149.154.167.99","TCP","54","52862  >  443 [ACK] Seq=15114 Ack=21183 Win=65535 Len=0"
"1085","91.698950","10.0.2.15","149.154.167.99","TLSv1.2","253","Application Data"
"1086","91.699383","149.154.167.99","10.0.2.15","TCP","60","443  >  52862 [ACK] Seq=21183 Ack=15313 Win=65535 Len=0"
"1089","91.881311","149.154.167.99","10.0.2.15","TLSv1.2","473","Application Data"
"1090","91.924311","10.0.2.15","149.154.167.99","TCP","54","52862  >  443 [ACK] Seq=15313 Ack=21602 Win=65535 Len=0"
"1091","91.951055","149.154.167.99","10.0.2.15","TLSv1.2","393","Application Data"
"1092","91.951094","10.0.2.15","149.154.167.99","TCP","54","52862  >  443 [ACK] Seq=15313 Ack=21941 Win=65535 Len=0"
"1095","92.038389","10.0.2.15","149.154.167.99","TLSv1.2","269","Application Data"
"1096","92.038721","149.154.167.99","10.0.2.15","TCP","60","443  >  52862 [ACK] Seq=21941 Ack=15528 Win=65535 Len=0"
"1098","92.136828","149.154.167.99","10.0.2.15","TLSv1.2","199","Application Data"
"1099","92.136865","10.0.2.15","149.154.167.99","TCP","54","52862  >  443 [ACK] Seq=15528 Ack=22086 Win=65535 Len=0"
"1102","92.457677","10.0.2.15","149.154.167.99","TLSv1.2","237","Application Data"
"1103","92.458100","149.154.167.99","10.0.2.15","TCP","60","443  >  52862 [ACK] Seq=22086 Ack=15711 Win=65535 Len=0"
"1104","92.539577","149.154.167.99","10.0.2.15","TLSv1.2","167","Application Data"
"1105","92.539605","10.0.2.15","149.154.167.99","TCP","54","52862  >  443 [ACK] Seq=15711 Ack=22199 Win=65535 Len=0"
"1106","92.708988","10.0.2.15","149.154.167.99","TLSv1.2","253","Application Data"
"1107","92.709320","149.154.167.99","10.0.2.15","TCP","60","443  >  52862 [ACK] Seq=22199 Ack=15910 Win=65535 Len=0"
"1108","92.825870","149.154.167.99","10.0.2.15","TLSv1.2","167","Application Data"
"1109","92.825908","10.0.2.15","149.154.167.99","TCP","54","52862  >  443 [ACK] Seq=15910 Ack=22312 Win=65535 Len=0"
"1112","92.832725","10.0.2.15","149.154.167.99","TLSv1.2","253","Application Data"
"1113","92.833143","149.154.167.99","10.0.2.15","TCP","60","443  >  52862 [ACK] Seq=22312 Ack=16109 Win=65535 Len=0"
"1114","92.973057","149.154.167.99","10.0.2.15","TLSv1.2","457","Application Data"
"1115","93.015670","10.0.2.15","149.154.167.99","TCP","54","52862  >  443 [ACK] Seq=16109 Ack=22715 Win=65535 Len=0"
"1116","93.216738","10.0.2.15","149.154.167.99","TLSv1.2","253","Application Data"
"1117","93.217268","149.154.167.99","10.0.2.15","TCP","60","443  >  52862 [ACK] Seq=22715 Ack=16308 Win=65535 Len=0"
"1118","93.309587","149.154.167.99","10.0.2.15","TLSv1.2","199","Application Data"
"1119","93.309616","10.0.2.15","149.154.167.99","TCP","54","52862  >  443 [ACK] Seq=16308 Ack=22860 Win=65535 Len=0"
"1124","93.716651","149.154.167.99","10.0.2.15","TLSv1.2","409","Application Data"
"1125","93.716687","10.0.2.15","149.154.167.99","TCP","54","52862  >  443 [ACK] Seq=16308 Ack=23215 Win=65535 Len=0"
"1133","94.449022","10.0.2.15","149.154.167.99","TLSv1.2","541","Application Data"
"1134","94.449453","149.154.167.99","10.0.2.15","TCP","60","443  >  52862 [ACK] Seq=23215 Ack=16795 Win=65535 Len=0"
"1135","94.475971","10.0.2.15","149.154.167.99","TLSv1.2","187","Application Data"
"1136","94.476326","149.154.167.99","10.0.2.15","TCP","60","443  >  52862 [ACK] Seq=23215 Ack=16928 Win=65535 Len=0"
"1137","94.559835","149.154.167.99","10.0.2.15","TLSv1.2","281","Application Data"
"1138","94.559868","10.0.2.15","149.154.167.99","TCP","54","52862  >  443 [ACK] Seq=16928 Ack=23442 Win=65535 Len=0"
"1139","94.578628","149.154.167.99","10.0.2.15","TLSv1.2","167","Application Data"
"1140","94.578867","10.0.2.15","149.154.167.99","TCP","54","52862  >  443 [ACK] Seq=16928 Ack=23555 Win=65535 Len=0"
"1143","94.605951","10.0.2.15","149.154.167.99","TLSv1.2","269","Application Data"
"1144","94.606387","149.154.167.99","10.0.2.15","TCP","60","443  >  52862 [ACK] Seq=23555 Ack=17143 Win=65535 Len=0"
"1145","94.705541","149.154.167.99","10.0.2.15","TLSv1.2","473","Application Data"
"1146","94.747694","10.0.2.15","149.154.167.99","TCP","54","52862  >  443 [ACK] Seq=17143 Ack=23974 Win=65535 Len=0"
"1147","94.991921","10.0.2.15","149.154.167.99","TLSv1.2","253","Application Data"
"1148","94.992409","149.154.167.99","10.0.2.15","TCP","60","443  >  52862 [ACK] Seq=23974 Ack=17342 Win=65535 Len=0"
"1151","95.083893","149.154.167.99","10.0.2.15","TLSv1.2","199","Application Data"
"1152","95.083927","10.0.2.15","149.154.167.99","TCP","54","52862  >  443 [ACK] Seq=17342 Ack=24119 Win=65535 Len=0"
"1153","95.190364","149.154.167.99","10.0.2.15","TLSv1.2","393","Application Data"
"1154","95.190400","10.0.2.15","149.154.167.99","TCP","54","52862  >  443 [ACK] Seq=17342 Ack=24458 Win=65535 Len=0"
"1160","95.657938","10.0.2.15","149.154.167.99","TLSv1.2","237","Application Data"
"1161","95.658269","149.154.167.99","10.0.2.15","TCP","60","443  >  52862 [ACK] Seq=24458 Ack=17525 Win=65535 Len=0"
"1162","95.734605","149.154.167.99","10.0.2.15","TLSv1.2","167","Application Data"
"1163","95.734638","10.0.2.15","149.154.167.99","TCP","54","52862  >  443 [ACK] Seq=17525 Ack=24571 Win=65535 Len=0"
"1164","95.991036","10.0.2.15","149.154.167.99","TLSv1.2","253","Application Data"
"1165","95.991376","149.154.167.99","10.0.2.15","TCP","60","443  >  52862 [ACK] Seq=24571 Ack=17724 Win=65535 Len=0"
"1166","96.091953","149.154.167.99","10.0.2.15","TLSv1.2","167","Application Data"
"1167","96.091982","10.0.2.15","149.154.167.99","TCP","54","52862  >  443 [ACK] Seq=17724 Ack=24684 Win=65535 Len=0"
"1168","96.094394","10.0.2.15","149.154.167.99","TLSv1.2","253","Application Data"
"1169","96.094711","149.154.167.99","10.0.2.15","TCP","60","443  >  52862 [ACK] Seq=24684 Ack=17923 Win=65535 Len=0"
"1174","96.188635","149.154.167.99","10.0.2.15","TLSv1.2","457","Application Data"
"1175","96.231352","10.0.2.15","149.154.167.99","TCP","54","52862  >  443 [ACK] Seq=17923 Ack=25087 Win=65535 Len=0"
"1176","96.291708","149.154.167.99","10.0.2.15","TLSv1.2","377","Application Data"
"1177","96.291739","10.0.2.15","149.154.167.99","TCP","54","52862  >  443 [ACK] Seq=17923 Ack=25410 Win=65535 Len=0"
"1180","96.495439","10.0.2.15","149.154.167.99","TLSv1.2","269","Application Data"
"1181","96.495818","149.154.167.99","10.0.2.15","TCP","60","443  >  52862 [ACK] Seq=25410 Ack=18138 Win=65535 Len=0"
"1185","96.589653","149.154.167.99","10.0.2.15","TLSv1.2","199","Application Data"
"1186","96.589693","10.0.2.15","149.154.167.99","TCP","54","52862  >  443 [ACK] Seq=18138 Ack=25555 Win=65535 Len=0"
"1187","97.063131","10.0.2.15","149.154.167.99","TLSv1.2","253","Application Data"
"1188","97.063583","149.154.167.99","10.0.2.15","TCP","60","443  >  52862 [ACK] Seq=25555 Ack=18337 Win=65535 Len=0"
"1189","97.194232","149.154.167.99","10.0.2.15","TLSv1.2","167","Application Data"
"1190","97.194260","10.0.2.15","149.154.167.99","TCP","54","52862  >  443 [ACK] Seq=18337 Ack=25668 Win=65535 Len=0"
"1191","97.197007","10.0.2.15","149.154.167.99","TLSv1.2","253","Application Data"
"1192","97.197398","149.154.167.99","10.0.2.15","TCP","60","443  >  52862 [ACK] Seq=25668 Ack=18536 Win=65535 Len=0"
"1195","97.351045","149.154.167.99","10.0.2.15","TLSv1.2","457","Application Data"
"1196","97.392053","10.0.2.15","149.154.167.99","TCP","54","52862  >  443 [ACK] Seq=18536 Ack=26071 Win=65535 Len=0"
"1199","97.422732","149.154.167.99","10.0.2.15","TLSv1.2","377","Application Data"
"1200","97.422778","10.0.2.15","149.154.167.99","TCP","54","52862  >  443 [ACK] Seq=18536 Ack=26394 Win=65535 Len=0"
"1201","97.593150","10.0.2.15","149.154.167.99","TLSv1.2","269","Application Data"
"1202","97.593666","149.154.167.99","10.0.2.15","TCP","60","443  >  52862 [ACK] Seq=26394 Ack=18751 Win=65535 Len=0"
"1203","97.696962","149.154.167.99","10.0.2.15","TLSv1.2","199","Application Data"
"1204","97.696994","10.0.2.15","149.154.167.99","TCP","54","52862  >  443 [ACK] Seq=18751 Ack=26539 Win=65535 Len=0"
"1208","98.195049","10.0.2.15","149.154.167.99","TLSv1.2","253","Application Data"
"1209","98.195306","149.154.167.99","10.0.2.15","TCP","60","443  >  52862 [ACK] Seq=26539 Ack=18950 Win=65535 Len=0"
"1210","98.300191","149.154.167.99","10.0.2.15","TLSv1.2","167","Application Data"
"1211","98.300219","10.0.2.15","149.154.167.99","TCP","54","52862  >  443 [ACK] Seq=18950 Ack=26652 Win=65535 Len=0"
"1212","98.302630","10.0.2.15","149.154.167.99","TLSv1.2","253","Application Data"
"1213","98.302852","149.154.167.99","10.0.2.15","TCP","60","443  >  52862 [ACK] Seq=26652 Ack=19149 Win=65535 Len=0"
"1218","98.405008","149.154.167.99","10.0.2.15","TLSv1.2","457","Application Data"
"1219","98.447763","10.0.2.15","149.154.167.99","TCP","54","52862  >  443 [ACK] Seq=19149 Ack=27055 Win=65535 Len=0"
"1222","98.603057","149.154.167.99","10.0.2.15","TLSv1.2","393","Application Data"
"1223","98.603077","10.0.2.15","149.154.167.99","TCP","54","52862  >  443 [ACK] Seq=19149 Ack=27394 Win=65535 Len=0"
"1224","98.708846","10.0.2.15","149.154.167.99","TLSv1.2","269","Application Data"
"1225","98.709278","149.154.167.99","10.0.2.15","TCP","60","443  >  52862 [ACK] Seq=27394 Ack=19364 Win=65535 Len=0"
"1226","98.743865","10.0.2.15","149.154.167.99","TLSv1.2","171","Application Data"
"1227","98.744191","149.154.167.99","10.0.2.15","TCP","60","443  >  52862 [ACK] Seq=27394 Ack=19481 Win=65535 Len=0"
"1228","98.800044","149.154.167.99","10.0.2.15","TLSv1.2","199","Application Data"
"1229","98.800078","10.0.2.15","149.154.167.99","TCP","54","52862  >  443 [ACK] Seq=19481 Ack=27539 Win=65535 Len=0"
"1230","98.823271","149.154.167.99","10.0.2.15","TLSv1.2","167","Application Data"
"1231","98.823301","10.0.2.15","149.154.167.99","TCP","54","52862  >  443 [ACK] Seq=19481 Ack=27652 Win=65535 Len=0"
"1237","99.359252","10.0.2.15","149.154.167.99","TLSv1.2","253","Application Data"
"1238","99.359818","149.154.167.99","10.0.2.15","TCP","60","443  >  52862 [ACK] Seq=27652 Ack=19680 Win=65535 Len=0"
"1239","99.475468","149.154.167.99","10.0.2.15","TLSv1.2","167","Application Data"
"1240","99.475507","10.0.2.15","149.154.167.99","TCP","54","52862  >  443 [ACK] Seq=19680 Ack=27765 Win=65535 Len=0"
"1243","99.477695","10.0.2.15","149.154.167.99","TLSv1.2","253","Application Data"
"1244","99.477941","149.154.167.99","10.0.2.15","TCP","60","443  >  52862 [ACK] Seq=27765 Ack=19879 Win=65535 Len=0"
"1245","99.576925","149.154.167.99","10.0.2.15","TLSv1.2","473","Application Data"
"1246","99.619354","10.0.2.15","149.154.167.99","TCP","54","52862  >  443 [ACK] Seq=19879 Ack=28184 Win=65535 Len=0"
"1247","99.889482","10.0.2.15","149.154.167.99","TLSv1.2","253","Application Data"
"1248","99.889875","149.154.167.99","10.0.2.15","TCP","60","443  >  52862 [ACK] Seq=28184 Ack=20078 Win=65535 Len=0"
"1249","99.992344","149.154.167.99","10.0.2.15","TLSv1.2","199","Application Data"
"1250","99.992373","10.0.2.15","149.154.167.99","TCP","54","52862  >  443 [ACK] Seq=20078 Ack=28329 Win=65535 Len=0"
"1253","100.533189","149.154.167.99","10.0.2.15","TLSv1.2","393","Application Data"
"1254","100.533224","10.0.2.15","149.154.167.99","TCP","54","52862  >  443 [ACK] Seq=20078 Ack=28668 Win=65535 Len=0"
"1260","101.296907","10.0.2.15","149.154.167.99","TLSv1.2","253","Application Data"
"1261","101.297204","149.154.167.99","10.0.2.15","TCP","60","443  >  52862 [ACK] Seq=28668 Ack=20277 Win=65535 Len=0"
"1264","101.399589","149.154.167.99","10.0.2.15","TLSv1.2","167","Application Data"
"1265","101.399603","10.0.2.15","149.154.167.99","TCP","54","52862  >  443 [ACK] Seq=20277 Ack=28781 Win=65535 Len=0"
"1266","101.403983","10.0.2.15","149.154.167.99","TLSv1.2","253","Application Data"
"1267","101.404137","149.154.167.99","10.0.2.15","TCP","60","443  >  52862 [ACK] Seq=28781 Ack=20476 Win=65535 Len=0"
"1268","101.546977","149.154.167.99","10.0.2.15","TLSv1.2","457","Application Data"
"1269","101.587512","10.0.2.15","149.154.167.99","TCP","54","52862  >  443 [ACK] Seq=20476 Ack=29184 Win=65535 Len=0"
"1270","101.800590","10.0.2.15","149.154.167.99","TLSv1.2","253","Application Data"
"1271","101.800835","149.154.167.99","10.0.2.15","TCP","60","443  >  52862 [ACK] Seq=29184 Ack=20675 Win=65535 Len=0"
"1272","101.832983","10.0.2.15","149.154.167.99","TLSv1.2","171","Application Data"
"1273","101.833301","149.154.167.99","10.0.2.15","TCP","60","443  >  52862 [ACK] Seq=29184 Ack=20792 Win=65535 Len=0"
"1274","101.912273","149.154.167.99","10.0.2.15","TLSv1.2","233","Application Data"
"1275","101.912306","10.0.2.15","149.154.167.99","TCP","54","52862  >  443 [ACK] Seq=20792 Ack=29363 Win=65535 Len=0"
"1276","101.981028","149.154.167.99","10.0.2.15","TLSv1.2","199","Application Data"
"1277","101.981064","10.0.2.15","149.154.167.99","TCP","54","52862  >  443 [ACK] Seq=20792 Ack=29508 Win=65535 Len=0"
"1284","104.929362","10.0.2.15","149.154.167.99","TLSv1.2","253","Application Data"
"1285","104.929776","149.154.167.99","10.0.2.15","TCP","60","443  >  52862 [ACK] Seq=29508 Ack=20991 Win=65535 Len=0"
"1286","105.013295","149.154.167.99","10.0.2.15","TLSv1.2","167","Application Data"
"1287","105.013345","10.0.2.15","149.154.167.99","TCP","54","52862  >  443 [ACK] Seq=20991 Ack=29621 Win=65535 Len=0"
"1290","105.981632","149.154.167.99","10.0.2.15","TLSv1.2","636","Application Data"
"1291","105.981671","10.0.2.15","149.154.167.99","TCP","54","52862  >  443 [ACK] Seq=20991 Ack=30203 Win=65535 Len=0"
"1297","106.410674","10.0.2.15","149.154.167.99","TLSv1.3","317","Application Data"
"1298","106.411056","149.154.167.99","10.0.2.15","TCP","60","443  >  60374 [ACK] Seq=31751 Ack=2175 Win=65535 Len=0"
"1299","106.505889","149.154.167.99","10.0.2.15","TCP","1294","443  >  60374 [PSH, ACK] Seq=31751 Ack=2175 Win=65535 Len=1240 [TCP segment of a reassembled PDU]"
"1300","106.505936","10.0.2.15","149.154.167.99","TCP","54","60374  >  443 [ACK] Seq=2175 Ack=32991 Win=62780 Len=0"
"1301","106.506395","149.154.167.99","10.0.2.15","TCP","2534","443  >  60374 [PSH, ACK] Seq=32991 Ack=2175 Win=65535 Len=2480 [TCP segment of a reassembled PDU]"
"1302","106.506409","10.0.2.15","149.154.167.99","TCP","54","60374  >  443 [ACK] Seq=2175 Ack=35471 Win=62780 Len=0"
"1303","106.511056","149.154.167.99","10.0.2.15","TCP","2534","443  >  60374 [PSH, ACK] Seq=35471 Ack=2175 Win=65535 Len=2480 [TCP segment of a reassembled PDU]"
"1304","106.511076","10.0.2.15","149.154.167.99","TCP","54","60374  >  443 [ACK] Seq=2175 Ack=37951 Win=62780 Len=0"
"1305","106.511872","149.154.167.99","10.0.2.15","TCP","2534","443  >  60374 [PSH, ACK] Seq=37951 Ack=2175 Win=65535 Len=2480 [TCP segment of a reassembled PDU]"
"1306","106.511887","10.0.2.15","149.154.167.99","TCP","54","60374  >  443 [ACK] Seq=2175 Ack=40431 Win=62780 Len=0"
"1307","106.512236","149.154.167.99","10.0.2.15","TLSv1.3","3412","Application Data"
"1308","106.512249","10.0.2.15","149.154.167.99","TCP","54","60374  >  443 [ACK] Seq=2175 Ack=43789 Win=61320 Len=0"
"1309","106.785089","10.0.2.15","149.154.167.99","TLSv1.2","253","Application Data"
"1310","106.785453","149.154.167.99","10.0.2.15","TCP","60","443  >  52862 [ACK] Seq=30203 Ack=21190 Win=65535 Len=0"
"1311","106.906905","149.154.167.99","10.0.2.15","TLSv1.2","167","Application Data"
"1312","106.906943","10.0.2.15","149.154.167.99","TCP","54","52862  >  443 [ACK] Seq=21190 Ack=30316 Win=65535 Len=0"
"1313","106.911721","10.0.2.15","149.154.167.99","TLSv1.2","253","Application Data"
"1314","106.911939","149.154.167.99","10.0.2.15","TCP","60","443  >  52862 [ACK] Seq=30316 Ack=21389 Win=65535 Len=0"
"1317","107.024467","149.154.167.99","10.0.2.15","TLSv1.2","732","Application Data"
"1318","107.067390","10.0.2.15","149.154.167.99","TCP","54","52862  >  443 [ACK] Seq=21389 Ack=30994 Win=65535 Len=0"
"1319","107.322616","10.0.2.15","149.154.167.99","TLSv1.2","253","Application Data"
"1320","107.323052","149.154.167.99","10.0.2.15","TCP","60","443  >  52862 [ACK] Seq=30994 Ack=21588 Win=65535 Len=0"
"1321","107.428707","149.154.167.99","10.0.2.15","TLSv1.2","199","Application Data"
"1322","107.428747","10.0.2.15","149.154.167.99","TCP","54","52862  >  443 [ACK] Seq=21588 Ack=31139 Win=65535 Len=0"
"1323","108.029055","10.0.2.15","149.154.167.99","TLSv1.2","237","Application Data"
"1324","108.029405","149.154.167.99","10.0.2.15","TCP","60","443  >  52862 [ACK] Seq=31139 Ack=21771 Win=65535 Len=0"
"1325","108.112189","149.154.167.99","10.0.2.15","TLSv1.2","167","Application Data"
"1326","108.112216","10.0.2.15","149.154.167.99","TCP","54","52862  >  443 [ACK] Seq=21771 Ack=31252 Win=65535 Len=0"
"1329","108.486819","149.154.167.99","10.0.2.15","TLSv1.2","393","Application Data"
"1330","108.486855","10.0.2.15","149.154.167.99","TCP","54","52862  >  443 [ACK] Seq=21771 Ack=31591 Win=65535 Len=0"
"1338","109.244223","10.0.2.15","149.154.167.99","TLSv1.2","253","Application Data"
"1339","109.244593","149.154.167.99","10.0.2.15","TCP","60","443  >  52862 [ACK] Seq=31591 Ack=21970 Win=65535 Len=0"
"1340","109.344055","149.154.167.99","10.0.2.15","TLSv1.2","167","Application Data"
"1341","109.344091","10.0.2.15","149.154.167.99","TCP","54","52862  >  443 [ACK] Seq=21970 Ack=31704 Win=65535 Len=0"
"1342","109.347325","10.0.2.15","149.154.167.99","TLSv1.2","253","Application Data"
"1343","109.347722","149.154.167.99","10.0.2.15","TCP","60","443  >  52862 [ACK] Seq=31704 Ack=22169 Win=65535 Len=0"
"1346","109.445890","149.154.167.99","10.0.2.15","TLSv1.2","473","Application Data"
"1347","109.465038","10.0.2.15","149.154.167.99","TLSv1.2","557","Application Data"
"1348","109.465465","149.154.167.99","10.0.2.15","TCP","60","443  >  52862 [ACK] Seq=32123 Ack=22672 Win=65535 Len=0"
"1349","109.564733","149.154.167.99","10.0.2.15","TLSv1.2","233","Application Data"
"1350","109.611332","10.0.2.15","149.154.167.99","TCP","54","52862  >  443 [ACK] Seq=22672 Ack=32302 Win=65535 Len=0"
"1351","109.754635","10.0.2.15","149.154.167.99","TLSv1.2","253","Application Data"
"1352","109.754929","149.154.167.99","10.0.2.15","TCP","60","443  >  52862 [ACK] Seq=32302 Ack=22871 Win=65535 Len=0"
"1353","109.960816","149.154.167.99","10.0.2.15","TLSv1.2","199","Application Data"
"1354","109.960870","10.0.2.15","149.154.167.99","TCP","54","52862  >  443 [ACK] Seq=22871 Ack=32447 Win=65535 Len=0"
"1357","110.103480","149.154.167.99","10.0.2.15","TLSv1.2","409","Application Data"
"1358","110.103519","10.0.2.15","149.154.167.99","TCP","54","52862  >  443 [ACK] Seq=22871 Ack=32802 Win=65535 Len=0"
"1366","110.882533","10.0.2.15","149.154.167.99","TLSv1.2","253","Application Data"
"1367","110.882907","149.154.167.99","10.0.2.15","TCP","60","443  >  52862 [ACK] Seq=32802 Ack=23070 Win=65535 Len=0"
"1368","110.989360","149.154.167.99","10.0.2.15","TLSv1.2","167","Application Data"
"1369","110.989389","10.0.2.15","149.154.167.99","TCP","54","52862  >  443 [ACK] Seq=23070 Ack=32915 Win=65535 Len=0"
"1370","110.992847","10.0.2.15","149.154.167.99","TLSv1.2","253","Application Data"
"1371","110.993038","149.154.167.99","10.0.2.15","TCP","60","443  >  52862 [ACK] Seq=32915 Ack=23269 Win=65535 Len=0"
"1374","111.095452","149.154.167.99","10.0.2.15","TLSv1.2","790","Application Data"
"1376","111.139358","10.0.2.15","149.154.167.99","TCP","54","52862  >  443 [ACK] Seq=23269 Ack=33651 Win=65535 Len=0"
"1378","111.187563","10.0.2.15","149.154.167.99","TLSv1.2","237","Application Data"
"1379","111.187748","10.0.2.15","149.154.167.99","TLSv1.2","171","Application Data"
"1380","111.187877","149.154.167.99","10.0.2.15","TCP","60","443  >  52862 [ACK] Seq=33651 Ack=23452 Win=65535 Len=0"
"1381","111.188023","149.154.167.99","10.0.2.15","TCP","60","443  >  52862 [ACK] Seq=33651 Ack=23569 Win=65535 Len=0"
"1382","111.296452","149.154.167.99","10.0.2.15","TLSv1.2","167","Application Data"
"1383","111.296503","10.0.2.15","149.154.167.99","TCP","54","52862  >  443 [ACK] Seq=23569 Ack=33764 Win=65535 Len=0"
"1384","111.394014","10.0.2.15","149.154.167.99","TLSv1.2","253","Application Data"
"1385","111.394409","149.154.167.99","10.0.2.15","TCP","60","443  >  52862 [ACK] Seq=33764 Ack=23768 Win=65535 Len=0"
"1389","111.500602","149.154.167.99","10.0.2.15","TLSv1.2","199","Application Data"
"1390","111.500649","10.0.2.15","149.154.167.99","TCP","54","52862  >  443 [ACK] Seq=23768 Ack=33909 Win=65535 Len=0"
"1391","111.925049","10.0.2.15","149.154.167.99","TLSv1.2","253","Application Data"
"1392","111.925330","149.154.167.99","10.0.2.15","TCP","60","443  >  52862 [ACK] Seq=33909 Ack=23967 Win=65535 Len=0"
"1393","112.208511","149.154.167.99","10.0.2.15","TLSv1.2","167","Application Data"
"1394","112.208554","10.0.2.15","149.154.167.99","TCP","54","52862  >  443 [ACK] Seq=23967 Ack=34022 Win=65535 Len=0"
"1395","112.211825","10.0.2.15","149.154.167.99","TLSv1.2","253","Application Data"
"1396","112.212110","149.154.167.99","10.0.2.15","TCP","60","443  >  52862 [ACK] Seq=34022 Ack=24166 Win=65535 Len=0"
"1399","112.324782","149.154.167.99","10.0.2.15","TLSv1.2","457","Application Data"
"1400","112.367374","10.0.2.15","149.154.167.99","TCP","54","52862  >  443 [ACK] Seq=24166 Ack=34425 Win=65535 Len=0"
"1401","112.424646","10.0.2.15","149.154.167.99","TLSv1.2","253","Application Data"
"1402","112.424960","149.154.167.99","10.0.2.15","TCP","60","443  >  52862 [ACK] Seq=34425 Ack=24365 Win=65535 Len=0"
"1405","112.524290","149.154.167.99","10.0.2.15","TLSv1.2","409","Application Data"
"1406","112.524326","10.0.2.15","149.154.167.99","TCP","54","52862  >  443 [ACK] Seq=24365 Ack=34780 Win=65535 Len=0"
"1407","112.550683","149.154.167.99","10.0.2.15","TLSv1.2","199","Application Data"
"1408","112.550728","10.0.2.15","149.154.167.99","TCP","54","52862  >  443 [ACK] Seq=24365 Ack=34925 Win=65535 Len=0"
"1412","113.304941","10.0.2.15","149.154.167.99","TLSv1.2","253","Application Data"
"1413","113.305357","149.154.167.99","10.0.2.15","TCP","60","443  >  52862 [ACK] Seq=34925 Ack=24564 Win=65535 Len=0"
"1416","113.403075","149.154.167.99","10.0.2.15","TLSv1.2","167","Application Data"
"1417","113.403101","10.0.2.15","149.154.167.99","TCP","54","52862  >  443 [ACK] Seq=24564 Ack=35038 Win=65535 Len=0"
"1418","113.406106","10.0.2.15","149.154.167.99","TLSv1.2","253","Application Data"
"1419","113.406362","149.154.167.99","10.0.2.15","TCP","60","443  >  52862 [ACK] Seq=35038 Ack=24763 Win=65535 Len=0"
"1422","113.506785","149.154.167.99","10.0.2.15","TLSv1.2","473","Application Data"
"1423","113.547011","149.154.167.99","10.0.2.15","TLSv1.2","393","Application Data"
"1424","113.547044","10.0.2.15","149.154.167.99","TCP","54","52862  >  443 [ACK] Seq=24763 Ack=35796 Win=65535 Len=0"
"1430","113.814178","10.0.2.15","149.154.167.99","TLSv1.2","269","Application Data"
"1431","113.814515","149.154.167.99","10.0.2.15","TCP","60","443  >  52862 [ACK] Seq=35796 Ack=24978 Win=65535 Len=0"
"1432","113.926892","149.154.167.99","10.0.2.15","TLSv1.2","199","Application Data"
"1433","113.967560","10.0.2.15","149.154.167.99","TCP","54","52862  >  443 [ACK] Seq=24978 Ack=35941 Win=65535 Len=0"
"1436","114.302321","10.0.2.15","149.154.167.99","TLSv1.2","237","Application Data"
"1437","114.302648","149.154.167.99","10.0.2.15","TCP","60","443  >  52862 [ACK] Seq=35941 Ack=25161 Win=65535 Len=0"
"1438","114.380267","149.154.167.99","10.0.2.15","TLSv1.2","167","Application Data"
"1439","114.380299","10.0.2.15","149.154.167.99","TCP","54","52862  >  443 [ACK] Seq=25161 Ack=36054 Win=65535 Len=0"
"1440","114.764963","149.154.167.99","10.0.2.15","TLSv1.2","393","Application Data"
"1441","114.764996","10.0.2.15","149.154.167.99","TCP","54","52862  >  443 [ACK] Seq=25161 Ack=36393 Win=65535 Len=0"
"1449","115.569347","10.0.2.15","149.154.167.99","TLSv1.2","253","Application Data"
"1450","115.569722","149.154.167.99","10.0.2.15","TCP","60","443  >  52862 [ACK] Seq=36393 Ack=25360 Win=65535 Len=0"
"1451","115.674198","149.154.167.99","10.0.2.15","TLSv1.2","167","Application Data"
"1452","115.674228","10.0.2.15","149.154.167.99","TCP","54","52862  >  443 [ACK] Seq=25360 Ack=36506 Win=65535 Len=0"
"1453","115.679848","10.0.2.15","149.154.167.99","TLSv1.2","253","Application Data"
"1454","115.680165","149.154.167.99","10.0.2.15","TCP","60","443  >  52862 [ACK] Seq=36506 Ack=25559 Win=65535 Len=0"
"1457","115.807791","149.154.167.99","10.0.2.15","TLSv1.2","473","Application Data"
"1458","115.851353","10.0.2.15","149.154.167.99","TCP","54","52862  >  443 [ACK] Seq=25559 Ack=36925 Win=65535 Len=0"
"1459","116.077292","10.0.2.15","149.154.167.99","TLSv1.2","269","Application Data"
"1460","116.077728","149.154.167.99","10.0.2.15","TCP","60","443  >  52862 [ACK] Seq=36925 Ack=25774 Win=65535 Len=0"
"1461","116.207396","149.154.167.99","10.0.2.15","TLSv1.2","217","Application Data"
"1462","116.207427","10.0.2.15","149.154.167.99","TCP","54","52862  >  443 [ACK] Seq=25774 Ack=37088 Win=65535 Len=0"
"1463","117.277497","149.154.167.99","10.0.2.15","TLSv1.2","409","Application Data"
"1464","117.277535","10.0.2.15","149.154.167.99","TCP","54","52862  >  443 [ACK] Seq=25774 Ack=37443 Win=65535 Len=0"
"1467","117.387097","10.0.2.15","149.154.167.99","TLSv1.2","237","Application Data"
"1468","117.387455","149.154.167.99","10.0.2.15","TCP","60","443  >  52862 [ACK] Seq=37443 Ack=25957 Win=65535 Len=0"
"1469","117.471447","149.154.167.99","10.0.2.15","TLSv1.2","167","Application Data"
"1470","117.471480","10.0.2.15","149.154.167.99","TCP","54","52862  >  443 [ACK] Seq=25957 Ack=37556 Win=65535 Len=0"
"1474","118.026001","10.0.2.15","149.154.167.99","TLSv1.2","253","Application Data"
"1475","118.026389","149.154.167.99","10.0.2.15","TCP","60","443  >  52862 [ACK] Seq=37556 Ack=26156 Win=65535 Len=0"
"1476","118.139670","149.154.167.99","10.0.2.15","TLSv1.2","167","Application Data"
"1477","118.139699","10.0.2.15","149.154.167.99","TCP","54","52862  >  443 [ACK] Seq=26156 Ack=37669 Win=65535 Len=0"
"1478","118.142772","10.0.2.15","149.154.167.99","TLSv1.2","253","Application Data"
"1479","118.143069","149.154.167.99","10.0.2.15","TCP","60","443  >  52862 [ACK] Seq=37669 Ack=26355 Win=65535 Len=0"
"1482","118.263906","149.154.167.99","10.0.2.15","TLSv1.2","473","Application Data"
"1483","118.307382","10.0.2.15","149.154.167.99","TCP","54","52862  >  443 [ACK] Seq=26355 Ack=38088 Win=65535 Len=0"
"1486","118.453430","149.154.167.99","10.0.2.15","TLSv1.2","393","Application Data"
"1487","118.453464","10.0.2.15","149.154.167.99","TCP","54","52862  >  443 [ACK] Seq=26355 Ack=38427 Win=65535 Len=0"
"1488","118.529460","10.0.2.15","149.154.167.99","TLSv1.2","269","Application Data"
"1489","118.529854","149.154.167.99","10.0.2.15","TCP","60","443  >  52862 [ACK] Seq=38427 Ack=26570 Win=65535 Len=0"
"1492","118.624508","149.154.167.99","10.0.2.15","TLSv1.2","199","Application Data"
"1493","118.624549","10.0.2.15","149.154.167.99","TCP","54","52862  >  443 [ACK] Seq=26570 Ack=38572 Win=65535 Len=0"
"1499","119.207366","10.0.2.15","149.154.167.99","TLSv1.2","253","Application Data"
"1500","119.207653","149.154.167.99","10.0.2.15","TCP","60","443  >  52862 [ACK] Seq=38572 Ack=26769 Win=65535 Len=0"
"1501","119.301288","149.154.167.99","10.0.2.15","TLSv1.2","167","Application Data"
"1502","119.301315","10.0.2.15","149.154.167.99","TCP","54","52862  >  443 [ACK] Seq=26769 Ack=38685 Win=65535 Len=0"
"1503","119.303784","10.0.2.15","149.154.167.99","TLSv1.2","253","Application Data"
"1504","119.304067","149.154.167.99","10.0.2.15","TCP","60","443  >  52862 [ACK] Seq=38685 Ack=26968 Win=65535 Len=0"
"1507","119.402552","149.154.167.99","10.0.2.15","TLSv1.2","457","Application Data"
"1508","119.446559","10.0.2.15","149.154.167.99","TCP","54","52862  >  443 [ACK] Seq=26968 Ack=39088 Win=65535 Len=0"
"1509","119.719720","10.0.2.15","149.154.167.99","TLSv1.2","253","Application Data"
"1510","119.720058","149.154.167.99","10.0.2.15","TCP","60","443  >  52862 [ACK] Seq=39088 Ack=27167 Win=65535 Len=0"
"1511","119.814035","149.154.167.99","10.0.2.15","TLSv1.2","199","Application Data"
"1512","119.814086","10.0.2.15","149.154.167.99","TCP","54","52862  >  443 [ACK] Seq=27167 Ack=39233 Win=65535 Len=0"
"1515","120.305730","149.154.167.99","10.0.2.15","TLSv1.2","409","Application Data"
"1516","120.305773","10.0.2.15","149.154.167.99","TCP","54","52862  >  443 [ACK] Seq=27167 Ack=39588 Win=65535 Len=0"
"1519","120.479272","10.0.2.15","149.154.167.99","TLSv1.2","237","Application Data"
"1520","120.479707","149.154.167.99","10.0.2.15","TCP","60","443  >  52862 [ACK] Seq=39588 Ack=27350 Win=65535 Len=0"
"1521","120.558861","149.154.167.99","10.0.2.15","TLSv1.2","167","Application Data"
"1522","120.558895","10.0.2.15","149.154.167.99","TCP","54","52862  >  443 [ACK] Seq=27350 Ack=39701 Win=65535 Len=0"
"1526","121.070581","10.0.2.15","149.154.167.99","TLSv1.2","253","Application Data"
"1527","121.070959","149.154.167.99","10.0.2.15","TCP","60","443  >  52862 [ACK] Seq=39701 Ack=27549 Win=65535 Len=0"
"1528","121.172599","149.154.167.99","10.0.2.15","TLSv1.2","167","Application Data"
"1529","121.172628","10.0.2.15","149.154.167.99","TCP","54","52862  >  443 [ACK] Seq=27549 Ack=39814 Win=65535 Len=0"
"1530","121.176545","10.0.2.15","149.154.167.99","TLSv1.2","253","Application Data"
"1531","121.176836","149.154.167.99","10.0.2.15","TCP","60","443  >  52862 [ACK] Seq=39814 Ack=27748 Win=65535 Len=0"
"1534","121.283241","149.154.167.99","10.0.2.15","TLSv1.2","473","Application Data"
"1535","121.323900","10.0.2.15","149.154.167.99","TCP","54","52862  >  443 [ACK] Seq=27748 Ack=40233 Win=65535 Len=0"
"1536","121.373712","149.154.167.99","10.0.2.15","TLSv1.2","393","Application Data"
"1537","121.373742","10.0.2.15","149.154.167.99","TCP","54","52862  >  443 [ACK] Seq=27748 Ack=40572 Win=65535 Len=0"
"1540","121.578476","10.0.2.15","149.154.167.99","TLSv1.2","269","Application Data"
"1541","121.578851","149.154.167.99","10.0.2.15","TCP","60","443  >  52862 [ACK] Seq=40572 Ack=27963 Win=65535 Len=0"
"1542","121.680624","149.154.167.99","10.0.2.15","TLSv1.2","199","Application Data"
"1543","121.680666","10.0.2.15","149.154.167.99","TCP","54","52862  >  443 [ACK] Seq=27963 Ack=40717 Win=65535 Len=0"
"1547","122.138194","10.0.2.15","149.154.167.99","TLSv1.2","253","Application Data"
"1548","122.138624","149.154.167.99","10.0.2.15","TCP","60","443  >  52862 [ACK] Seq=40717 Ack=28162 Win=65535 Len=0"
"1549","122.243107","149.154.167.99","10.0.2.15","TLSv1.2","167","Application Data"
"1550","122.243149","10.0.2.15","149.154.167.99","TCP","54","52862  >  443 [ACK] Seq=28162 Ack=40830 Win=65535 Len=0"
"1551","122.246376","10.0.2.15","149.154.167.99","TLSv1.2","253","Application Data"
"1552","122.246642","149.154.167.99","10.0.2.15","TCP","60","443  >  52862 [ACK] Seq=40830 Ack=28361 Win=65535 Len=0"
"1555","122.339409","149.154.167.99","10.0.2.15","TLSv1.2","473","Application Data"
"1556","122.383320","10.0.2.15","149.154.167.99","TCP","54","52862  >  443 [ACK] Seq=28361 Ack=41249 Win=65535 Len=0"
"1557","122.647198","10.0.2.15","149.154.167.99","TLSv1.2","253","Application Data"
"1558","122.647553","149.154.167.99","10.0.2.15","TCP","60","443  >  52862 [ACK] Seq=41249 Ack=28560 Win=65535 Len=0"
"1559","122.753551","149.154.167.99","10.0.2.15","TLSv1.2","199","Application Data"
"1560","122.753581","10.0.2.15","149.154.167.99","TCP","54","52862  >  443 [ACK] Seq=28560 Ack=41394 Win=65535 Len=0"
"1605","123.563249","10.0.2.15","149.154.167.99","TLSv1.2","237","Application Data"
"1606","123.563639","149.154.167.99","10.0.2.15","TCP","60","443  >  52862 [ACK] Seq=41394 Ack=28743 Win=65535 Len=0"
"1607","123.644360","149.154.167.99","10.0.2.15","TLSv1.2","167","Application Data"
"1608","123.644390","10.0.2.15","149.154.167.99","TCP","54","52862  >  443 [ACK] Seq=28743 Ack=41507 Win=65535 Len=0"
"1620","124.452679","10.0.2.15","149.154.167.99","TLSv1.2","525","Application Data"
"1621","124.453336","149.154.167.99","10.0.2.15","TCP","60","443  >  52862 [ACK] Seq=41507 Ack=29214 Win=65535 Len=0"
"1622","124.554883","149.154.167.99","10.0.2.15","TLSv1.2","233","Application Data"
"1623","124.554915","10.0.2.15","149.154.167.99","TCP","54","52862  >  443 [ACK] Seq=29214 Ack=41686 Win=65535 Len=0"
"1630","125.850772","10.0.2.15","149.154.167.99","TLSv1.2","221","Application Data"
"1631","125.852011","149.154.167.99","10.0.2.15","TCP","60","443  >  52862 [ACK] Seq=41686 Ack=29381 Win=65535 Len=0"
"1632","126.008015","149.154.167.99","10.0.2.15","TLSv1.2","167","Application Data"
"1633","126.008048","10.0.2.15","149.154.167.99","TCP","54","52862  >  443 [ACK] Seq=29381 Ack=41799 Win=65535 Len=0"
"1638","126.648027","10.0.2.15","149.154.167.99","TLSv1.2","237","Application Data"
"1639","126.648371","149.154.167.99","10.0.2.15","TCP","60","443  >  52862 [ACK] Seq=41799 Ack=29564 Win=65535 Len=0"
"1640","126.735196","149.154.167.99","10.0.2.15","TLSv1.2","167","Application Data"
"1641","126.735230","10.0.2.15","149.154.167.99","TCP","54","52862  >  443 [ACK] Seq=29564 Ack=41912 Win=65535 Len=0"
"1646","127.250737","10.0.2.15","149.154.167.99","TLSv1.2","93","Application Data"
"1647","127.250920","10.0.2.15","149.154.167.99","TLSv1.2","78","Application Data"
"1648","127.250958","10.0.2.15","149.154.167.99","TCP","54","58620  >  443 [FIN, ACK] Seq=142 Ack=79 Win=63986 Len=0"
"1649","127.250993","149.154.167.99","10.0.2.15","TCP","60","443  >  58620 [ACK] Seq=79 Ack=118 Win=65535 Len=0"
"1650","127.251039","149.154.167.99","10.0.2.15","TCP","60","443  >  58620 [ACK] Seq=79 Ack=142 Win=65535 Len=0"
"1651","127.251039","149.154.167.99","10.0.2.15","TCP","60","443  >  58620 [ACK] Seq=79 Ack=143 Win=65535 Len=0"
"1652","127.332252","149.154.167.99","10.0.2.15","TCP","60","443  >  58620 [FIN, ACK] Seq=79 Ack=143 Win=65535 Len=0"
"1653","127.332285","10.0.2.15","149.154.167.99","TCP","54","58620  >  443 [ACK] Seq=143 Ack=80 Win=63986 Len=0"
"1654","128.313546","149.154.167.99","10.0.2.15","TLSv1.2","668","Application Data"
"1655","128.313583","10.0.2.15","149.154.167.99","TCP","54","52862  >  443 [ACK] Seq=29564 Ack=42526 Win=65535 Len=0"
"1661","128.714115","10.0.2.15","149.154.167.99","TLSv1.3","301","Application Data"
"1662","128.714399","149.154.167.99","10.0.2.15","TCP","60","443  >  60374 [ACK] Seq=43789 Ack=2422 Win=65535 Len=0"
"1663","128.824338","149.154.167.99","10.0.2.15","TCP","1294","443  >  60374 [PSH, ACK] Seq=43789 Ack=2422 Win=65535 Len=1240 [TCP segment of a reassembled PDU]"
"1664","128.824460","10.0.2.15","149.154.167.99","TCP","54","60374  >  443 [ACK] Seq=2422 Ack=45029 Win=62780 Len=0"
"1665","128.825064","149.154.167.99","10.0.2.15","TCP","3774","443  >  60374 [PSH, ACK] Seq=45029 Ack=2422 Win=65535 Len=3720 [TCP segment of a reassembled PDU]"
"1666","128.825082","10.0.2.15","149.154.167.99","TCP","54","60374  >  443 [ACK] Seq=2422 Ack=48749 Win=61320 Len=0"
"1667","128.825267","149.154.167.99","10.0.2.15","TLSv1.3","3276","Application Data"
"1668","128.825278","10.0.2.15","149.154.167.99","TCP","54","60374  >  443 [ACK] Seq=2422 Ack=51971 Win=61320 Len=0"
"1671","129.746428","10.0.2.15","149.154.167.99","TLSv1.2","237","Application Data"
"1672","129.746989","149.154.167.99","10.0.2.15","TCP","60","443  >  52862 [ACK] Seq=42526 Ack=29747 Win=65535 Len=0"
"1673","129.829223","149.154.167.99","10.0.2.15","TLSv1.2","167","Application Data"
"1674","129.829254","10.0.2.15","149.154.167.99","TCP","54","52862  >  443 [ACK] Seq=29747 Ack=42639 Win=65535 Len=0"
"1677","130.563094","149.154.167.99","10.0.2.15","TLSv1.2","393","Application Data"
"1678","130.563146","10.0.2.15","149.154.167.99","TCP","54","52862  >  443 [ACK] Seq=29747 Ack=42978 Win=65535 Len=0"
"1684","131.447304","149.154.167.99","10.0.2.15","TLSv1.2","393","Application Data"
"1685","131.447358","10.0.2.15","149.154.167.99","TCP","54","52862  >  443 [ACK] Seq=29747 Ack=43317 Win=65535 Len=0"
"1695","132.843189","10.0.2.15","149.154.167.99","TLSv1.2","253","Application Data"
"1696","132.843463","149.154.167.99","10.0.2.15","TCP","60","443  >  52862 [ACK] Seq=43317 Ack=29946 Win=65535 Len=0"
"1697","132.922893","149.154.167.99","10.0.2.15","TLSv1.2","167","Application Data"
"1698","132.922922","10.0.2.15","149.154.167.99","TCP","54","52862  >  443 [ACK] Seq=29946 Ack=43430 Win=65535 Len=0"
"1701","133.114126","149.154.167.99","10.0.2.15","TLSv1.2","409","Application Data"
"1702","133.114139","10.0.2.15","149.154.167.99","TCP","54","52862  >  443 [ACK] Seq=29946 Ack=43785 Win=65535 Len=0"
"1706","134.006469","149.154.167.99","10.0.2.15","TLSv1.2","393","Application Data"
"1707","134.006503","10.0.2.15","149.154.167.99","TCP","54","52862  >  443 [ACK] Seq=29946 Ack=44124 Win=65535 Len=0"
"1717","135.464676","149.154.167.99","10.0.2.15","TLSv1.2","409","Application Data"
"1718","135.464707","10.0.2.15","149.154.167.99","TCP","54","52862  >  443 [ACK] Seq=29946 Ack=44479 Win=65535 Len=0"
"1724","135.934370","10.0.2.15","149.154.167.99","TLSv1.2","253","Application Data"
"1725","135.934823","149.154.167.99","10.0.2.15","TCP","60","443  >  52862 [ACK] Seq=44479 Ack=30145 Win=65535 Len=0"
"1726","135.956839","10.0.2.15","149.154.167.99","TLSv1.3","93","Application Data"
"1727","135.957225","149.154.167.99","10.0.2.15","TCP","60","443  >  49342 [ACK] Seq=849 Ack=1291 Win=65535 Len=0"
"1728","136.025816","149.154.167.99","10.0.2.15","TLSv1.3","93","Application Data"
"1729","136.025850","10.0.2.15","149.154.167.99","TCP","54","49342  >  443 [ACK] Seq=1291 Ack=888 Win=63986 Len=0"
"1730","136.042043","149.154.167.99","10.0.2.15","TLSv1.2","167","Application Data"
"1731","136.042104","10.0.2.15","149.154.167.99","TCP","54","52862  >  443 [ACK] Seq=30145 Ack=44592 Win=65535 Len=0"
"1738","139.051878","10.0.2.15","149.154.167.99","TLSv1.2","237","Application Data"
"1739","139.052181","149.154.167.99","10.0.2.15","TCP","60","443  >  52862 [ACK] Seq=44592 Ack=30328 Win=65535 Len=0"
"1740","139.132869","149.154.167.99","10.0.2.15","TLSv1.2","167","Application Data"
"1741","139.132897","10.0.2.15","149.154.167.99","TCP","54","52862  >  443 [ACK] Seq=30328 Ack=44705 Win=65535 Len=0"
"1744","139.453315","10.0.2.15","149.154.167.99","TLSv1.2","541","Application Data"
"1745","139.453762","149.154.167.99","10.0.2.15","TCP","60","443  >  52862 [ACK] Seq=44705 Ack=30815 Win=65535 Len=0"
"1746","139.552012","149.154.167.99","10.0.2.15","TLSv1.2","233","Application Data"
"1747","139.552041","10.0.2.15","149.154.167.99","TCP","54","52862  >  443 [ACK] Seq=30815 Ack=44884 Win=65535 Len=0"
"1760","142.140617","10.0.2.15","149.154.167.99","TLSv1.2","237","Application Data"
"1761","142.141001","149.154.167.99","10.0.2.15","TCP","60","443  >  52862 [ACK] Seq=44884 Ack=30998 Win=65535 Len=0"
"1762","142.226543","149.154.167.99","10.0.2.15","TLSv1.2","167","Application Data"
"1763","142.226571","10.0.2.15","149.154.167.99","TCP","54","52862  >  443 [ACK] Seq=30998 Ack=44997 Win=65535 Len=0"
"1815","145.234569","10.0.2.15","149.154.167.99","TLSv1.2","237","Application Data"
"1816","145.234999","149.154.167.99","10.0.2.15","TCP","60","443  >  52862 [ACK] Seq=44997 Ack=31181 Win=65535 Len=0"
"1817","145.311144","149.154.167.99","10.0.2.15","TLSv1.2","167","Application Data"
"1818","145.311173","10.0.2.15","149.154.167.99","TCP","54","52862  >  443 [ACK] Seq=31181 Ack=45110 Win=65535 Len=0"
"1827","148.318830","10.0.2.15","149.154.167.99","TLSv1.2","237","Application Data"
"1828","148.319196","149.154.167.99","10.0.2.15","TCP","60","443  >  52862 [ACK] Seq=45110 Ack=31364 Win=65535 Len=0"
"1831","148.433388","149.154.167.99","10.0.2.15","TLSv1.2","167","Application Data"
"1832","148.433416","10.0.2.15","149.154.167.99","TCP","54","52862  >  443 [ACK] Seq=31364 Ack=45223 Win=65535 Len=0"
"1837","150.652870","10.0.2.15","149.154.167.99","TLSv1.2","221","Application Data"
"1838","150.653224","149.154.167.99","10.0.2.15","TCP","60","443  >  52862 [ACK] Seq=45223 Ack=31531 Win=65535 Len=0"
"1839","150.750490","149.154.167.99","10.0.2.15","TLSv1.2","167","Application Data"
"1840","150.750519","10.0.2.15","149.154.167.99","TCP","54","52862  >  443 [ACK] Seq=31531 Ack=45336 Win=65535 Len=0"
"1843","151.052068","10.0.2.15","149.154.167.99","TLSv1.2","253","Application Data"
"1844","151.052362","149.154.167.99","10.0.2.15","TCP","60","443  >  52862 [ACK] Seq=45336 Ack=31730 Win=65535 Len=0"
"1845","151.249705","149.154.167.99","10.0.2.15","TLSv1.2","167","Application Data"
"1846","151.249734","10.0.2.15","149.154.167.99","TCP","54","52862  >  443 [ACK] Seq=31730 Ack=45449 Win=65535 Len=0"
"1847","151.254126","10.0.2.15","149.154.167.99","TLSv1.2","253","Application Data"
"1848","151.254599","149.154.167.99","10.0.2.15","TCP","60","443  >  52862 [ACK] Seq=45449 Ack=31929 Win=65535 Len=0"
"1851","151.429014","149.154.167.99","10.0.2.15","TLSv1.2","473","Application Data"
"1852","151.440807","10.0.2.15","149.154.167.99","TLSv1.2","237","Application Data"
"1853","151.441200","149.154.167.99","10.0.2.15","TCP","60","443  >  52862 [ACK] Seq=45868 Ack=32112 Win=65535 Len=0"
"1854","151.549854","10.0.2.15","149.154.167.99","TLSv1.2","221","Application Data"
"1855","151.550107","149.154.167.99","10.0.2.15","TCP","60","443  >  52862 [ACK] Seq=45868 Ack=32279 Win=65535 Len=0"
"1856","151.586577","149.154.167.99","10.0.2.15","TLSv1.2","167","Application Data"
"1857","151.627520","10.0.2.15","149.154.167.99","TCP","54","52862  >  443 [ACK] Seq=32279 Ack=45981 Win=65535 Len=0"
"1858","151.732551","149.154.167.99","10.0.2.15","TLSv1.2","265","Application Data"
"1859","151.732587","10.0.2.15","149.154.167.99","TCP","54","52862  >  443 [ACK] Seq=32279 Ack=46192 Win=65535 Len=0"
"1864","154.455596","10.0.2.15","149.154.167.99","TLSv1.2","557","Application Data"
"1865","154.455998","149.154.167.99","10.0.2.15","TCP","60","443  >  52862 [ACK] Seq=46192 Ack=32782 Win=65535 Len=0"
"1866","154.575949","149.154.167.99","10.0.2.15","TLSv1.2","233","Application Data"
"1867","154.575979","10.0.2.15","149.154.167.99","TCP","54","52862  >  443 [ACK] Seq=32782 Ack=46371 Win=65535 Len=0"
"1868","154.603198","10.0.2.15","149.154.167.99","TLSv1.2","237","Application Data"
"1869","154.603745","149.154.167.99","10.0.2.15","TCP","60","443  >  52862 [ACK] Seq=46371 Ack=32965 Win=65535 Len=0"
"1870","154.722308","149.154.167.99","10.0.2.15","TLSv1.2","167","Application Data"
"1871","154.767343","10.0.2.15","149.154.167.99","TCP","54","52862  >  443 [ACK] Seq=32965 Ack=46484 Win=65535 Len=0"
"1876","156.159655","10.0.2.15","149.154.167.99","TLSv1.2","221","Application Data"
"1877","156.160110","149.154.167.99","10.0.2.15","TCP","60","443  >  52862 [ACK] Seq=46484 Ack=33132 Win=65535 Len=0"
"1878","156.265271","149.154.167.99","10.0.2.15","TLSv1.2","167","Application Data"
"1879","156.265323","10.0.2.15","149.154.167.99","TCP","54","52862  >  443 [ACK] Seq=33132 Ack=46597 Win=65535 Len=0"
"1882","157.732469","10.0.2.15","149.154.167.99","TLSv1.2","237","Application Data"
"1883","157.732840","149.154.167.99","10.0.2.15","TCP","60","443  >  52862 [ACK] Seq=46597 Ack=33315 Win=65535 Len=0"
"1884","158.196099","149.154.167.99","10.0.2.15","TLSv1.2","167","Application Data"
"1885","158.196143","10.0.2.15","149.154.167.99","TCP","54","52862  >  443 [ACK] Seq=33315 Ack=46710 Win=65535 Len=0"
"1890","158.838299","10.0.2.15","149.154.167.99","TLSv1.3","82","Application Data"
"1891","158.838772","149.154.167.99","10.0.2.15","TCP","60","443  >  60374 [ACK] Seq=51971 Ack=2450 Win=65535 Len=0"
"1892","158.915631","149.154.167.99","10.0.2.15","TLSv1.3","92","Application Data"
"1893","158.915669","10.0.2.15","149.154.167.99","TCP","54","60374  >  443 [ACK] Seq=2450 Ack=52009 Win=62780 Len=0"
"1894","158.915747","149.154.167.99","10.0.2.15","TLSv1.3","78","Application Data"
"1895","158.915755","10.0.2.15","149.154.167.99","TCP","54","60374  >  443 [ACK] Seq=2450 Ack=52033 Win=62780 Len=0"
"1896","158.915747","149.154.167.99","10.0.2.15","TCP","60","443  >  60374 [FIN, ACK] Seq=52033 Ack=2450 Win=65535 Len=0"
"1897","158.916003","10.0.2.15","149.154.167.99","TLSv1.3","78","Application Data"
"1898","158.916037","10.0.2.15","149.154.167.99","TCP","54","60374  >  443 [FIN, ACK] Seq=2474 Ack=52034 Win=62780 Len=0"
"1899","158.916249","149.154.167.99","10.0.2.15","TCP","60","443  >  60374 [ACK] Seq=52034 Ack=2474 Win=65535 Len=0"
"1900","158.916249","149.154.167.99","10.0.2.15","TCP","60","443  >  60374 [ACK] Seq=52034 Ack=2475 Win=65535 Len=0"
"1905","161.203193","10.0.2.15","149.154.167.99","TLSv1.2","237","Application Data"
"1906","161.203610","149.154.167.99","10.0.2.15","TCP","60","443  >  52862 [ACK] Seq=46710 Ack=33498 Win=65535 Len=0"
"1907","161.315690","149.154.167.99","10.0.2.15","TLSv1.2","167","Application Data"
"1908","161.315724","10.0.2.15","149.154.167.99","TCP","54","52862  >  443 [ACK] Seq=33498 Ack=46823 Win=65535 Len=0"
