"No.","Time","Source","Destination","Protocol","Length","Info"
"2","0.000045","10.0.2.15","104.18.0.32","TCP","54","38680  >  443 [ACK] Seq=1 Ack=40 Win=65535 Len=0"
"3","0.000000","104.18.0.32","10.0.2.15","TCP","60","443  >  38680 [FIN, ACK] Seq=40 Ack=1 Win=65535 Len=0"
"4","0.000348","10.0.2.15","104.18.0.32","TCP","54","38680  >  443 [FIN, ACK] Seq=1 Ack=41 Win=65535 Len=0"
"5","0.000708","104.18.0.32","10.0.2.15","TCP","60","443  >  38680 [ACK] Seq=41 Ack=2 Win=65535 Len=0"
"37","0.856067","10.0.2.15","104.18.0.32","TCP","54","38694  >  443 [ACK] Seq=1 Ack=40 Win=62780 Len=0"
"38","0.856294","10.0.2.15","104.18.0.32","TCP","54","38694  >  443 [FIN, ACK] Seq=1 Ack=40 Win=62780 Len=0"
"39","0.856602","104.18.0.32","10.0.2.15","TCP","60","443  >  38694 [ACK] Seq=40 Ack=2 Win=65535 Len=0"
"40","0.856789","104.18.0.32","10.0.2.15","TCP","60","443  >  38694 [FIN, ACK] Seq=40 Ack=2 Win=65535 Len=0"
"41","0.856805","10.0.2.15","104.18.0.32","TCP","54","38694  >  443 [ACK] Seq=2 Ack=41 Win=62780 Len=0"
"43","0.980385","149.154.167.99","10.0.2.15","TCP","60","443  >  34208 [ACK] Seq=1 Ack=184 Win=65535 Len=0"
"45","1.051585","10.0.2.15","149.154.167.99","TCP","54","34208  >  443 [ACK] Seq=184 Ack=114 Win=65535 Len=0"
"46","1.193041","10.0.2.15","23.59.70.11","TCP","54","43538  >  443 [ACK] Seq=1 Ack=1 Win=63936 Len=0"
"47","1.193532","23.59.70.11","10.0.2.15","TCP","60","[TCP ACKed unseen segment] 443  >  43538 [ACK] Seq=1 Ack=2 Win=65535 Len=0"
"94","2.080286","10.0.2.15","35.186.224.40","TCP","54","49032  >  443 [ACK] Seq=1 Ack=1413 Win=65535 Len=0"
"96","2.083175","10.0.2.15","35.186.224.40","TCP","54","49032  >  443 [ACK] Seq=1 Ack=2825 Win=65535 Len=0"
"98","2.083321","10.0.2.15","35.186.224.40","TCP","54","49032  >  443 [ACK] Seq=1 Ack=5001 Win=65535 Len=0"
"100","2.083852","10.0.2.15","35.186.224.40","TCP","54","49032  >  443 [ACK] Seq=1 Ack=6413 Win=65535 Len=0"
"102","2.084567","10.0.2.15","35.186.224.40","TCP","54","49032  >  443 [ACK] Seq=1 Ack=7825 Win=65535 Len=0"
"104","2.085129","10.0.2.15","35.186.224.40","TCP","54","49032  >  443 [ACK] Seq=1 Ack=12061 Win=65535 Len=0"
"106","2.085806","10.0.2.15","35.186.224.40","TCP","54","49032  >  443 [ACK] Seq=1 Ack=12501 Win=65535 Len=0"
"108","2.101856","10.0.2.15","35.186.224.40","TCP","54","49032  >  443 [ACK] Seq=1 Ack=13913 Win=65535 Len=0"
"110","2.103586","10.0.2.15","35.186.224.40","TCP","54","49032  >  443 [ACK] Seq=1 Ack=18149 Win=65535 Len=0"
"113","2.106778","10.0.2.15","35.186.224.40","TCP","54","49032  >  443 [ACK] Seq=1 Ack=26621 Win=65535 Len=0"
"115","2.106794","10.0.2.15","35.186.224.40","TCP","54","49032  >  443 [ACK] Seq=1 Ack=32269 Win=65535 Len=0"
"117","2.107377","10.0.2.15","35.186.224.40","TCP","54","49032  >  443 [ACK] Seq=1 Ack=33681 Win=65535 Len=0"
"119","2.109065","10.0.2.15","35.186.224.40","TCP","54","49032  >  443 [ACK] Seq=1 Ack=36505 Win=65535 Len=0"
"121","2.109685","10.0.2.15","35.186.224.40","TCP","54","49032  >  443 [ACK] Seq=1 Ack=40137 Win=65535 Len=0"
"266","3.241893","10.0.2.15","35.208.249.213","TCP","54","43198  >  443 [ACK] Seq=1 Ack=1 Win=62780 Len=0"
"267","3.242299","35.208.249.213","10.0.2.15","TCP","60","[TCP ACKed unseen segment] 443  >  43198 [ACK] Seq=1 Ack=2 Win=65535 Len=0"
"275","4.057973","149.154.167.99","10.0.2.15","TCP","60","443  >  34208 [ACK] Seq=114 Ack=367 Win=65535 Len=0"
"277","4.132545","10.0.2.15","149.154.167.99","TCP","54","34208  >  443 [ACK] Seq=367 Ack=227 Win=65535 Len=0"
"279","4.555253","10.0.2.15","146.75.121.108","TCP","54","44366  >  443 [FIN, ACK] Seq=1 Ack=1 Win=62780 Len=0"
"280","4.555325","10.0.2.15","213.57.23.147","TCP","54","40936  >  443 [FIN, ACK] Seq=1 Ack=1 Win=62780 Len=0"
"281","4.555355","10.0.2.15","213.57.24.147","TCP","54","37956  >  443 [FIN, ACK] Seq=1 Ack=1 Win=62780 Len=0"
"282","4.555380","10.0.2.15","173.222.107.27","TCP","54","58080  >  443 [FIN, ACK] Seq=1 Ack=1 Win=62780 Len=0"
"283","4.555429","10.0.2.15","173.222.107.27","TCP","54","58086  >  443 [FIN, ACK] Seq=1 Ack=1 Win=24816 Len=0"
"284","4.555448","10.0.2.15","173.222.107.27","TCP","54","36042  >  443 [FIN, ACK] Seq=1 Ack=1 Win=62780 Len=0"
"285","4.555490","10.0.2.15","173.222.107.27","TCP","54","36046  >  443 [FIN, ACK] Seq=1 Ack=1 Win=65535 Len=0"
"286","4.555542","10.0.2.15","23.59.68.45","TCP","54","46236  >  443 [FIN, ACK] Seq=1 Ack=1 Win=62780 Len=0"
"287","4.555582","10.0.2.15","23.59.70.11","TCP","54","[TCP Previous segment not captured] 43538  >  443 [FIN, ACK] Seq=2 Ack=1 Win=63936 Len=0"
"288","4.555706","10.0.2.15","104.26.9.169","TCP","54","35498  >  443 [RST, ACK] Seq=1 Ack=1 Win=62780 Len=0"
"290","4.555751","146.75.121.108","10.0.2.15","TCP","60","443  >  44366 [ACK] Seq=1 Ack=2 Win=65535 Len=0"
"291","4.555785","10.0.2.15","104.26.9.169","TCP","54","35506  >  443 [RST, ACK] Seq=1 Ack=1 Win=62780 Len=0"
"292","4.555819","10.0.2.15","23.59.68.64","TCP","54","35070  >  443 [FIN, ACK] Seq=1 Ack=1 Win=62780 Len=0"
"293","4.555864","213.57.23.147","10.0.2.15","TCP","60","443  >  40936 [ACK] Seq=1 Ack=2 Win=65535 Len=0"
"294","4.555864","213.57.24.147","10.0.2.15","TCP","60","443  >  37956 [ACK] Seq=1 Ack=2 Win=65535 Len=0"
"295","4.555864","173.222.107.27","10.0.2.15","TCP","60","443  >  58080 [ACK] Seq=1 Ack=2 Win=65535 Len=0"
"296","4.555864","173.222.107.27","10.0.2.15","TCP","60","443  >  58086 [ACK] Seq=1 Ack=2 Win=65535 Len=0"
"297","4.555864","173.222.107.27","10.0.2.15","TCP","60","443  >  36042 [ACK] Seq=1 Ack=2 Win=65535 Len=0"
"298","4.555907","10.0.2.15","23.59.68.64","TCP","54","35084  >  443 [FIN, ACK] Seq=1 Ack=1 Win=62780 Len=0"
"299","4.555946","173.222.107.27","10.0.2.15","TCP","60","443  >  36046 [ACK] Seq=1 Ack=2 Win=65535 Len=0"
"300","4.555946","23.59.68.45","10.0.2.15","TCP","60","443  >  46236 [ACK] Seq=1 Ack=2 Win=65535 Len=0"
"301","4.555946","23.59.70.11","10.0.2.15","TCP","60","[TCP ACKed unseen segment] 443  >  43538 [ACK] Seq=1 Ack=3 Win=65535 Len=0"
"302","4.555983","10.0.2.15","23.59.68.64","TCP","54","50734  >  443 [FIN, ACK] Seq=1 Ack=1 Win=62780 Len=0"
"303","4.556057","10.0.2.15","104.106.124.97","TCP","54","39038  >  443 [FIN, ACK] Seq=1 Ack=1 Win=62780 Len=0"
"304","4.556093","23.59.68.64","10.0.2.15","TCP","60","443  >  35070 [ACK] Seq=1 Ack=2 Win=65535 Len=0"
"305","4.556093","23.59.68.64","10.0.2.15","TCP","60","443  >  35084 [ACK] Seq=1 Ack=2 Win=65535 Len=0"
"306","4.556093","23.59.68.64","10.0.2.15","TCP","60","443  >  50734 [ACK] Seq=1 Ack=2 Win=65535 Len=0"
"307","4.556150","10.0.2.15","104.106.124.97","TCP","54","45252  >  443 [FIN, ACK] Seq=1 Ack=1 Win=62780 Len=0"
"308","4.556217","10.0.2.15","104.106.124.97","TCP","54","45262  >  443 [FIN, ACK] Seq=1 Ack=1 Win=63970 Len=0"
"309","4.556371","104.106.124.97","10.0.2.15","TCP","60","443  >  39038 [ACK] Seq=1 Ack=2 Win=65535 Len=0"
"310","4.556371","104.106.124.97","10.0.2.15","TCP","60","443  >  45252 [ACK] Seq=1 Ack=2 Win=65535 Len=0"
"311","4.556371","104.106.124.97","10.0.2.15","TCP","60","443  >  45262 [ACK] Seq=1 Ack=2 Win=65535 Len=0"
"317","4.571767","10.0.2.15","213.57.23.147","TCP","54","40936  >  443 [RST] Seq=2 Win=0 Len=0"
"318","4.571734","213.57.23.147","10.0.2.15","TCP","60","443  >  40936 [FIN, ACK] Seq=25 Ack=2 Win=65535 Len=0"
"319","4.571788","10.0.2.15","213.57.23.147","TCP","54","40936  >  443 [RST] Seq=2 Win=0 Len=0"
"320","4.572042","213.57.23.147","10.0.2.15","TCP","60","443  >  40936 [RST, ACK] Seq=4081906394 Ack=2 Win=0 Len=0"
"322","4.579345","10.0.2.15","213.57.24.147","TCP","54","37956  >  443 [RST] Seq=2 Win=0 Len=0"
"326","4.591395","10.0.2.15","213.57.24.219","TCP","74","60202  >  443 [SYN] Seq=0 Win=64240 Len=0 MSS=1460 SACK_PERM=1 TSval=2991010087 TSecr=0 WS=128"
"328","4.603780","213.57.24.219","10.0.2.15","TCP","60","443  >  60202 [SYN, ACK] Seq=0 Ack=1 Win=65535 Len=0 MSS=1460"
"329","4.603832","10.0.2.15","213.57.24.219","TCP","54","60202  >  443 [ACK] Seq=1 Ack=1 Win=64240 Len=0"
"331","4.604414","213.57.24.219","10.0.2.15","TCP","60","443  >  60202 [ACK] Seq=1 Ack=652 Win=65535 Len=0"
"333","4.620032","10.0.2.15","173.222.107.27","TCP","54","58080  >  443 [RST] Seq=2 Win=0 Len=0"
"334","4.620236","173.222.107.27","10.0.2.15","TCP","60","443  >  58080 [FIN, ACK] Seq=25 Ack=2 Win=65535 Len=0"
"335","4.620244","10.0.2.15","173.222.107.27","TCP","54","58080  >  443 [RST] Seq=2 Win=0 Len=0"
"336","4.620536","173.222.107.27","10.0.2.15","TCP","60","443  >  58080 [RST, ACK] Seq=4076721665 Ack=2 Win=0 Len=0"
"338","4.621803","10.0.2.15","213.57.24.219","TCP","54","60202  >  443 [ACK] Seq=652 Ack=271 Win=63970 Len=0"
"340","4.621826","10.0.2.15","173.222.107.27","TCP","54","36042  >  443 [RST] Seq=2 Win=0 Len=0"
"341","4.621779","173.222.107.27","10.0.2.15","TCP","60","443  >  36042 [FIN, ACK] Seq=25 Ack=2 Win=65535 Len=0"
"342","4.621837","10.0.2.15","173.222.107.27","TCP","54","36042  >  443 [RST] Seq=2 Win=0 Len=0"
"343","4.622104","173.222.107.27","10.0.2.15","TCP","60","443  >  36042 [RST, ACK] Seq=4057376522 Ack=2 Win=0 Len=0"
"346","4.622465","213.57.24.219","10.0.2.15","TCP","60","443  >  60202 [ACK] Seq=271 Ack=732 Win=65535 Len=0"
"347","4.622465","213.57.24.219","10.0.2.15","TCP","60","443  >  60202 [ACK] Seq=271 Ack=1525 Win=65535 Len=0"
"349","4.624453","10.0.2.15","173.222.107.27","TCP","54","36046  >  443 [RST] Seq=2 Win=0 Len=0"
"351","4.627559","10.0.2.15","173.222.107.27","TCP","54","58086  >  443 [RST] Seq=2 Win=0 Len=0"
"353","4.632641","10.0.2.15","104.106.124.97","TCP","54","39038  >  443 [RST] Seq=2 Win=0 Len=0"
"354","4.632591","104.106.124.97","10.0.2.15","TCP","60","443  >  39038 [FIN, ACK] Seq=25 Ack=2 Win=65535 Len=0"
"355","4.632665","10.0.2.15","104.106.124.97","TCP","54","39038  >  443 [RST] Seq=2 Win=0 Len=0"
"356","4.632829","104.106.124.97","10.0.2.15","TCP","60","443  >  39038 [RST, ACK] Seq=4075825360 Ack=2 Win=0 Len=0"
"358","4.633025","10.0.2.15","146.75.121.108","TCP","54","44366  >  443 [RST] Seq=2 Win=0 Len=0"
"359","4.633012","146.75.121.108","10.0.2.15","TCP","60","443  >  44366 [FIN, ACK] Seq=32 Ack=2 Win=65535 Len=0"
"360","4.633040","10.0.2.15","146.75.121.108","TCP","54","44366  >  443 [RST] Seq=2 Win=0 Len=0"
"361","4.633320","146.75.121.108","10.0.2.15","TCP","60","443  >  44366 [RST, ACK] Seq=4075613622 Ack=2 Win=0 Len=0"
"363","4.633475","10.0.2.15","104.106.124.97","TCP","54","45252  >  443 [RST] Seq=2 Win=0 Len=0"
"364","4.633463","104.106.124.97","10.0.2.15","TCP","60","443  >  45252 [FIN, ACK] Seq=25 Ack=2 Win=65535 Len=0"
"365","4.633487","10.0.2.15","104.106.124.97","TCP","54","45252  >  443 [RST] Seq=2 Win=0 Len=0"
"366","4.633698","104.106.124.97","10.0.2.15","TCP","60","443  >  45252 [RST, ACK] Seq=4056683767 Ack=2 Win=0 Len=0"
"369","4.643746","10.0.2.15","213.57.24.219","TCP","54","60202  >  443 [ACK] Seq=1525 Ack=1153 Win=63970 Len=0"
"371","4.645533","10.0.2.15","104.106.124.97","TCP","54","45262  >  443 [RST] Seq=2 Win=0 Len=0"
"372","4.646608","213.57.24.219","10.0.2.15","TCP","2974","443  >  60202 [PSH, ACK] Seq=1153 Ack=1525 Win=65535 Len=2920 [TCP segment of a reassembled PDU]"
"373","4.646699","10.0.2.15","213.57.24.219","TCP","54","60202  >  443 [ACK] Seq=1525 Ack=4073 Win=63970 Len=0"
"375","4.646904","10.0.2.15","23.59.68.64","TCP","54","50734  >  443 [RST] Seq=2 Win=0 Len=0"
"376","4.647563","213.57.24.219","10.0.2.15","TCP","1514","443  >  60202 [PSH, ACK] Seq=4073 Ack=1525 Win=65535 Len=1460 [TCP segment of a reassembled PDU]"
"377","4.653679","213.57.24.219","10.0.2.15","TCP","5894","443  >  60202 [PSH, ACK] Seq=5533 Ack=1525 Win=65535 Len=5840 [TCP segment of a reassembled PDU]"
"379","4.653716","10.0.2.15","23.59.68.64","TCP","54","35070  >  443 [RST] Seq=2 Win=0 Len=0"
"380","4.653800","23.59.68.64","10.0.2.15","TCP","60","443  >  35070 [FIN, ACK] Seq=32 Ack=2 Win=65535 Len=0"
"381","4.653806","10.0.2.15","23.59.68.64","TCP","54","35070  >  443 [RST] Seq=2 Win=0 Len=0"
"382","4.653966","23.59.68.64","10.0.2.15","TCP","60","443  >  35070 [RST, ACK] Seq=4073840885 Ack=2 Win=0 Len=0"
"383","4.654274","10.0.2.15","213.57.24.219","TCP","54","60202  >  443 [ACK] Seq=1525 Ack=11373 Win=63970 Len=0"
"385","4.654494","10.0.2.15","213.57.24.219","TCP","54","60202  >  443 [ACK] Seq=1525 Ack=20133 Win=63970 Len=0"
"386","4.654663","213.57.24.219","10.0.2.15","TCP","10274","443  >  60202 [ACK] Seq=20133 Ack=1525 Win=65535 Len=10220 [TCP segment of a reassembled PDU]"
"387","4.654888","10.0.2.15","213.57.24.219","TCP","54","60202  >  443 [ACK] Seq=1525 Ack=30353 Win=63970 Len=0"
"389","4.655047","10.0.2.15","213.57.24.219","TCP","54","60202  >  443 [ACK] Seq=1525 Ack=42033 Win=63970 Len=0"
"391","4.655146","10.0.2.15","23.59.68.64","TCP","54","35084  >  443 [RST] Seq=2 Win=0 Len=0"
"392","4.655135","23.59.68.64","10.0.2.15","TCP","60","443  >  35084 [FIN, ACK] Seq=32 Ack=2 Win=65535 Len=0"
"393","4.655158","10.0.2.15","23.59.68.64","TCP","54","35084  >  443 [RST] Seq=2 Win=0 Len=0"
"395","4.655166","10.0.2.15","23.59.70.11","TCP","54","43538  >  443 [RST] Seq=3 Win=0 Len=0"
"396","4.655349","213.57.24.219","10.0.2.15","TCP","13194","443  >  60202 [ACK] Seq=42033 Ack=1525 Win=65535 Len=13140 [TCP segment of a reassembled PDU]"
"397","4.655398","23.59.68.64","10.0.2.15","TCP","60","443  >  35084 [RST, ACK] Seq=4073772253 Ack=2 Win=0 Len=0"
"399","4.655544","10.0.2.15","23.59.68.45","TCP","54","46236  >  443 [RST] Seq=2 Win=0 Len=0"
"400","4.655535","23.59.68.45","10.0.2.15","TCP","60","443  >  46236 [FIN, ACK] Seq=25 Ack=2 Win=65535 Len=0"
"401","4.655553","10.0.2.15","23.59.68.45","TCP","54","46236  >  443 [RST] Seq=2 Win=0 Len=0"
"402","4.655646","10.0.2.15","213.57.24.219","TCP","54","60202  >  443 [ACK] Seq=1525 Ack=55173 Win=63970 Len=0"
"403","4.655853","23.59.68.45","10.0.2.15","TCP","60","443  >  46236 [RST, ACK] Seq=4081394008 Ack=2 Win=0 Len=0"
"405","4.655886","10.0.2.15","213.57.24.219","TCP","54","60202  >  443 [ACK] Seq=1525 Ack=58439 Win=63970 Len=0"
"406","4.656846","213.57.24.219","10.0.2.15","TCP","1514","443  >  60202 [PSH, ACK] Seq=58439 Ack=1525 Win=65535 Len=1460 [TCP segment of a reassembled PDU]"
"407","4.657294","213.57.24.219","10.0.2.15","TCP","2974","443  >  60202 [PSH, ACK] Seq=59899 Ack=1525 Win=65535 Len=2920 [TCP segment of a reassembled PDU]"
"408","4.657334","10.0.2.15","213.57.24.219","TCP","54","60202  >  443 [ACK] Seq=1525 Ack=62819 Win=63970 Len=0"
"409","4.658142","213.57.24.219","10.0.2.15","TCP","1514","443  >  60202 [PSH, ACK] Seq=62819 Ack=1525 Win=65535 Len=1460 [TCP segment of a reassembled PDU]"
"410","4.659270","213.57.24.219","10.0.2.15","TCP","1440","443  >  60202 [PSH, ACK] Seq=64279 Ack=1525 Win=65535 Len=1386 [TCP segment of a reassembled PDU]"
"411","4.659297","10.0.2.15","213.57.24.219","TCP","54","60202  >  443 [ACK] Seq=1525 Ack=65665 Win=63970 Len=0"
"412","4.665722","213.57.24.219","10.0.2.15","TCP","1514","443  >  60202 [PSH, ACK] Seq=65665 Ack=1525 Win=65535 Len=1460 [TCP segment of a reassembled PDU]"
"413","4.666440","213.57.24.219","10.0.2.15","TCP","2538","443  >  60202 [PSH, ACK] Seq=67125 Ack=1525 Win=65535 Len=2484 [TCP segment of a reassembled PDU]"
"414","4.666453","10.0.2.15","213.57.24.219","TCP","54","60202  >  443 [ACK] Seq=1525 Ack=69609 Win=65535 Len=0"
"415","4.669541","213.57.24.219","10.0.2.15","TCP","1514","443  >  60202 [PSH, ACK] Seq=69609 Ack=1525 Win=65535 Len=1460 [TCP segment of a reassembled PDU]"
"416","4.670088","213.57.24.219","10.0.2.15","TCP","1514","443  >  60202 [PSH, ACK] Seq=71069 Ack=1525 Win=65535 Len=1460 [TCP segment of a reassembled PDU]"
"417","4.670097","10.0.2.15","213.57.24.219","TCP","54","60202  >  443 [ACK] Seq=1525 Ack=72529 Win=65535 Len=0"
"419","4.671584","10.0.2.15","213.57.24.219","TCP","54","60202  >  443 [ACK] Seq=1525 Ack=78369 Win=65535 Len=0"
"421","4.671715","10.0.2.15","213.57.24.219","TCP","54","60202  >  443 [ACK] Seq=1525 Ack=81799 Win=65535 Len=0"
"422","4.672038","213.57.24.219","10.0.2.15","TCP","1514","443  >  60202 [PSH, ACK] Seq=81799 Ack=1525 Win=65535 Len=1460 [TCP segment of a reassembled PDU]"
"423","4.673678","213.57.24.219","10.0.2.15","TCP","2974","443  >  60202 [PSH, ACK] Seq=83259 Ack=1525 Win=65535 Len=2920 [TCP segment of a reassembled PDU]"
"424","4.673697","10.0.2.15","213.57.24.219","TCP","54","60202  >  443 [ACK] Seq=1525 Ack=86179 Win=65535 Len=0"
"425","4.673824","213.57.24.219","10.0.2.15","TCP","2974","443  >  60202 [PSH, ACK] Seq=86179 Ack=1525 Win=65535 Len=2920 [TCP segment of a reassembled PDU]"
"426","4.673837","10.0.2.15","213.57.24.219","TCP","54","60202  >  443 [ACK] Seq=1525 Ack=89099 Win=65535 Len=0"
"427","4.674170","213.57.24.219","10.0.2.15","TCP","2974","443  >  60202 [PSH, ACK] Seq=89099 Ack=1525 Win=65535 Len=2920 [TCP segment of a reassembled PDU]"
"428","4.674178","10.0.2.15","213.57.24.219","TCP","54","60202  >  443 [ACK] Seq=1525 Ack=92019 Win=65535 Len=0"
"429","4.674580","213.57.24.219","10.0.2.15","TCP","2974","443  >  60202 [PSH, ACK] Seq=92019 Ack=1525 Win=65535 Len=2920 [TCP segment of a reassembled PDU]"
"430","4.674591","10.0.2.15","213.57.24.219","TCP","54","60202  >  443 [ACK] Seq=1525 Ack=94939 Win=65535 Len=0"
"431","4.675105","213.57.24.219","10.0.2.15","TCP","2974","443  >  60202 [PSH, ACK] Seq=94939 Ack=1525 Win=65535 Len=2920 [TCP segment of a reassembled PDU]"
"432","4.675115","10.0.2.15","213.57.24.219","TCP","54","60202  >  443 [ACK] Seq=1525 Ack=97859 Win=65535 Len=0"
"434","4.675484","10.0.2.15","213.57.24.219","TCP","54","60202  >  443 [ACK] Seq=1525 Ack=100779 Win=65535 Len=0"
"435","4.675774","213.57.24.219","10.0.2.15","TCP","2974","443  >  60202 [PSH, ACK] Seq=100779 Ack=1525 Win=65535 Len=2920 [TCP segment of a reassembled PDU]"
"436","4.675802","10.0.2.15","213.57.24.219","TCP","54","60202  >  443 [ACK] Seq=1525 Ack=103699 Win=65535 Len=0"
"437","4.676190","213.57.24.219","10.0.2.15","TCP","2974","443  >  60202 [PSH, ACK] Seq=103699 Ack=1525 Win=65535 Len=2920 [TCP segment of a reassembled PDU]"
"438","4.676200","10.0.2.15","213.57.24.219","TCP","54","60202  >  443 [ACK] Seq=1525 Ack=106619 Win=65535 Len=0"
"439","4.676478","213.57.24.219","10.0.2.15","TCP","2974","443  >  60202 [PSH, ACK] Seq=106619 Ack=1525 Win=65535 Len=2920 [TCP segment of a reassembled PDU]"
"440","4.676488","10.0.2.15","213.57.24.219","TCP","54","60202  >  443 [ACK] Seq=1525 Ack=109539 Win=65535 Len=0"
"441","4.676897","213.57.24.219","10.0.2.15","TCP","2974","443  >  60202 [PSH, ACK] Seq=109539 Ack=1525 Win=65535 Len=2920 [TCP segment of a reassembled PDU]"
"442","4.676905","10.0.2.15","213.57.24.219","TCP","54","60202  >  443 [ACK] Seq=1525 Ack=112459 Win=65535 Len=0"
"444","4.681018","10.0.2.15","213.57.24.219","TCP","54","60202  >  443 [ACK] Seq=1525 Ack=115379 Win=65535 Len=0"
"445","4.681241","213.57.24.219","10.0.2.15","TCP","2974","443  >  60202 [PSH, ACK] Seq=115379 Ack=1525 Win=65535 Len=2920 [TCP segment of a reassembled PDU]"
"446","4.681252","10.0.2.15","213.57.24.219","TCP","54","60202  >  443 [ACK] Seq=1525 Ack=118299 Win=65535 Len=0"
"447","4.681800","213.57.24.219","10.0.2.15","TCP","2974","443  >  60202 [PSH, ACK] Seq=118299 Ack=1525 Win=65535 Len=2920 [TCP segment of a reassembled PDU]"
"448","4.681814","10.0.2.15","213.57.24.219","TCP","54","60202  >  443 [ACK] Seq=1525 Ack=121219 Win=65535 Len=0"
"450","4.682039","10.0.2.15","213.57.24.219","TCP","54","60202  >  443 [ACK] Seq=1525 Ack=124139 Win=65535 Len=0"
"451","4.682806","213.57.24.219","10.0.2.15","TCP","2974","443  >  60202 [PSH, ACK] Seq=124139 Ack=1525 Win=65535 Len=2920 [TCP segment of a reassembled PDU]"
"452","4.682815","10.0.2.15","213.57.24.219","TCP","54","60202  >  443 [ACK] Seq=1525 Ack=127059 Win=65535 Len=0"
"453","4.683742","213.57.24.219","10.0.2.15","TCP","1514","443  >  60202 [PSH, ACK] Seq=127059 Ack=1525 Win=65535 Len=1460 [TCP segment of a reassembled PDU]"
"454","4.684110","213.57.24.219","10.0.2.15","TCP","2974","443  >  60202 [PSH, ACK] Seq=128519 Ack=1525 Win=65535 Len=2920 [TCP segment of a reassembled PDU]"
"455","4.684120","10.0.2.15","213.57.24.219","TCP","54","60202  >  443 [ACK] Seq=1525 Ack=131439 Win=65535 Len=0"
"457","4.684546","10.0.2.15","213.57.24.219","TCP","54","60202  >  443 [ACK] Seq=1525 Ack=135145 Win=65535 Len=0"
"458","4.686555","213.57.24.219","10.0.2.15","TCP","5894","443  >  60202 [PSH, ACK] Seq=135145 Ack=1525 Win=65535 Len=5840 [TCP segment of a reassembled PDU]"
"459","4.686568","10.0.2.15","213.57.24.219","TCP","54","60202  >  443 [ACK] Seq=1525 Ack=140985 Win=65535 Len=0"
"460","4.686959","213.57.24.219","10.0.2.15","TCP","3648","443  >  60202 [PSH, ACK] Seq=140985 Ack=1525 Win=65535 Len=3594 [TCP segment of a reassembled PDU]"
"461","4.686969","10.0.2.15","213.57.24.219","TCP","54","60202  >  443 [ACK] Seq=1525 Ack=144579 Win=65535 Len=0"
"462","4.692537","213.57.24.219","10.0.2.15","TCP","2974","443  >  60202 [PSH, ACK] Seq=144579 Ack=1525 Win=65535 Len=2920 [TCP segment of a reassembled PDU]"
"463","4.692590","10.0.2.15","213.57.24.219","TCP","54","60202  >  443 [ACK] Seq=1525 Ack=147499 Win=65535 Len=0"
"464","4.693017","213.57.24.219","10.0.2.15","TCP","2974","443  >  60202 [PSH, ACK] Seq=147499 Ack=1525 Win=65535 Len=2920 [TCP segment of a reassembled PDU]"
"465","4.693028","10.0.2.15","213.57.24.219","TCP","54","60202  >  443 [ACK] Seq=1525 Ack=150419 Win=65535 Len=0"
"467","4.693280","10.0.2.15","213.57.24.219","TCP","54","60202  >  443 [ACK] Seq=1525 Ack=153339 Win=65535 Len=0"
"468","4.693803","213.57.24.219","10.0.2.15","TCP","2974","443  >  60202 [PSH, ACK] Seq=153339 Ack=1525 Win=65535 Len=2920 [TCP segment of a reassembled PDU]"
"469","4.693810","10.0.2.15","213.57.24.219","TCP","54","60202  >  443 [ACK] Seq=1525 Ack=156259 Win=65535 Len=0"
"470","4.694120","213.57.24.219","10.0.2.15","TCP","2974","443  >  60202 [PSH, ACK] Seq=156259 Ack=1525 Win=65535 Len=2920 [TCP segment of a reassembled PDU]"
"471","4.694127","10.0.2.15","213.57.24.219","TCP","54","60202  >  443 [ACK] Seq=1525 Ack=159179 Win=65535 Len=0"
"473","4.696919","10.0.2.15","213.57.24.219","TCP","54","60202  >  443 [ACK] Seq=1525 Ack=166929 Win=65535 Len=0"
"476","5.288091","10.0.2.15","35.186.253.211","TCP","54","39300  >  443 [ACK] Seq=1 Ack=1 Win=63540 Len=0"
"477","5.288500","35.186.253.211","10.0.2.15","TCP","60","[TCP ACKed unseen segment] 443  >  39300 [ACK] Seq=1 Ack=2 Win=65535 Len=0"
"479","5.740820","172.67.154.71","10.0.2.15","TCP","60","443  >  49654 [FIN, ACK] Seq=40 Ack=1 Win=65535 Len=0"
"480","5.741048","10.0.2.15","172.67.154.71","TCP","54","49654  >  443 [FIN, ACK] Seq=1 Ack=41 Win=62780 Len=0"
"481","5.741311","172.67.154.71","10.0.2.15","TCP","60","443  >  49654 [ACK] Seq=41 Ack=2 Win=65535 Len=0"
"483","5.755903","10.0.2.15","104.22.5.69","TCP","54","57272  >  443 [FIN, ACK] Seq=1 Ack=40 Win=62780 Len=0"
"484","5.756343","104.22.5.69","10.0.2.15","TCP","60","443  >  57272 [ACK] Seq=40 Ack=2 Win=65535 Len=0"
"485","5.756568","104.22.5.69","10.0.2.15","TCP","60","443  >  57272 [FIN, ACK] Seq=40 Ack=2 Win=65535 Len=0"
"486","5.756587","10.0.2.15","104.22.5.69","TCP","54","57272  >  443 [ACK] Seq=2 Ack=41 Win=62780 Len=0"
"488","5.888568","10.0.2.15","104.19.159.19","TCP","54","34414  >  443 [ACK] Seq=1 Ack=47 Win=62780 Len=0"
"489","5.888736","104.19.159.19","10.0.2.15","TCP","60","443  >  34414 [FIN, ACK] Seq=47 Ack=1 Win=65535 Len=0"
"490","5.888804","10.0.2.15","104.19.159.19","TCP","54","34414  >  443 [FIN, ACK] Seq=1 Ack=48 Win=62780 Len=0"
"491","5.889042","104.19.159.19","10.0.2.15","TCP","60","443  >  34414 [ACK] Seq=48 Ack=2 Win=65535 Len=0"
"493","7.055172","35.186.224.40","10.0.2.15","TCP","60","443  >  49032 [ACK] Seq=40137 Ack=44 Win=65535 Len=0"
"495","7.133778","10.0.2.15","35.186.224.40","TCP","54","49032  >  443 [ACK] Seq=44 Ack=40177 Win=65535 Len=0"
"497","7.139426","149.154.167.99","10.0.2.15","TCP","60","443  >  34208 [ACK] Seq=227 Ack=550 Win=65535 Len=0"
"499","7.212577","10.0.2.15","149.154.167.99","TCP","54","34208  >  443 [ACK] Seq=550 Ack=340 Win=65535 Len=0"
"500","7.336250","10.0.2.15","142.250.184.195","TCP","54","57436  >  443 [ACK] Seq=1 Ack=1 Win=62780 Len=0"
"501","7.336761","142.250.184.195","10.0.2.15","TCP","60","[TCP ACKed unseen segment] 443  >  57436 [ACK] Seq=1 Ack=2 Win=65535 Len=0"
"502","7.340096","10.0.2.15","35.190.60.146","TCP","54","44574  >  443 [ACK] Seq=1 Ack=1 Win=62780 Len=0"
"503","7.340155","10.0.2.15","35.186.193.173","TCP","54","46258  >  443 [ACK] Seq=1 Ack=1 Win=62780 Len=0"
"504","7.340555","35.190.60.146","10.0.2.15","TCP","60","[TCP ACKed unseen segment] 443  >  44574 [ACK] Seq=1 Ack=2 Win=65535 Len=0"
"505","7.340555","35.186.193.173","10.0.2.15","TCP","60","[TCP ACKed unseen segment] 443  >  46258 [ACK] Seq=1 Ack=2 Win=65535 Len=0"
"533","9.082603","149.154.167.99","10.0.2.15","TCP","60","443  >  34208 [ACK] Seq=340 Ack=717 Win=65535 Len=0"
"546","9.188912","10.0.2.15","149.154.167.99","TCP","54","34208  >  443 [ACK] Seq=717 Ack=453 Win=65535 Len=0"
"553","10.222129","149.154.167.99","10.0.2.15","TCP","60","443  >  34208 [ACK] Seq=453 Ack=900 Win=65535 Len=0"
"557","10.296339","10.0.2.15","149.154.167.99","TCP","54","34208  >  443 [ACK] Seq=900 Ack=566 Win=65535 Len=0"
"565","11.343288","149.154.167.99","10.0.2.15","TCP","60","443  >  34208 [ACK] Seq=566 Ack=1259 Win=65535 Len=0"
"566","11.432022","10.0.2.15","172.67.188.164","TCP","54","41034  >  443 [ACK] Seq=1 Ack=1 Win=65535 Len=0"
"567","11.432413","172.67.188.164","10.0.2.15","TCP","60","[TCP ACKed unseen segment] 443  >  41034 [ACK] Seq=1 Ack=2 Win=65535 Len=0"
"569","11.442768","10.0.2.15","149.154.167.99","TCP","54","34208  >  443 [ACK] Seq=1259 Ack=745 Win=65535 Len=0"
"571","11.527212","104.22.55.232","10.0.2.15","TCP","60","443  >  59070 [FIN, ACK] Seq=40 Ack=1 Win=65535 Len=0"
"572","11.527472","10.0.2.15","104.22.55.232","TCP","54","59070  >  443 [FIN, ACK] Seq=1 Ack=41 Win=62780 Len=0"
"573","11.527806","104.22.55.232","10.0.2.15","TCP","60","443  >  59070 [ACK] Seq=41 Ack=2 Win=65535 Len=0"
"575","12.563983","149.154.167.99","10.0.2.15","TCP","60","443  >  34208 [ACK] Seq=745 Ack=1426 Win=65535 Len=0"
"577","12.651174","10.0.2.15","149.154.167.99","TCP","54","34208  >  443 [ACK] Seq=1426 Ack=858 Win=65535 Len=0"
"581","13.338594","149.154.167.99","10.0.2.15","TCP","60","443  >  34208 [ACK] Seq=858 Ack=1609 Win=65535 Len=0"
"583","13.409456","10.0.2.15","149.154.167.99","TCP","54","34208  >  443 [ACK] Seq=1609 Ack=971 Win=65535 Len=0"
"584","13.480970","10.0.2.15","34.111.113.62","TCP","54","33216  >  443 [ACK] Seq=1 Ack=1 Win=62780 Len=0"
"585","13.481041","10.0.2.15","146.75.121.253","TCP","54","46990  >  443 [ACK] Seq=1 Ack=1 Win=62780 Len=0"
"586","13.481090","10.0.2.15","35.244.159.8","TCP","54","43640  >  443 [ACK] Seq=1 Ack=1 Win=63540 Len=0"
"587","13.481108","10.0.2.15","35.227.252.103","TCP","54","52456  >  443 [ACK] Seq=1 Ack=1 Win=62780 Len=0"
"588","13.481358","34.111.113.62","10.0.2.15","TCP","60","[TCP ACKed unseen segment] 443  >  33216 [ACK] Seq=1 Ack=2 Win=65535 Len=0"
"589","13.481358","146.75.121.253","10.0.2.15","TCP","60","[TCP ACKed unseen segment] 443  >  46990 [ACK] Seq=1 Ack=2 Win=65535 Len=0"
"590","13.481358","35.244.159.8","10.0.2.15","TCP","60","[TCP ACKed unseen segment] 443  >  43640 [ACK] Seq=1 Ack=2 Win=65535 Len=0"
"591","13.481358","35.227.252.103","10.0.2.15","TCP","60","[TCP ACKed unseen segment] 443  >  52456 [ACK] Seq=1 Ack=2 Win=65535 Len=0"
"602","14.390706","213.57.24.219","10.0.2.15","TCP","60","443  >  60202 [ACK] Seq=166929 Ack=2318 Win=65535 Len=0"
"604","14.405499","10.0.2.15","213.57.24.219","TCP","54","60202  >  443 [ACK] Seq=2318 Ack=170428 Win=65535 Len=0"
"605","14.406254","213.57.24.219","10.0.2.15","TCP","2974","443  >  60202 [PSH, ACK] Seq=170428 Ack=2318 Win=65535 Len=2920 [TCP segment of a reassembled PDU]"
"606","14.406273","10.0.2.15","213.57.24.219","TCP","54","60202  >  443 [ACK] Seq=2318 Ack=173348 Win=65535 Len=0"
"608","14.406971","213.57.24.219","10.0.2.15","TCP","2974","443  >  60202 [PSH, ACK] Seq=173348 Ack=2318 Win=65535 Len=2920 [TCP segment of a reassembled PDU]"
"609","14.406984","10.0.2.15","213.57.24.219","TCP","54","60202  >  443 [ACK] Seq=2318 Ack=176268 Win=65535 Len=0"
"610","14.407226","213.57.24.219","10.0.2.15","TCP","2974","443  >  60202 [PSH, ACK] Seq=176268 Ack=2318 Win=65535 Len=2920 [TCP segment of a reassembled PDU]"
"611","14.407239","10.0.2.15","213.57.24.219","TCP","54","60202  >  443 [ACK] Seq=2318 Ack=179188 Win=65535 Len=0"
"612","14.407797","213.57.24.219","10.0.2.15","TCP","2974","443  >  60202 [PSH, ACK] Seq=179188 Ack=2318 Win=65535 Len=2920 [TCP segment of a reassembled PDU]"
"613","14.407810","10.0.2.15","213.57.24.219","TCP","54","60202  >  443 [ACK] Seq=2318 Ack=182108 Win=65535 Len=0"
"615","14.408065","10.0.2.15","213.57.24.219","TCP","54","60202  >  443 [ACK] Seq=2318 Ack=185028 Win=65535 Len=0"
"616","14.408451","213.57.24.219","10.0.2.15","TCP","2974","443  >  60202 [PSH, ACK] Seq=185028 Ack=2318 Win=65535 Len=2920 [TCP segment of a reassembled PDU]"
"617","14.408457","10.0.2.15","213.57.24.219","TCP","54","60202  >  443 [ACK] Seq=2318 Ack=187948 Win=65535 Len=0"
"618","14.408638","213.57.24.219","10.0.2.15","TCP","2974","443  >  60202 [PSH, ACK] Seq=187948 Ack=2318 Win=65535 Len=2920 [TCP segment of a reassembled PDU]"
"619","14.408643","10.0.2.15","213.57.24.219","TCP","54","60202  >  443 [ACK] Seq=2318 Ack=190868 Win=65535 Len=0"
"620","14.409006","213.57.24.219","10.0.2.15","TCP","2974","443  >  60202 [PSH, ACK] Seq=190868 Ack=2318 Win=65535 Len=2920 [TCP segment of a reassembled PDU]"
"621","14.409012","10.0.2.15","213.57.24.219","TCP","54","60202  >  443 [ACK] Seq=2318 Ack=193788 Win=65535 Len=0"
"622","14.409491","213.57.24.219","10.0.2.15","TCP","2974","443  >  60202 [PSH, ACK] Seq=193788 Ack=2318 Win=65535 Len=2920 [TCP segment of a reassembled PDU]"
"623","14.409497","10.0.2.15","213.57.24.219","TCP","54","60202  >  443 [ACK] Seq=2318 Ack=196708 Win=65535 Len=0"
"625","14.409792","10.0.2.15","213.57.24.219","TCP","54","60202  >  443 [ACK] Seq=2318 Ack=200320 Win=65535 Len=0"
"626","14.410316","213.57.24.219","10.0.2.15","TCP","2974","443  >  60202 [PSH, ACK] Seq=200320 Ack=2318 Win=65535 Len=2920 [TCP segment of a reassembled PDU]"
"627","14.410323","10.0.2.15","213.57.24.219","TCP","54","60202  >  443 [ACK] Seq=2318 Ack=203240 Win=65535 Len=0"
"629","14.410663","10.0.2.15","213.57.24.219","TCP","54","60202  >  443 [ACK] Seq=2318 Ack=206160 Win=65535 Len=0"
"630","14.411028","213.57.24.219","10.0.2.15","TCP","2974","443  >  60202 [PSH, ACK] Seq=206160 Ack=2318 Win=65535 Len=2920 [TCP segment of a reassembled PDU]"
"631","14.411039","10.0.2.15","213.57.24.219","TCP","54","60202  >  443 [ACK] Seq=2318 Ack=209080 Win=65535 Len=0"
"632","14.411346","213.57.24.219","10.0.2.15","TCP","2974","443  >  60202 [PSH, ACK] Seq=209080 Ack=2318 Win=65535 Len=2920 [TCP segment of a reassembled PDU]"
"633","14.411360","10.0.2.15","213.57.24.219","TCP","54","60202  >  443 [ACK] Seq=2318 Ack=212000 Win=65535 Len=0"
"634","14.411841","213.57.24.219","10.0.2.15","TCP","2974","443  >  60202 [PSH, ACK] Seq=212000 Ack=2318 Win=65535 Len=2920 [TCP segment of a reassembled PDU]"
"635","14.411864","10.0.2.15","213.57.24.219","TCP","54","60202  >  443 [ACK] Seq=2318 Ack=214920 Win=65535 Len=0"
"636","14.412326","213.57.24.219","10.0.2.15","TCP","2974","443  >  60202 [PSH, ACK] Seq=214920 Ack=2318 Win=65535 Len=2920 [TCP segment of a reassembled PDU]"
"637","14.412334","10.0.2.15","213.57.24.219","TCP","54","60202  >  443 [ACK] Seq=2318 Ack=217840 Win=65535 Len=0"
"638","14.414293","213.57.24.219","10.0.2.15","TCP","2974","443  >  60202 [PSH, ACK] Seq=217840 Ack=2318 Win=65535 Len=2920 [TCP segment of a reassembled PDU]"
"639","14.414304","10.0.2.15","213.57.24.219","TCP","54","60202  >  443 [ACK] Seq=2318 Ack=220760 Win=65535 Len=0"
"641","14.414585","10.0.2.15","213.57.24.219","TCP","54","60202  >  443 [ACK] Seq=2318 Ack=235360 Win=65535 Len=0"
"642","14.416819","213.57.24.219","10.0.2.15","TCP","1514","443  >  60202 [PSH, ACK] Seq=235360 Ack=2318 Win=65535 Len=1460 [TCP segment of a reassembled PDU]"
"644","14.426010","10.0.2.15","213.57.24.219","TCP","54","60202  >  443 [ACK] Seq=2318 Ack=258720 Win=65535 Len=0"
"646","14.426515","10.0.2.15","213.57.24.219","TCP","54","60202  >  443 [ACK] Seq=2318 Ack=273320 Win=65535 Len=0"
"648","14.427236","10.0.2.15","213.57.24.219","TCP","54","60202  >  443 [ACK] Seq=2318 Ack=285000 Win=65535 Len=0"
"650","14.427305","10.0.2.15","213.57.24.219","TCP","54","60202  >  443 [ACK] Seq=2318 Ack=298257 Win=65535 Len=0"
"651","14.431056","213.57.24.219","10.0.2.15","TCP","1514","443  >  60202 [PSH, ACK] Seq=298257 Ack=2318 Win=65535 Len=1460 [TCP segment of a reassembled PDU]"
"652","14.431488","213.57.24.219","10.0.2.15","TCP","2093","443  >  60202 [PSH, ACK] Seq=299717 Ack=2318 Win=65535 Len=2039 [TCP segment of a reassembled PDU]"
"653","14.431499","10.0.2.15","213.57.24.219","TCP","54","60202  >  443 [ACK] Seq=2318 Ack=301756 Win=65535 Len=0"
"657","14.437132","10.0.2.15","213.57.24.219","TCP","54","60202  >  443 [ACK] Seq=2318 Ack=306136 Win=65535 Len=0"
"658","14.437626","213.57.24.219","10.0.2.15","TCP","2974","443  >  60202 [PSH, ACK] Seq=306136 Ack=2318 Win=65535 Len=2920 [TCP segment of a reassembled PDU]"
"659","14.437649","10.0.2.15","213.57.24.219","TCP","54","60202  >  443 [ACK] Seq=2318 Ack=309056 Win=65535 Len=0"
"660","14.437977","213.57.24.219","10.0.2.15","TCP","4434","443  >  60202 [PSH, ACK] Seq=309056 Ack=2318 Win=65535 Len=4380 [TCP segment of a reassembled PDU]"
"661","14.437986","10.0.2.15","213.57.24.219","TCP","54","60202  >  443 [ACK] Seq=2318 Ack=313436 Win=65535 Len=0"
"662","14.438414","213.57.24.219","10.0.2.15","TCP","2974","443  >  60202 [PSH, ACK] Seq=313436 Ack=2318 Win=65535 Len=2920 [TCP segment of a reassembled PDU]"
"663","14.438421","10.0.2.15","213.57.24.219","TCP","54","60202  >  443 [ACK] Seq=2318 Ack=316356 Win=65535 Len=0"
"665","14.438802","10.0.2.15","213.57.24.219","TCP","54","60202  >  443 [ACK] Seq=2318 Ack=319276 Win=65535 Len=0"
"666","14.439123","213.57.24.219","10.0.2.15","TCP","2974","443  >  60202 [PSH, ACK] Seq=319276 Ack=2318 Win=65535 Len=2920 [TCP segment of a reassembled PDU]"
"667","14.439130","10.0.2.15","213.57.24.219","TCP","54","60202  >  443 [ACK] Seq=2318 Ack=322196 Win=65535 Len=0"
"668","14.439574","213.57.24.219","10.0.2.15","TCP","2974","443  >  60202 [PSH, ACK] Seq=322196 Ack=2318 Win=65535 Len=2920 [TCP segment of a reassembled PDU]"
"669","14.439581","10.0.2.15","213.57.24.219","TCP","54","60202  >  443 [ACK] Seq=2318 Ack=325116 Win=65535 Len=0"
"671","14.442528","10.0.2.15","213.57.24.219","TCP","54","60202  >  443 [ACK] Seq=2318 Ack=333267 Win=65535 Len=0"
"695","15.961825","149.154.167.99","10.0.2.15","TCP","60","443  >  34208 [ACK] Seq=971 Ack=1776 Win=65535 Len=0"
"697","16.051384","10.0.2.15","149.154.167.99","TCP","54","34208  >  443 [ACK] Seq=1776 Ack=1084 Win=65535 Len=0"
"699","16.418250","149.154.167.99","10.0.2.15","TCP","60","443  >  34208 [ACK] Seq=1084 Ack=1959 Win=65535 Len=0"
"701","16.488361","10.0.2.15","149.154.167.99","TCP","54","34208  >  443 [ACK] Seq=1959 Ack=1197 Win=65535 Len=0"
"712","16.681244","10.0.2.15","35.186.224.40","TCP","54","49032  >  443 [ACK] Seq=44 Ack=41637 Win=65535 Len=0"
"714","16.681495","10.0.2.15","35.186.224.40","TCP","54","49032  >  443 [ACK] Seq=44 Ack=44557 Win=65535 Len=0"
"716","16.681642","10.0.2.15","35.186.224.40","TCP","54","49032  >  443 [ACK] Seq=44 Ack=45825 Win=65535 Len=0"
"718","16.683651","10.0.2.15","35.186.224.40","TCP","54","49032  >  443 [ACK] Seq=44 Ack=51473 Win=65535 Len=0"
"720","16.684350","10.0.2.15","35.186.224.40","TCP","54","49032  >  443 [ACK] Seq=44 Ack=57655 Win=65535 Len=0"
"722","16.692340","10.0.2.15","35.186.224.40","TCP","54","49032  >  443 [ACK] Seq=44 Ack=59067 Win=65535 Len=0"
"724","16.692877","10.0.2.15","35.186.224.40","TCP","54","49032  >  443 [ACK] Seq=44 Ack=61891 Win=65535 Len=0"
"726","16.693234","10.0.2.15","35.186.224.40","TCP","54","49032  >  443 [ACK] Seq=44 Ack=64715 Win=65535 Len=0"
"728","16.695023","10.0.2.15","35.186.224.40","TCP","54","49032  >  443 [ACK] Seq=44 Ack=67539 Win=65535 Len=0"
"730","16.695132","10.0.2.15","35.186.224.40","TCP","54","49032  >  443 [ACK] Seq=44 Ack=70363 Win=65535 Len=0"
"732","16.695510","10.0.2.15","35.186.224.40","TCP","54","49032  >  443 [ACK] Seq=44 Ack=71775 Win=65535 Len=0"
"734","16.696881","10.0.2.15","35.186.224.40","TCP","54","49032  >  443 [ACK] Seq=44 Ack=73187 Win=65535 Len=0"
"736","16.697093","10.0.2.15","35.186.224.40","TCP","54","49032  >  443 [ACK] Seq=44 Ack=76011 Win=65535 Len=0"
"738","16.697421","10.0.2.15","35.186.224.40","TCP","54","49032  >  443 [ACK] Seq=44 Ack=78835 Win=65535 Len=0"
"740","16.697877","10.0.2.15","35.186.224.40","TCP","54","49032  >  443 [ACK] Seq=44 Ack=80245 Win=65535 Len=0"
"764","19.496371","149.154.167.99","10.0.2.15","TCP","60","443  >  34208 [ACK] Seq=1197 Ack=2142 Win=65535 Len=0"
"766","19.566444","10.0.2.15","149.154.167.99","TCP","54","34208  >  443 [ACK] Seq=2142 Ack=1310 Win=65535 Len=0"
"767","19.624543","10.0.2.15","35.210.239.72","TCP","54","51178  >  443 [ACK] Seq=1 Ack=1 Win=62780 Len=0"
"768","19.624572","10.0.2.15","146.75.121.44","TCP","54","60166  >  443 [ACK] Seq=1 Ack=1 Win=62780 Len=0"
"769","19.624573","10.0.2.15","34.160.236.64","TCP","54","52340  >  443 [ACK] Seq=1 Ack=1 Win=62780 Len=0"
"770","19.624579","10.0.2.15","35.190.113.31","TCP","54","47980  >  443 [ACK] Seq=1 Ack=1 Win=62780 Len=0"
"771","19.625101","35.210.239.72","10.0.2.15","TCP","60","[TCP ACKed unseen segment] 443  >  51178 [ACK] Seq=1 Ack=2 Win=65535 Len=0"
"772","19.625102","146.75.121.44","10.0.2.15","TCP","60","[TCP ACKed unseen segment] 443  >  60166 [ACK] Seq=1 Ack=2 Win=65535 Len=0"
"773","19.625102","34.160.236.64","10.0.2.15","TCP","60","[TCP ACKed unseen segment] 443  >  52340 [ACK] Seq=1 Ack=2 Win=65535 Len=0"
"774","19.625102","35.190.113.31","10.0.2.15","TCP","60","[TCP ACKed unseen segment] 443  >  47980 [ACK] Seq=1 Ack=2 Win=65535 Len=0"
"778","20.393881","10.0.2.15","104.22.36.96","TCP","54","56422  >  443 [ACK] Seq=1 Ack=40 Win=62780 Len=0"
"779","20.393838","104.22.36.96","10.0.2.15","TCP","60","443  >  56422 [FIN, ACK] Seq=40 Ack=1 Win=65535 Len=0"
"780","20.394090","10.0.2.15","104.22.36.96","TCP","54","56422  >  443 [FIN, ACK] Seq=1 Ack=41 Win=62780 Len=0"
"781","20.394366","104.22.36.96","10.0.2.15","TCP","60","443  >  56422 [ACK] Seq=41 Ack=2 Win=65535 Len=0"
"783","20.565115","10.0.2.15","149.154.167.99","TCP","54","34208  >  443 [ACK] Seq=2142 Ack=1649 Win=65535 Len=0"
"786","20.616031","149.154.167.99","10.0.2.15","TCP","60","443  >  34208 [ACK] Seq=1649 Ack=2389 Win=65535 Len=0"
"787","20.616031","149.154.167.99","10.0.2.15","TCP","60","443  >  34208 [ACK] Seq=1649 Ack=2506 Win=65535 Len=0"
"789","20.690686","10.0.2.15","149.154.167.99","TCP","54","34208  >  443 [ACK] Seq=2506 Ack=1908 Win=65535 Len=0"
"791","20.691434","10.0.2.15","149.154.167.99","TCP","54","34208  >  443 [ACK] Seq=2506 Ack=2200 Win=65535 Len=0"
"793","20.694399","10.0.2.15","149.154.167.99","TCP","54","34208  >  443 [ACK] Seq=2506 Ack=2379 Win=65535 Len=0"
"795","20.695497","10.0.2.15","149.154.167.99","TCP","54","34208  >  443 [ACK] Seq=2506 Ack=2524 Win=65535 Len=0"
"798","20.909088","34.117.65.55","10.0.2.15","TCP","60","443  >  55680 [ACK] Seq=846 Ack=345 Win=65535 Len=0"
"801","20.943306","10.0.2.15","149.154.167.99","TCP","74","48404  >  443 [SYN] Seq=0 Win=64240 Len=0 MSS=1460 SACK_PERM=1 TSval=2003262033 TSecr=0 WS=128"
"802","21.017339","149.154.167.99","10.0.2.15","TCP","60","443  >  48404 [SYN, ACK] Seq=0 Ack=1 Win=65535 Len=0 MSS=1460"
"803","21.017381","10.0.2.15","149.154.167.99","TCP","54","48404  >  443 [ACK] Seq=1 Ack=1 Win=64240 Len=0"
"805","21.019443","149.154.167.99","10.0.2.15","TCP","60","443  >  48404 [ACK] Seq=1 Ack=518 Win=65535 Len=0"
"807","21.097490","10.0.2.15","149.154.167.99","TCP","54","48404  >  443 [ACK] Seq=518 Ack=2921 Win=62780 Len=0"
"809","21.097910","10.0.2.15","149.154.167.99","TCP","54","48404  >  443 [ACK] Seq=518 Ack=5697 Win=61320 Len=0"
