"No.","Time","Source","Destination","Protocol","Length","Info"
"1","0.000000","10.0.2.15","149.154.167.99","TLSv1.2","237","Application Data"
"2","0.000363","149.154.167.99","10.0.2.15","TCP","60","443  >  49012 [ACK] Seq=1 Ack=184 Win=65535 Len=0"
"3","0.084315","149.154.167.99","10.0.2.15","TLSv1.2","167","Application Data"
"4","0.084351","10.0.2.15","149.154.167.99","TCP","54","49012  >  443 [ACK] Seq=184 Ack=114 Win=65535 Len=0"
"5","0.812982","10.0.2.15","149.154.167.99","TLSv1.2","221","Application Data"
"6","0.813425","149.154.167.99","10.0.2.15","TCP","60","443  >  49012 [ACK] Seq=114 Ack=351 Win=65535 Len=0"
"7","0.920175","10.0.2.15","34.117.237.239","TLSv1.2","93","Application Data"
"8","0.920229","10.0.2.15","34.117.65.55","TLSv1.2","93","Application Data"
"9","0.920632","34.117.237.239","10.0.2.15","TCP","60","443  >  47566 [ACK] Seq=1 Ack=40 Win=65535 Len=0"
"10","0.920632","34.117.65.55","10.0.2.15","TCP","60","443  >  39916 [ACK] Seq=1 Ack=40 Win=65535 Len=0"
"11","0.929841","149.154.167.99","10.0.2.15","TLSv1.2","167","Application Data"
"12","0.929926","10.0.2.15","149.154.167.99","TCP","54","49012  >  443 [ACK] Seq=351 Ack=227 Win=65535 Len=0"
"13","0.937119","34.117.237.239","10.0.2.15","TLSv1.2","93","Application Data"
"14","0.946188","34.117.65.55","10.0.2.15","TLSv1.2","93","Application Data"
"15","0.977588","10.0.2.15","34.117.237.239","TCP","54","47566  >  443 [ACK] Seq=40 Ack=40 Win=62780 Len=0"
"16","0.989578","10.0.2.15","34.117.65.55","TCP","54","39916  >  443 [ACK] Seq=40 Ack=40 Win=62780 Len=0"
"17","1.679146","10.0.2.15","149.154.167.99","TLSv1.2","253","Application Data"
"18","1.679671","149.154.167.99","10.0.2.15","TCP","60","443  >  49012 [ACK] Seq=227 Ack=550 Win=65535 Len=0"
"19","1.780813","149.154.167.99","10.0.2.15","TLSv1.2","167","Application Data"
"20","1.780853","10.0.2.15","149.154.167.99","TCP","54","49012  >  443 [ACK] Seq=550 Ack=340 Win=65535 Len=0"
"21","2.762828","10.0.2.15","149.154.167.99","TLSv1.2","269","Application Data"
"22","2.763248","149.154.167.99","10.0.2.15","TCP","60","443  >  49012 [ACK] Seq=340 Ack=765 Win=65535 Len=0"
"23","2.945349","10.0.2.15","142.250.184.196","TLSv1.2","93","Application Data"
"24","2.945398","10.0.2.15","142.250.184.196","TLSv1.2","93","Application Data"
"25","2.946009","142.250.184.196","10.0.2.15","TCP","60","443  >  38596 [ACK] Seq=1 Ack=40 Win=65535 Len=0"
"26","2.946010","142.250.184.196","10.0.2.15","TCP","60","443  >  38566 [ACK] Seq=1 Ack=40 Win=65535 Len=0"
"27","2.956081","149.154.167.99","10.0.2.15","TLSv1.2","409","Application Data"
"28","2.956116","10.0.2.15","149.154.167.99","TCP","54","49012  >  443 [ACK] Seq=765 Ack=695 Win=65535 Len=0"
"29","3.009825","142.250.184.196","10.0.2.15","TLSv1.2","93","Application Data"
"30","3.012086","142.250.184.196","10.0.2.15","TLSv1.2","93","Application Data"
"31","3.053738","10.0.2.15","142.250.184.196","TCP","54","38566  >  443 [ACK] Seq=40 Ack=40 Win=62780 Len=0"
"32","3.053767","10.0.2.15","142.250.184.196","TCP","54","38596  >  443 [ACK] Seq=40 Ack=40 Win=62780 Len=0"
"33","3.090340","10.0.2.15","149.154.167.99","TLSv1.2","237","Application Data"
"34","3.090759","149.154.167.99","10.0.2.15","TCP","60","443  >  49012 [ACK] Seq=695 Ack=948 Win=65535 Len=0"
"35","3.183187","149.154.167.99","10.0.2.15","TLSv1.2","167","Application Data"
"36","3.183218","10.0.2.15","149.154.167.99","TCP","54","49012  >  443 [ACK] Seq=948 Ack=808 Win=65535 Len=0"
"37","3.240740","10.0.2.15","149.154.167.99","TLSv1.2","269","Application Data"
"38","3.241198","149.154.167.99","10.0.2.15","TCP","60","443  >  49012 [ACK] Seq=808 Ack=1163 Win=65535 Len=0"
"39","3.339682","149.154.167.99","10.0.2.15","TLSv1.2","441","Application Data"
"40","3.339733","10.0.2.15","149.154.167.99","TCP","54","49012  >  443 [ACK] Seq=1163 Ack=1195 Win=65535 Len=0"
"41","3.707066","10.0.2.15","149.154.167.99","TLSv1.2","253","Application Data"
"42","3.707740","149.154.167.99","10.0.2.15","TCP","60","443  >  49012 [ACK] Seq=1195 Ack=1362 Win=65535 Len=0"
"43","3.803023","149.154.167.99","10.0.2.15","TLSv1.2","167","Application Data"
"44","3.803058","10.0.2.15","149.154.167.99","TCP","54","49012  >  443 [ACK] Seq=1362 Ack=1308 Win=65535 Len=0"
"45","3.806148","10.0.2.15","149.154.167.99","TLSv1.2","253","Application Data"
"46","3.806540","149.154.167.99","10.0.2.15","TCP","60","443  >  49012 [ACK] Seq=1308 Ack=1561 Win=65535 Len=0"
"47","3.929124","149.154.167.99","10.0.2.15","TLSv1.2","473","Application Data"
"48","3.945681","10.0.2.15","34.120.208.123","TLSv1.2","93","Application Data"
"49","3.946210","34.120.208.123","10.0.2.15","TCP","60","443  >  60180 [ACK] Seq=1 Ack=40 Win=65535 Len=0"
"50","3.962827","10.0.2.15","149.154.167.99","TLSv1.2","203","Application Data"
"51","3.963400","149.154.167.99","10.0.2.15","TCP","60","443  >  49012 [ACK] Seq=1727 Ack=1710 Win=65535 Len=0"
"52","3.971148","34.120.208.123","10.0.2.15","TLSv1.2","93","Application Data"
"53","4.013626","10.0.2.15","34.120.208.123","TCP","54","60180  >  443 [ACK] Seq=40 Ack=40 Win=63540 Len=0"
"54","4.139167","149.154.167.99","10.0.2.15","TLSv1.2","409","Application Data"
"55","4.185624","10.0.2.15","149.154.167.99","TCP","54","49012  >  443 [ACK] Seq=1710 Ack=2082 Win=65535 Len=0"
"56","4.377621","10.0.2.15","149.154.167.99","TLSv1.2","285","Application Data"
"57","4.378097","149.154.167.99","10.0.2.15","TCP","60","443  >  49012 [ACK] Seq=2082 Ack=1941 Win=65535 Len=0"
"58","4.478962","149.154.167.99","10.0.2.15","TLSv1.2","457","Application Data"
"59","4.479007","10.0.2.15","149.154.167.99","TCP","54","49012  >  443 [ACK] Seq=1941 Ack=2485 Win=65535 Len=0"
"60","4.670578","10.0.2.15","149.154.167.99","TLSv1.2","253","Application Data"
"61","4.671053","149.154.167.99","10.0.2.15","TCP","60","443  >  49012 [ACK] Seq=2485 Ack=2140 Win=65535 Len=0"
"62","4.767651","149.154.167.99","10.0.2.15","TLSv1.2","167","Application Data"
"63","4.767684","10.0.2.15","149.154.167.99","TCP","54","49012  >  443 [ACK] Seq=2140 Ack=2598 Win=65535 Len=0"
"64","4.872352","10.0.2.15","149.154.167.99","TLSv1.2","253","Application Data"
"65","4.873272","149.154.167.99","10.0.2.15","TCP","60","443  >  49012 [ACK] Seq=2598 Ack=2339 Win=65535 Len=0"
"66","4.924430","10.0.2.15","149.154.167.99","TLSv1.2","203","Application Data"
"67","4.924892","149.154.167.99","10.0.2.15","TCP","60","443  >  49012 [ACK] Seq=2598 Ack=2488 Win=65535 Len=0"
"68","4.971265","149.154.167.99","10.0.2.15","TLSv1.2","167","Application Data"
"69","4.971295","10.0.2.15","149.154.167.99","TCP","54","49012  >  443 [ACK] Seq=2488 Ack=2711 Win=65535 Len=0"
"70","4.976918","10.0.2.15","149.154.167.99","TLSv1.2","253","Application Data"
"71","4.977570","149.154.167.99","10.0.2.15","TCP","60","443  >  49012 [ACK] Seq=2711 Ack=2687 Win=65535 Len=0"
"72","5.083140","149.154.167.99","10.0.2.15","TLSv1.2","521","Application Data"
"73","5.083892","149.154.167.99","10.0.2.15","TLSv1.2","393","Application Data"
"74","5.083991","10.0.2.15","149.154.167.99","TCP","54","49012  >  443 [ACK] Seq=2687 Ack=3517 Win=65535 Len=0"
"75","5.389371","10.0.2.15","149.154.167.99","TLSv1.2","285","Application Data"
"76","5.389794","149.154.167.99","10.0.2.15","TCP","60","443  >  49012 [ACK] Seq=3517 Ack=2918 Win=65535 Len=0"
"77","5.497761","149.154.167.99","10.0.2.15","TLSv1.2","473","Application Data"
"78","5.551731","10.0.2.15","149.154.167.99","TCP","54","49012  >  443 [ACK] Seq=2918 Ack=3936 Win=65535 Len=0"
"79","5.860261","10.0.2.15","149.154.167.99","TLSv1.2","253","Application Data"
"80","5.860942","149.154.167.99","10.0.2.15","TCP","60","443  >  49012 [ACK] Seq=3936 Ack=3117 Win=65535 Len=0"
"81","5.979635","149.154.167.99","10.0.2.15","TLSv1.2","167","Application Data"
"82","5.979693","10.0.2.15","149.154.167.99","TCP","54","49012  >  443 [ACK] Seq=3117 Ack=4049 Win=65535 Len=0"
"83","5.982945","10.0.2.15","149.154.167.99","TLSv1.2","253","Application Data"
"84","5.983374","149.154.167.99","10.0.2.15","TCP","60","443  >  49012 [ACK] Seq=4049 Ack=3316 Win=65535 Len=0"
"85","6.039876","10.0.2.15","149.154.167.99","TLSv1.2","221","Application Data"
"86","6.040275","149.154.167.99","10.0.2.15","TCP","60","443  >  49012 [ACK] Seq=4049 Ack=3483 Win=65535 Len=0"
"87","6.146368","10.0.2.15","149.154.167.99","TLSv1.2","221","Application Data"
"88","6.146774","149.154.167.99","10.0.2.15","TCP","60","443  >  49012 [ACK] Seq=4049 Ack=3650 Win=65535 Len=0"
"89","6.154559","149.154.167.99","10.0.2.15","TLSv1.2","457","Application Data"
"90","6.158856","149.154.167.99","10.0.2.15","TLSv1.2","249","Application Data"
"91","6.158959","10.0.2.15","149.154.167.99","TCP","54","49012  >  443 [ACK] Seq=3650 Ack=4647 Win=65535 Len=0"
"92","6.198337","10.0.2.15","149.154.167.99","TLSv1.2","237","Application Data"
"93","6.198863","149.154.167.99","10.0.2.15","TCP","60","443  >  49012 [ACK] Seq=4647 Ack=3833 Win=65535 Len=0"
"94","6.329236","149.154.167.99","10.0.2.15","TLSv1.2","233","Application Data"
"95","6.336091","149.154.167.99","10.0.2.15","TLSv1.2","409","Application Data"
"96","6.336205","10.0.2.15","149.154.167.99","TCP","54","49012  >  443 [ACK] Seq=3833 Ack=5181 Win=65535 Len=0"
"97","6.631821","10.0.2.15","149.154.167.99","TLSv1.2","285","Application Data"
"98","6.632259","149.154.167.99","10.0.2.15","TCP","60","443  >  49012 [ACK] Seq=5181 Ack=4064 Win=65535 Len=0"
"99","6.715772","149.154.167.99","10.0.2.15","TLSv1.2","167","Application Data"
"100","6.735976","10.0.2.15","149.154.167.99","TLSv1.2","269","Application Data"
"101","6.736786","149.154.167.99","10.0.2.15","TCP","60","443  >  49012 [ACK] Seq=5294 Ack=4279 Win=65535 Len=0"
"102","6.818935","149.154.167.99","10.0.2.15","TLSv1.2","167","Application Data"
"103","6.821407","10.0.2.15","149.154.167.99","TLSv1.2","269","Application Data"
"104","6.821738","149.154.167.99","10.0.2.15","TCP","60","443  >  49012 [ACK] Seq=5407 Ack=4494 Win=65535 Len=0"
"105","6.912290","149.154.167.99","10.0.2.15","TLSv1.2","167","Application Data"
"106","6.916246","10.0.2.15","149.154.167.99","TLSv1.2","269","Application Data"
"107","6.916706","149.154.167.99","10.0.2.15","TCP","60","443  >  49012 [ACK] Seq=5520 Ack=4709 Win=65535 Len=0"
"108","6.997413","149.154.167.99","10.0.2.15","TLSv1.2","167","Application Data"
"109","7.003194","10.0.2.15","149.154.167.99","TLSv1.2","269","Application Data"
"110","7.003711","149.154.167.99","10.0.2.15","TCP","60","443  >  49012 [ACK] Seq=5633 Ack=4924 Win=65535 Len=0"
"111","7.089635","149.154.167.99","10.0.2.15","TLSv1.2","167","Application Data"
"112","7.096312","10.0.2.15","149.154.167.99","TLSv1.2","269","Application Data"
"113","7.096773","149.154.167.99","10.0.2.15","TCP","60","443  >  49012 [ACK] Seq=5746 Ack=5139 Win=65535 Len=0"
"114","7.100018","10.0.2.15","149.154.167.99","TLSv1.2","187","Application Data"
"115","7.100385","149.154.167.99","10.0.2.15","TCP","60","443  >  49012 [ACK] Seq=5746 Ack=5272 Win=65535 Len=0"
"116","7.182923","149.154.167.99","10.0.2.15","TLSv1.2","280","Application Data, Application Data"
"117","7.188398","10.0.2.15","149.154.167.99","TLSv1.2","269","Application Data"
"118","7.188969","149.154.167.99","10.0.2.15","TCP","60","443  >  49012 [ACK] Seq=5972 Ack=5487 Win=65535 Len=0"
"119","7.189788","10.0.2.15","149.154.167.99","TLSv1.2","253","Application Data"
"120","7.190198","149.154.167.99","10.0.2.15","TCP","60","443  >  49012 [ACK] Seq=5972 Ack=5686 Win=65535 Len=0"
"121","7.234682","10.0.2.15","149.154.167.99","TLSv1.2","203","Application Data"
"122","7.235226","149.154.167.99","10.0.2.15","TCP","60","443  >  49012 [ACK] Seq=5972 Ack=5835 Win=65535 Len=0"
"123","7.271204","149.154.167.99","10.0.2.15","TLSv1.2","167","Application Data"
"124","7.279144","149.154.167.99","10.0.2.15","TLSv1.2","167","Application Data"
"125","7.279275","10.0.2.15","149.154.167.99","TCP","54","49012  >  443 [ACK] Seq=5835 Ack=6198 Win=65535 Len=0"
"126","7.306558","10.0.2.15","149.154.167.99","TLSv1.2","269","Application Data"
"127","7.306945","149.154.167.99","10.0.2.15","TCP","60","443  >  49012 [ACK] Seq=6198 Ack=6050 Win=65535 Len=0"
"128","7.308588","10.0.2.15","149.154.167.99","TLSv1.2","253","Application Data"
"129","7.308843","149.154.167.99","10.0.2.15","TCP","60","443  >  49012 [ACK] Seq=6198 Ack=6249 Win=65535 Len=0"
"130","7.367611","149.154.167.99","10.0.2.15","TLSv1.2","167","Application Data"
"131","7.369850","10.0.2.15","149.154.167.99","TLSv1.2","269","Application Data"
"132","7.370399","149.154.167.99","10.0.2.15","TCP","60","443  >  49012 [ACK] Seq=6311 Ack=6464 Win=65535 Len=0"
"133","7.416673","149.154.167.99","10.0.2.15","TLSv1.2","233","Application Data"
"134","7.424419","10.0.2.15","149.154.167.99","TLSv1.2","269","Application Data"
"135","7.424887","149.154.167.99","10.0.2.15","TCP","60","443  >  49012 [ACK] Seq=6490 Ack=6679 Win=65535 Len=0"
"136","7.431510","149.154.167.99","10.0.2.15","TLSv1.2","489","Application Data"
"137","7.483219","10.0.2.15","149.154.167.99","TCP","54","49012  >  443 [ACK] Seq=6679 Ack=6925 Win=65535 Len=0"
"138","7.527335","149.154.167.99","10.0.2.15","TLSv1.2","537","Application Data"
"139","7.527366","10.0.2.15","149.154.167.99","TCP","54","49012  >  443 [ACK] Seq=6679 Ack=7408 Win=65535 Len=0"
"140","7.559607","149.154.167.99","10.0.2.15","TLSv1.2","409","Application Data"
"141","7.559644","10.0.2.15","149.154.167.99","TCP","54","49012  >  443 [ACK] Seq=6679 Ack=7763 Win=65535 Len=0"
"142","7.666907","10.0.2.15","149.154.167.99","TLSv1.2","285","Application Data"
"143","7.667338","149.154.167.99","10.0.2.15","TCP","60","443  >  49012 [ACK] Seq=7763 Ack=6910 Win=65535 Len=0"
"144","7.708096","10.0.2.15","149.154.167.99","TLSv1.2","221","Application Data"
"145","7.708484","149.154.167.99","10.0.2.15","TCP","60","443  >  49012 [ACK] Seq=7763 Ack=7077 Win=65535 Len=0"
"146","7.766200","149.154.167.99","10.0.2.15","TLSv1.2","167","Application Data"
"147","7.766238","10.0.2.15","149.154.167.99","TCP","54","49012  >  443 [ACK] Seq=7077 Ack=7876 Win=65535 Len=0"
"148","7.812477","149.154.167.99","10.0.2.15","TLSv1.2","505","Application Data"
"149","7.812517","10.0.2.15","149.154.167.99","TCP","54","49012  >  443 [ACK] Seq=7077 Ack=8327 Win=65535 Len=0"
"150","8.183204","10.0.2.15","149.154.167.99","TLSv1.2","253","Application Data"
"151","8.183550","149.154.167.99","10.0.2.15","TCP","60","443  >  49012 [ACK] Seq=8327 Ack=7276 Win=65535 Len=0"
"152","8.347840","149.154.167.99","10.0.2.15","TLSv1.2","167","Application Data"
"153","8.347868","10.0.2.15","149.154.167.99","TCP","54","49012  >  443 [ACK] Seq=7276 Ack=8440 Win=65535 Len=0"
"154","8.358296","10.0.2.15","149.154.167.99","TLSv1.2","253","Application Data"
"155","8.358673","149.154.167.99","10.0.2.15","TCP","60","443  >  49012 [ACK] Seq=8440 Ack=7475 Win=65535 Len=0"
"156","8.686777","149.154.167.99","10.0.2.15","TLSv1.2","473","Application Data"
"157","8.733611","10.0.2.15","149.154.167.99","TCP","54","49012  >  443 [ACK] Seq=7475 Ack=8859 Win=65535 Len=0"
"158","8.758101","10.0.2.15","149.154.167.99","TLSv1.2","139","Application Data"
"159","8.758810","149.154.167.99","10.0.2.15","TCP","60","443  >  48996 [ACK] Seq=1 Ack=86 Win=65535 Len=0"
"160","8.833669","149.154.167.99","10.0.2.15","TCP","1294","443  >  48996 [PSH, ACK] Seq=1 Ack=86 Win=65535 Len=1240 [TCP segment of a reassembled PDU]"
"161","8.833707","10.0.2.15","149.154.167.99","TCP","54","48996  >  443 [ACK] Seq=86 Ack=1241 Win=65535 Len=0"
"162","8.834174","149.154.167.99","10.0.2.15","TLSv1.2","1842","Application Data"
"163","8.834187","10.0.2.15","149.154.167.99","TCP","54","48996  >  443 [ACK] Seq=86 Ack=3029 Win=65535 Len=0"
"164","8.874944","10.0.2.15","149.154.167.99","TLSv1.2","149","Application Data"
"165","8.875451","149.154.167.99","10.0.2.15","TCP","60","443  >  48996 [ACK] Seq=3029 Ack=181 Win=65535 Len=0"
"166","8.946481","149.154.167.99","10.0.2.15","TCP","1294","443  >  48996 [PSH, ACK] Seq=3029 Ack=181 Win=65535 Len=1240 [TCP segment of a reassembled PDU]"
"167","8.946524","10.0.2.15","149.154.167.99","TCP","54","48996  >  443 [ACK] Seq=181 Ack=4269 Win=65535 Len=0"
"168","8.947096","149.154.167.99","10.0.2.15","TCP","1294","443  >  48996 [PSH, ACK] Seq=4269 Ack=181 Win=65535 Len=1240 [TCP segment of a reassembled PDU]"
"169","8.947127","10.0.2.15","149.154.167.99","TCP","54","48996  >  443 [ACK] Seq=181 Ack=5509 Win=65535 Len=0"
"170","8.947676","149.154.167.99","10.0.2.15","TCP","2534","443  >  48996 [PSH, ACK] Seq=5509 Ack=181 Win=65535 Len=2480 [TCP segment of a reassembled PDU]"
"171","8.947691","10.0.2.15","149.154.167.99","TCP","54","48996  >  443 [ACK] Seq=181 Ack=7989 Win=65535 Len=0"
"172","8.948057","149.154.167.99","10.0.2.15","TCP","2534","443  >  48996 [PSH, ACK] Seq=7989 Ack=181 Win=65535 Len=2480 [TCP segment of a reassembled PDU]"
"173","8.948064","10.0.2.15","149.154.167.99","TCP","54","48996  >  443 [ACK] Seq=181 Ack=10469 Win=65535 Len=0"
"174","8.948561","149.154.167.99","10.0.2.15","TCP","2534","443  >  48996 [PSH, ACK] Seq=10469 Ack=181 Win=65535 Len=2480 [TCP segment of a reassembled PDU]"
"175","8.948570","10.0.2.15","149.154.167.99","TCP","54","48996  >  443 [ACK] Seq=181 Ack=12949 Win=65535 Len=0"
"176","8.949586","149.154.167.99","10.0.2.15","TCP","1294","443  >  48996 [PSH, ACK] Seq=12949 Ack=181 Win=65535 Len=1240 [TCP segment of a reassembled PDU]"
"177","8.949594","10.0.2.15","149.154.167.99","TCP","54","48996  >  443 [ACK] Seq=181 Ack=14189 Win=65535 Len=0"
"178","8.950815","149.154.167.99","10.0.2.15","TCP","1294","443  >  48996 [PSH, ACK] Seq=14189 Ack=181 Win=65535 Len=1240 [TCP segment of a reassembled PDU]"
"179","8.950832","10.0.2.15","149.154.167.99","TCP","54","48996  >  443 [ACK] Seq=181 Ack=15429 Win=65535 Len=0"
"180","9.018425","149.154.167.99","10.0.2.15","TCP","1294","443  >  48996 [PSH, ACK] Seq=15429 Ack=181 Win=65535 Len=1240 [TCP segment of a reassembled PDU]"
"181","9.018461","10.0.2.15","149.154.167.99","TCP","54","48996  >  443 [ACK] Seq=181 Ack=16669 Win=65535 Len=0"
"182","9.019045","149.154.167.99","10.0.2.15","TCP","2534","443  >  48996 [PSH, ACK] Seq=16669 Ack=181 Win=65535 Len=2480 [TCP segment of a reassembled PDU]"
"183","9.019065","10.0.2.15","149.154.167.99","TCP","54","48996  >  443 [ACK] Seq=181 Ack=19149 Win=65535 Len=0"
"184","9.019458","149.154.167.99","10.0.2.15","TLSv1.2","2534","Application Data [TCP segment of a reassembled PDU]"
"185","9.019476","10.0.2.15","149.154.167.99","TCP","54","48996  >  443 [ACK] Seq=181 Ack=21629 Win=65535 Len=0"
"186","9.019587","149.154.167.99","10.0.2.15","TCP","2534","443  >  48996 [PSH, ACK] Seq=21629 Ack=181 Win=65535 Len=2480 [TCP segment of a reassembled PDU]"
"187","9.019596","10.0.2.15","149.154.167.99","TCP","54","48996  >  443 [ACK] Seq=181 Ack=24109 Win=65535 Len=0"
"188","9.021147","149.154.167.99","10.0.2.15","TCP","1294","443  >  48996 [PSH, ACK] Seq=24109 Ack=181 Win=65535 Len=1240 [TCP segment of a reassembled PDU]"
"189","9.021160","10.0.2.15","149.154.167.99","TCP","54","48996  >  443 [ACK] Seq=181 Ack=25349 Win=65535 Len=0"
"190","9.021292","149.154.167.99","10.0.2.15","TCP","1294","443  >  48996 [PSH, ACK] Seq=25349 Ack=181 Win=65535 Len=1240 [TCP segment of a reassembled PDU]"
"191","9.021299","10.0.2.15","149.154.167.99","TCP","54","48996  >  443 [ACK] Seq=181 Ack=26589 Win=65535 Len=0"
"192","9.021789","149.154.167.99","10.0.2.15","TLSv1.2","3774","Application Data [TCP segment of a reassembled PDU]"
"193","9.021797","10.0.2.15","149.154.167.99","TCP","54","48996  >  443 [ACK] Seq=181 Ack=30309 Win=65535 Len=0"
"194","9.025420","149.154.167.99","10.0.2.15","TCP","2534","443  >  48996 [PSH, ACK] Seq=30309 Ack=181 Win=65535 Len=2480 [TCP segment of a reassembled PDU]"
"195","9.025429","10.0.2.15","149.154.167.99","TCP","54","48996  >  443 [ACK] Seq=181 Ack=32789 Win=65535 Len=0"
"196","9.025856","149.154.167.99","10.0.2.15","TCP","2534","443  >  48996 [PSH, ACK] Seq=32789 Ack=181 Win=65535 Len=2480 [TCP segment of a reassembled PDU]"
"197","9.025863","10.0.2.15","149.154.167.99","TCP","54","48996  >  443 [ACK] Seq=181 Ack=35269 Win=65535 Len=0"
"198","9.028990","149.154.167.99","10.0.2.15","TCP","3774","443  >  48996 [PSH, ACK] Seq=35269 Ack=181 Win=65535 Len=3720 [TCP segment of a reassembled PDU]"
"199","9.029012","10.0.2.15","149.154.167.99","TCP","54","48996  >  443 [ACK] Seq=181 Ack=38989 Win=65535 Len=0"
"200","9.029217","149.154.167.99","10.0.2.15","TCP","1294","443  >  48996 [PSH, ACK] Seq=38989 Ack=181 Win=65535 Len=1240 [TCP segment of a reassembled PDU]"
"201","9.029224","10.0.2.15","149.154.167.99","TCP","54","48996  >  443 [ACK] Seq=181 Ack=40229 Win=65535 Len=0"
"202","9.168469","149.154.167.99","10.0.2.15","TCP","1294","443  >  48996 [PSH, ACK] Seq=40229 Ack=181 Win=65535 Len=1240 [TCP segment of a reassembled PDU]"
"203","9.168546","10.0.2.15","149.154.167.99","TCP","54","48996  >  443 [ACK] Seq=181 Ack=41469 Win=65535 Len=0"
"204","9.168469","149.154.167.99","10.0.2.15","TLSv1.2","3774","Application Data [TCP segment of a reassembled PDU]"
"205","9.168572","10.0.2.15","149.154.167.99","TCP","54","48996  >  443 [ACK] Seq=181 Ack=45189 Win=65535 Len=0"
"206","9.168469","149.154.167.99","10.0.2.15","TCP","2534","443  >  48996 [PSH, ACK] Seq=45189 Ack=181 Win=65535 Len=2480 [TCP segment of a reassembled PDU]"
"207","9.168581","10.0.2.15","149.154.167.99","TCP","54","48996  >  443 [ACK] Seq=181 Ack=47669 Win=65535 Len=0"
"208","9.168470","149.154.167.99","10.0.2.15","TCP","7494","443  >  48996 [PSH, ACK] Seq=47669 Ack=181 Win=65535 Len=7440 [TCP segment of a reassembled PDU]"
"209","9.168590","10.0.2.15","149.154.167.99","TCP","54","48996  >  443 [ACK] Seq=181 Ack=55109 Win=65535 Len=0"
"210","9.168613","149.154.167.99","10.0.2.15","TLSv1.2","2534","Application Data [TCP segment of a reassembled PDU]"
"211","9.168627","10.0.2.15","149.154.167.99","TCP","54","48996  >  443 [ACK] Seq=181 Ack=57589 Win=65535 Len=0"
"212","9.168613","149.154.167.99","10.0.2.15","TCP","2534","443  >  48996 [PSH, ACK] Seq=57589 Ack=181 Win=65535 Len=2480 [TCP segment of a reassembled PDU]"
"213","9.168643","10.0.2.15","149.154.167.99","TCP","54","48996  >  443 [ACK] Seq=181 Ack=60069 Win=65535 Len=0"
"214","9.168614","149.154.167.99","10.0.2.15","TCP","6254","443  >  48996 [PSH, ACK] Seq=60069 Ack=181 Win=65535 Len=6200 [TCP segment of a reassembled PDU]"
"215","9.168653","10.0.2.15","149.154.167.99","TCP","54","48996  >  443 [ACK] Seq=181 Ack=66269 Win=65535 Len=0"
"216","9.168665","149.154.167.99","10.0.2.15","TCP","2534","443  >  48996 [PSH, ACK] Seq=66269 Ack=181 Win=65535 Len=2480 [TCP segment of a reassembled PDU]"
"217","9.168669","10.0.2.15","149.154.167.99","TCP","54","48996  >  443 [ACK] Seq=181 Ack=68749 Win=65535 Len=0"
"218","9.168665","149.154.167.99","10.0.2.15","TCP","2534","443  >  48996 [PSH, ACK] Seq=68749 Ack=181 Win=65535 Len=2480 [TCP segment of a reassembled PDU]"
"219","9.168679","10.0.2.15","149.154.167.99","TCP","54","48996  >  443 [ACK] Seq=181 Ack=71229 Win=65535 Len=0"
"220","9.168665","149.154.167.99","10.0.2.15","TCP","1294","443  >  48996 [PSH, ACK] Seq=71229 Ack=181 Win=65535 Len=1240 [TCP segment of a reassembled PDU]"
"221","9.168705","10.0.2.15","149.154.167.99","TCP","54","48996  >  443 [ACK] Seq=181 Ack=72469 Win=65535 Len=0"
"222","9.168665","149.154.167.99","10.0.2.15","TLSv1.2","2534","Application Data [TCP segment of a reassembled PDU]"
"223","9.168718","10.0.2.15","149.154.167.99","TCP","54","48996  >  443 [ACK] Seq=181 Ack=74949 Win=65535 Len=0"
"224","9.168665","149.154.167.99","10.0.2.15","TCP","5014","443  >  48996 [PSH, ACK] Seq=74949 Ack=181 Win=65535 Len=4960 [TCP segment of a reassembled PDU]"
"225","9.168744","10.0.2.15","149.154.167.99","TCP","54","48996  >  443 [ACK] Seq=181 Ack=79909 Win=65535 Len=0"
"226","9.168761","149.154.167.99","10.0.2.15","TCP","1294","443  >  48996 [PSH, ACK] Seq=79909 Ack=181 Win=65535 Len=1240 [TCP segment of a reassembled PDU]"
"227","9.168765","10.0.2.15","149.154.167.99","TCP","54","48996  >  443 [ACK] Seq=181 Ack=81149 Win=65535 Len=0"
"228","9.168761","149.154.167.99","10.0.2.15","TLSv1.2","6254","Application Data [TCP segment of a reassembled PDU]"
"229","9.168776","10.0.2.15","149.154.167.99","TCP","54","48996  >  443 [ACK] Seq=181 Ack=87349 Win=65535 Len=0"
"230","9.168761","149.154.167.99","10.0.2.15","TCP","2534","443  >  48996 [PSH, ACK] Seq=87349 Ack=181 Win=65535 Len=2480 [TCP segment of a reassembled PDU]"
"231","9.168786","10.0.2.15","149.154.167.99","TCP","54","48996  >  443 [ACK] Seq=181 Ack=89829 Win=65535 Len=0"
"232","9.168800","149.154.167.99","10.0.2.15","TCP","1294","443  >  48996 [PSH, ACK] Seq=89829 Ack=181 Win=65535 Len=1240 [TCP segment of a reassembled PDU]"
"233","9.168805","10.0.2.15","149.154.167.99","TCP","54","48996  >  443 [ACK] Seq=181 Ack=91069 Win=65535 Len=0"
"234","9.168800","149.154.167.99","10.0.2.15","TLSv1.2","14654","Application Data [TCP segment of a reassembled PDU]"
"235","9.168814","10.0.2.15","149.154.167.99","TCP","54","48996  >  443 [ACK] Seq=181 Ack=105669 Win=65535 Len=0"
"236","9.169676","149.154.167.99","10.0.2.15","TLSv1.2","8814","Application Data [TCP segment of a reassembled PDU]"
"237","9.169694","10.0.2.15","149.154.167.99","TCP","54","48996  >  443 [ACK] Seq=181 Ack=114429 Win=65535 Len=0"
"238","9.169777","149.154.167.99","10.0.2.15","TLSv1.2","33734","Application Data, Application Data"
"239","9.169797","10.0.2.15","149.154.167.99","TCP","54","48996  >  443 [ACK] Seq=181 Ack=148109 Win=65535 Len=0"
"240","9.169811","149.154.167.99","10.0.2.15","TCP","1294","443  >  48996 [PSH, ACK] Seq=148109 Ack=181 Win=65535 Len=1240 [TCP segment of a reassembled PDU]"
"241","9.169814","10.0.2.15","149.154.167.99","TCP","54","48996  >  443 [ACK] Seq=181 Ack=149349 Win=65535 Len=0"
"242","9.170330","149.154.167.99","10.0.2.15","TLSv1.2","2534","Application Data [TCP segment of a reassembled PDU]"
"243","9.170339","10.0.2.15","149.154.167.99","TCP","54","48996  >  443 [ACK] Seq=181 Ack=151829 Win=65535 Len=0"
"244","9.175314","149.154.167.99","10.0.2.15","TCP","2534","443  >  48996 [PSH, ACK] Seq=151829 Ack=181 Win=65535 Len=2480 [TCP segment of a reassembled PDU]"
"245","9.175339","10.0.2.15","149.154.167.99","TCP","54","48996  >  443 [ACK] Seq=181 Ack=154309 Win=65535 Len=0"
"246","9.175314","149.154.167.99","10.0.2.15","TCP","1294","443  >  48996 [PSH, ACK] Seq=154309 Ack=181 Win=65535 Len=1240 [TCP segment of a reassembled PDU]"
"247","9.175435","10.0.2.15","149.154.167.99","TCP","54","48996  >  443 [ACK] Seq=181 Ack=155549 Win=65535 Len=0"
"248","9.175315","149.154.167.99","10.0.2.15","TCP","2534","443  >  48996 [PSH, ACK] Seq=155549 Ack=181 Win=65535 Len=2480 [TCP segment of a reassembled PDU]"
"249","9.175445","10.0.2.15","149.154.167.99","TCP","54","48996  >  443 [ACK] Seq=181 Ack=158029 Win=65535 Len=0"
"250","9.175315","149.154.167.99","10.0.2.15","TCP","2534","443  >  48996 [PSH, ACK] Seq=158029 Ack=181 Win=65535 Len=2480 [TCP segment of a reassembled PDU]"
"251","9.175454","10.0.2.15","149.154.167.99","TCP","54","48996  >  443 [ACK] Seq=181 Ack=160509 Win=65535 Len=0"
"252","9.175315","149.154.167.99","10.0.2.15","TCP","3774","443  >  48996 [PSH, ACK] Seq=160509 Ack=181 Win=65535 Len=3720 [TCP segment of a reassembled PDU]"
"253","9.175463","10.0.2.15","149.154.167.99","TCP","54","48996  >  443 [ACK] Seq=181 Ack=164229 Win=65535 Len=0"
"254","9.175935","149.154.167.99","10.0.2.15","TLSv1.2","3774","Application Data [TCP segment of a reassembled PDU]"
"255","9.175943","10.0.2.15","149.154.167.99","TCP","54","48996  >  443 [ACK] Seq=181 Ack=167949 Win=65535 Len=0"
"256","9.176825","149.154.167.99","10.0.2.15","TCP","2534","443  >  48996 [PSH, ACK] Seq=167949 Ack=181 Win=65535 Len=2480 [TCP segment of a reassembled PDU]"
"257","9.176901","10.0.2.15","149.154.167.99","TCP","54","48996  >  443 [ACK] Seq=181 Ack=170429 Win=65535 Len=0"
"258","9.177756","149.154.167.99","10.0.2.15","TCP","2534","443  >  48996 [PSH, ACK] Seq=170429 Ack=181 Win=65535 Len=2480 [TCP segment of a reassembled PDU]"
"259","9.177766","10.0.2.15","149.154.167.99","TCP","54","48996  >  443 [ACK] Seq=181 Ack=172909 Win=65535 Len=0"
"260","9.177993","149.154.167.99","10.0.2.15","TCP","1294","443  >  48996 [PSH, ACK] Seq=172909 Ack=181 Win=65535 Len=1240 [TCP segment of a reassembled PDU]"
"261","9.178021","10.0.2.15","149.154.167.99","TCP","54","48996  >  443 [ACK] Seq=181 Ack=174149 Win=65535 Len=0"
"262","9.179073","149.154.167.99","10.0.2.15","TCP","2534","443  >  48996 [PSH, ACK] Seq=174149 Ack=181 Win=65535 Len=2480 [TCP segment of a reassembled PDU]"
"263","9.179083","10.0.2.15","149.154.167.99","TCP","54","48996  >  443 [ACK] Seq=181 Ack=176629 Win=65535 Len=0"
"264","9.179205","149.154.167.99","10.0.2.15","TLSv1.2","5245","Application Data"
"265","9.179212","10.0.2.15","149.154.167.99","TCP","54","48996  >  443 [ACK] Seq=181 Ack=181820 Win=65535 Len=0"
"266","9.363625","10.0.2.15","149.154.167.99","TLSv1.2","237","Application Data"
"267","9.363954","149.154.167.99","10.0.2.15","TCP","60","443  >  49012 [ACK] Seq=8859 Ack=7658 Win=65535 Len=0"
"268","9.946296","10.0.2.15","149.154.167.99","TLSv1.2","93","Application Data"
"269","9.946461","10.0.2.15","149.154.167.99","TLSv1.2","93","Application Data"
"270","9.946853","149.154.167.99","10.0.2.15","TCP","60","443  >  49000 [ACK] Seq=1 Ack=40 Win=65535 Len=0"
"271","9.946853","149.154.167.99","10.0.2.15","TCP","60","443  >  49010 [ACK] Seq=1 Ack=40 Win=65535 Len=0"
"272","11.366286","10.0.2.15","149.154.167.99","TLSv1.2","171","Application Data"
"273","11.366847","149.154.167.99","10.0.2.15","TCP","60","443  >  49012 [ACK] Seq=8859 Ack=7775 Win=65535 Len=0"
"274","11.491392","10.0.2.15","149.154.167.99","TLSv1.2","187","Application Data"
"275","11.491888","149.154.167.99","10.0.2.15","TCP","60","443  >  49012 [ACK] Seq=8859 Ack=7908 Win=65535 Len=0"
"276","11.493098","10.0.2.15","149.154.167.99","TLSv1.2","171","Application Data"
"277","11.493520","149.154.167.99","10.0.2.15","TCP","60","443  >  49012 [ACK] Seq=8859 Ack=8025 Win=65535 Len=0"
"278","12.177490","149.154.167.99","10.0.2.15","TLSv1.2","167","Application Data"
"279","12.177560","10.0.2.15","149.154.167.99","TCP","54","49012  >  443 [ACK] Seq=8025 Ack=8972 Win=65535 Len=0"
"280","12.247263","149.154.167.99","10.0.2.15","TLSv1.2","93","Application Data"
"281","12.256343","149.154.167.99","10.0.2.15","TLSv1.2","93","Application Data"
"282","12.284147","149.154.167.99","10.0.2.15","TLSv1.2","324","Application Data"
"283","12.284184","10.0.2.15","149.154.167.99","TCP","54","49012  >  443 [ACK] Seq=8025 Ack=9242 Win=65535 Len=0"
"284","12.290361","10.0.2.15","149.154.167.99","TCP","54","49000  >  443 [ACK] Seq=40 Ack=40 Win=62780 Len=0"
"285","12.300218","10.0.2.15","149.154.167.99","TCP","54","49010  >  443 [ACK] Seq=40 Ack=40 Win=62780 Len=0"
"286","12.300242","149.154.167.99","10.0.2.15","TLSv1.2","167","Application Data"
"287","12.300256","10.0.2.15","149.154.167.99","TCP","54","49012  >  443 [ACK] Seq=8025 Ack=9355 Win=65535 Len=0"
"288","14.466880","10.0.2.15","149.154.167.99","TLSv1.2","285","Application Data"
"289","14.467322","149.154.167.99","10.0.2.15","TCP","60","443  >  49012 [ACK] Seq=9355 Ack=8256 Win=65535 Len=0"
"290","14.568551","149.154.167.99","10.0.2.15","TLSv1.2","167","Application Data"
"291","14.568579","10.0.2.15","149.154.167.99","TCP","54","49012  >  443 [ACK] Seq=8256 Ack=9468 Win=65535 Len=0"
"292","15.197228","10.0.2.15","149.154.167.99","TLSv1.2","237","Application Data"
"293","15.197668","149.154.167.99","10.0.2.15","TCP","60","443  >  49012 [ACK] Seq=9468 Ack=8439 Win=65535 Len=0"
"294","15.282049","149.154.167.99","10.0.2.15","TLSv1.2","167","Application Data"
"295","15.282085","10.0.2.15","149.154.167.99","TCP","54","49012  >  443 [ACK] Seq=8439 Ack=9581 Win=65535 Len=0"
"296","17.476242","10.0.2.15","149.154.167.99","TLSv1.2","253","Application Data"
"297","17.476674","149.154.167.99","10.0.2.15","TCP","60","443  >  49012 [ACK] Seq=9581 Ack=8638 Win=65535 Len=0"
"298","17.567531","149.154.167.99","10.0.2.15","TLSv1.2","167","Application Data"
"299","17.567578","10.0.2.15","149.154.167.99","TCP","54","49012  >  443 [ACK] Seq=8638 Ack=9694 Win=65535 Len=0"
"300","18.287823","10.0.2.15","149.154.167.99","TLSv1.2","237","Application Data"
"301","18.288156","149.154.167.99","10.0.2.15","TCP","60","443  >  49012 [ACK] Seq=9694 Ack=8821 Win=65535 Len=0"
"302","18.370373","149.154.167.99","10.0.2.15","TLSv1.2","167","Application Data"
"303","18.370406","10.0.2.15","149.154.167.99","TCP","54","49012  >  443 [ACK] Seq=8821 Ack=9807 Win=65535 Len=0"
"304","20.026766","10.0.2.15","149.154.167.99","TLSv1.2","140","Application Data"
"305","20.027054","149.154.167.99","10.0.2.15","TCP","60","443  >  48996 [ACK] Seq=181820 Ack=267 Win=65535 Len=0"
"306","20.101170","149.154.167.99","10.0.2.15","TCP","1294","443  >  48996 [PSH, ACK] Seq=181820 Ack=267 Win=65535 Len=1240 [TCP segment of a reassembled PDU]"
"307","20.101209","10.0.2.15","149.154.167.99","TCP","54","48996  >  443 [ACK] Seq=267 Ack=183060 Win=65535 Len=0"
"308","20.105086","149.154.167.99","10.0.2.15","TCP","2534","443  >  48996 [PSH, ACK] Seq=183060 Ack=267 Win=65535 Len=2480 [TCP segment of a reassembled PDU]"
"309","20.105111","10.0.2.15","149.154.167.99","TCP","54","48996  >  443 [ACK] Seq=267 Ack=185540 Win=65535 Len=0"
"310","20.105086","149.154.167.99","10.0.2.15","TCP","8734","443  >  48996 [PSH, ACK] Seq=185540 Ack=267 Win=65535 Len=8680 [TCP segment of a reassembled PDU]"
"311","20.105129","10.0.2.15","149.154.167.99","TCP","54","48996  >  443 [ACK] Seq=267 Ack=194220 Win=65535 Len=0"
"312","20.173575","149.154.167.99","10.0.2.15","TCP","1294","443  >  48996 [PSH, ACK] Seq=194220 Ack=267 Win=65535 Len=1240 [TCP segment of a reassembled PDU]"
"313","20.173608","10.0.2.15","149.154.167.99","TCP","54","48996  >  443 [ACK] Seq=267 Ack=195460 Win=65535 Len=0"
"314","20.174226","149.154.167.99","10.0.2.15","TCP","1294","443  >  48996 [PSH, ACK] Seq=195460 Ack=267 Win=65535 Len=1240 [TCP segment of a reassembled PDU]"
"315","20.174244","10.0.2.15","149.154.167.99","TCP","54","48996  >  443 [ACK] Seq=267 Ack=196700 Win=65535 Len=0"
"316","20.174712","149.154.167.99","10.0.2.15","TLSv1.2","2534","Application Data [TCP segment of a reassembled PDU]"
"317","20.174721","10.0.2.15","149.154.167.99","TCP","54","48996  >  443 [ACK] Seq=267 Ack=199180 Win=65535 Len=0"
"318","20.175143","149.154.167.99","10.0.2.15","TCP","2534","443  >  48996 [PSH, ACK] Seq=199180 Ack=267 Win=65535 Len=2480 [TCP segment of a reassembled PDU]"
"319","20.175150","10.0.2.15","149.154.167.99","TCP","54","48996  >  443 [ACK] Seq=267 Ack=201660 Win=65535 Len=0"
"320","20.175551","149.154.167.99","10.0.2.15","TCP","2534","443  >  48996 [PSH, ACK] Seq=201660 Ack=267 Win=65535 Len=2480 [TCP segment of a reassembled PDU]"
"321","20.175558","10.0.2.15","149.154.167.99","TCP","54","48996  >  443 [ACK] Seq=267 Ack=204140 Win=65535 Len=0"
"322","20.175771","149.154.167.99","10.0.2.15","TCP","1294","443  >  48996 [PSH, ACK] Seq=204140 Ack=267 Win=65535 Len=1240 [TCP segment of a reassembled PDU]"
"323","20.175777","10.0.2.15","149.154.167.99","TCP","54","48996  >  443 [ACK] Seq=267 Ack=205380 Win=65535 Len=0"
"324","20.176266","149.154.167.99","10.0.2.15","TCP","1294","443  >  48996 [PSH, ACK] Seq=205380 Ack=267 Win=65535 Len=1240 [TCP segment of a reassembled PDU]"
"325","20.176272","10.0.2.15","149.154.167.99","TCP","54","48996  >  443 [ACK] Seq=267 Ack=206620 Win=65535 Len=0"
"326","20.177047","149.154.167.99","10.0.2.15","TLSv1.2","3774","Application Data [TCP segment of a reassembled PDU]"
"327","20.177059","10.0.2.15","149.154.167.99","TCP","54","48996  >  443 [ACK] Seq=267 Ack=210340 Win=65535 Len=0"
"328","20.179311","149.154.167.99","10.0.2.15","TCP","5014","443  >  48996 [PSH, ACK] Seq=210340 Ack=267 Win=65535 Len=4960 [TCP segment of a reassembled PDU]"
"329","20.179451","10.0.2.15","149.154.167.99","TCP","54","48996  >  443 [ACK] Seq=267 Ack=215300 Win=65535 Len=0"
"330","20.179311","149.154.167.99","10.0.2.15","TCP","1294","443  >  48996 [PSH, ACK] Seq=215300 Ack=267 Win=65535 Len=1240 [TCP segment of a reassembled PDU]"
"331","20.179600","10.0.2.15","149.154.167.99","TCP","54","48996  >  443 [ACK] Seq=267 Ack=216540 Win=65535 Len=0"
"332","20.179311","149.154.167.99","10.0.2.15","TCP","2534","443  >  48996 [PSH, ACK] Seq=216540 Ack=267 Win=65535 Len=2480 [TCP segment of a reassembled PDU]"
"333","20.179650","10.0.2.15","149.154.167.99","TCP","54","48996  >  443 [ACK] Seq=267 Ack=219020 Win=65535 Len=0"
"334","20.243465","149.154.167.99","10.0.2.15","TCP","1294","443  >  48996 [PSH, ACK] Seq=219020 Ack=267 Win=65535 Len=1240 [TCP segment of a reassembled PDU]"
"335","20.243510","10.0.2.15","149.154.167.99","TCP","54","48996  >  443 [ACK] Seq=267 Ack=220260 Win=65535 Len=0"
"336","20.243865","149.154.167.99","10.0.2.15","TCP","2534","443  >  48996 [PSH, ACK] Seq=220260 Ack=267 Win=65535 Len=2480 [TCP segment of a reassembled PDU]"
"337","20.243873","10.0.2.15","149.154.167.99","TCP","54","48996  >  443 [ACK] Seq=267 Ack=222740 Win=65535 Len=0"
"338","20.247168","149.154.167.99","10.0.2.15","TLSv1.2","6254","Application Data [TCP segment of a reassembled PDU]"
"339","20.247224","10.0.2.15","149.154.167.99","TCP","54","48996  >  443 [ACK] Seq=267 Ack=228940 Win=65535 Len=0"
"340","20.248136","149.154.167.99","10.0.2.15","TCP","1294","443  >  48996 [PSH, ACK] Seq=228940 Ack=267 Win=65535 Len=1240 [TCP segment of a reassembled PDU]"
"341","20.248153","10.0.2.15","149.154.167.99","TCP","54","48996  >  443 [ACK] Seq=267 Ack=230180 Win=65535 Len=0"
"342","20.248610","149.154.167.99","10.0.2.15","TCP","2534","443  >  48996 [PSH, ACK] Seq=230180 Ack=267 Win=65535 Len=2480 [TCP segment of a reassembled PDU]"
"343","20.248619","10.0.2.15","149.154.167.99","TCP","54","48996  >  443 [ACK] Seq=267 Ack=232660 Win=65535 Len=0"
"344","20.249176","149.154.167.99","10.0.2.15","TLSv1.2","3774","Application Data [TCP segment of a reassembled PDU]"
"345","20.249185","10.0.2.15","149.154.167.99","TCP","54","48996  >  443 [ACK] Seq=267 Ack=236380 Win=65535 Len=0"
"346","20.249587","149.154.167.99","10.0.2.15","TCP","2534","443  >  48996 [PSH, ACK] Seq=236380 Ack=267 Win=65535 Len=2480 [TCP segment of a reassembled PDU]"
"347","20.249595","10.0.2.15","149.154.167.99","TCP","54","48996  >  443 [ACK] Seq=267 Ack=238860 Win=65535 Len=0"
"348","20.249878","149.154.167.99","10.0.2.15","TCP","1294","443  >  48996 [PSH, ACK] Seq=238860 Ack=267 Win=65535 Len=1240 [TCP segment of a reassembled PDU]"
"349","20.249887","10.0.2.15","149.154.167.99","TCP","54","48996  >  443 [ACK] Seq=267 Ack=240100 Win=65535 Len=0"
"350","20.250335","149.154.167.99","10.0.2.15","TCP","6254","443  >  48996 [PSH, ACK] Seq=240100 Ack=267 Win=65535 Len=6200 [TCP segment of a reassembled PDU]"
"351","20.250345","10.0.2.15","149.154.167.99","TCP","54","48996  >  443 [ACK] Seq=267 Ack=246300 Win=65535 Len=0"
"352","20.250863","149.154.167.99","10.0.2.15","TCP","3774","443  >  48996 [PSH, ACK] Seq=246300 Ack=267 Win=65535 Len=3720 [TCP segment of a reassembled PDU]"
"353","20.250874","10.0.2.15","149.154.167.99","TCP","54","48996  >  443 [ACK] Seq=267 Ack=250020 Win=65535 Len=0"
"354","20.251854","149.154.167.99","10.0.2.15","TLSv1.2","5014","Application Data [TCP segment of a reassembled PDU]"
"355","20.251864","10.0.2.15","149.154.167.99","TCP","54","48996  >  443 [ACK] Seq=267 Ack=254980 Win=65535 Len=0"
"356","20.252077","149.154.167.99","10.0.2.15","TCP","1294","443  >  48996 [PSH, ACK] Seq=254980 Ack=267 Win=65535 Len=1240 [TCP segment of a reassembled PDU]"
"357","20.252083","10.0.2.15","149.154.167.99","TCP","54","48996  >  443 [ACK] Seq=267 Ack=256220 Win=65535 Len=0"
"358","20.260904","149.154.167.99","10.0.2.15","TCP","2534","443  >  48996 [PSH, ACK] Seq=256220 Ack=267 Win=65535 Len=2480 [TCP segment of a reassembled PDU]"
"359","20.260951","10.0.2.15","149.154.167.99","TCP","54","48996  >  443 [ACK] Seq=267 Ack=258700 Win=65535 Len=0"
