"No.","Time","Source","Destination","Protocol","Length","Info"
"3","0.572106","10.0.2.15","149.154.167.99","TLSv1.2","237","Application Data"
"4","0.572594","149.154.167.99","10.0.2.15","TCP","60","443  >  52862 [ACK] Seq=1 Ack=184 Win=65535 Len=0"
"5","0.667565","149.154.167.99","10.0.2.15","TLSv1.2","167","Application Data"
"6","0.667594","10.0.2.15","149.154.167.99","TCP","54","52862  >  443 [ACK] Seq=184 Ack=114 Win=65535 Len=0"
"11","2.427096","10.0.2.15","149.154.167.99","TLSv1.2","221","Application Data"
"12","2.427540","149.154.167.99","10.0.2.15","TCP","60","443  >  52862 [ACK] Seq=114 Ack=351 Win=65535 Len=0"
"13","2.532951","149.154.167.99","10.0.2.15","TLSv1.2","167","Application Data"
"14","2.532978","10.0.2.15","149.154.167.99","TCP","54","52862  >  443 [ACK] Seq=351 Ack=227 Win=65535 Len=0"
"15","3.701911","10.0.2.15","149.154.167.99","TLSv1.2","237","Application Data"
"16","3.702321","149.154.167.99","10.0.2.15","TCP","60","443  >  52862 [ACK] Seq=227 Ack=534 Win=65535 Len=0"
"17","3.781300","149.154.167.99","10.0.2.15","TLSv1.2","167","Application Data"
"18","3.781371","10.0.2.15","149.154.167.99","TCP","54","52862  >  443 [ACK] Seq=534 Ack=340 Win=65535 Len=0"
"23","6.824367","10.0.2.15","149.154.167.99","TLSv1.2","237","Application Data"
"24","6.824788","149.154.167.99","10.0.2.15","TCP","60","443  >  52862 [ACK] Seq=340 Ack=717 Win=65535 Len=0"
"27","6.906484","149.154.167.99","10.0.2.15","TLSv1.2","167","Application Data"
"28","6.906547","10.0.2.15","149.154.167.99","TCP","54","52862  >  443 [ACK] Seq=717 Ack=453 Win=65535 Len=0"
"29","9.913543","10.0.2.15","149.154.167.99","TLSv1.2","237","Application Data"
"30","9.913906","149.154.167.99","10.0.2.15","TCP","60","443  >  52862 [ACK] Seq=453 Ack=900 Win=65535 Len=0"
"31","9.994272","149.154.167.99","10.0.2.15","TLSv1.2","167","Application Data"
"32","9.994317","10.0.2.15","149.154.167.99","TCP","54","52862  >  443 [ACK] Seq=900 Ack=566 Win=65535 Len=0"
"39","12.885584","149.154.167.91","10.0.2.15","TCP","60","443  >  55888 [ACK] Seq=1 Ack=1 Win=65535 Len=1 [TCP segment of a reassembled PDU]"
"40","12.885616","10.0.2.15","149.154.167.91","TCP","54","[TCP ZeroWindow] 55888  >  443 [ACK] Seq=1 Ack=1 Win=0 Len=0"
"41","13.003586","10.0.2.15","149.154.167.99","TLSv1.2","237","Application Data"
"42","13.003896","149.154.167.99","10.0.2.15","TCP","60","443  >  52862 [ACK] Seq=566 Ack=1083 Win=65535 Len=0"
"43","13.090508","149.154.167.99","10.0.2.15","TLSv1.2","167","Application Data"
"44","13.090542","10.0.2.15","149.154.167.99","TCP","54","52862  >  443 [ACK] Seq=1083 Ack=679 Win=65535 Len=0"
"51","16.097413","10.0.2.15","149.154.167.99","TLSv1.2","237","Application Data"
"52","16.097687","149.154.167.99","10.0.2.15","TCP","60","443  >  52862 [ACK] Seq=679 Ack=1266 Win=65535 Len=0"
"53","16.175951","149.154.167.99","10.0.2.15","TLSv1.2","167","Application Data"
"54","16.175982","10.0.2.15","149.154.167.99","TCP","54","52862  >  443 [ACK] Seq=1266 Ack=792 Win=65535 Len=0"
"70","19.189199","10.0.2.15","149.154.167.99","TLSv1.2","237","Application Data"
"71","19.189665","149.154.167.99","10.0.2.15","TCP","60","443  >  52862 [ACK] Seq=792 Ack=1449 Win=65535 Len=0"
"72","19.272910","149.154.167.99","10.0.2.15","TLSv1.2","167","Application Data"
"73","19.272961","10.0.2.15","149.154.167.99","TCP","54","52862  >  443 [ACK] Seq=1449 Ack=905 Win=65535 Len=0"
"80","22.285164","10.0.2.15","149.154.167.99","TLSv1.2","237","Application Data"
"81","22.285542","149.154.167.99","10.0.2.15","TCP","60","443  >  52862 [ACK] Seq=905 Ack=1632 Win=65535 Len=0"
"82","22.390315","149.154.167.99","10.0.2.15","TLSv1.2","167","Application Data"
"83","22.390498","10.0.2.15","149.154.167.99","TCP","54","52862  >  443 [ACK] Seq=1632 Ack=1018 Win=65535 Len=0"
"88","25.398303","10.0.2.15","149.154.167.99","TLSv1.2","237","Application Data"
"89","25.398572","149.154.167.91","10.0.2.15","TCP","60","443  >  59140 [ACK] Seq=1 Ack=1 Win=65535 Len=1 [TCP segment of a reassembled PDU]"
"90","25.398595","10.0.2.15","149.154.167.91","TCP","54","[TCP ZeroWindow] 59140  >  443 [ACK] Seq=1 Ack=1 Win=0 Len=0"
"91","25.398673","149.154.167.99","10.0.2.15","TCP","60","443  >  52862 [ACK] Seq=1018 Ack=1815 Win=65535 Len=0"
"92","25.488854","149.154.167.99","10.0.2.15","TLSv1.2","167","Application Data"
"93","25.488886","10.0.2.15","149.154.167.99","TCP","54","52862  >  443 [ACK] Seq=1815 Ack=1131 Win=65535 Len=0"
"98","28.497838","10.0.2.15","149.154.167.99","TLSv1.2","237","Application Data"
"99","28.498371","149.154.167.99","10.0.2.15","TCP","60","443  >  52862 [ACK] Seq=1131 Ack=1998 Win=65535 Len=0"
"100","28.589532","149.154.167.99","10.0.2.15","TLSv1.2","167","Application Data"
"101","28.589560","10.0.2.15","149.154.167.99","TCP","54","52862  >  443 [ACK] Seq=1998 Ack=1244 Win=65535 Len=0"
"102","28.846758","34.117.65.55","10.0.2.15","TLSv1.2","78","Application Data"
"103","28.847027","10.0.2.15","34.117.65.55","TLSv1.2","82","Application Data"
"104","28.847251","34.117.65.55","10.0.2.15","TCP","60","443  >  35990 [ACK] Seq=25 Ack=29 Win=65535 Len=0"
"109","31.597805","10.0.2.15","149.154.167.99","TLSv1.2","237","Application Data"
"110","31.598274","149.154.167.99","10.0.2.15","TCP","60","443  >  52862 [ACK] Seq=1244 Ack=2181 Win=65535 Len=0"
"111","31.675946","149.154.167.99","10.0.2.15","TLSv1.2","167","Application Data"
"112","31.675975","10.0.2.15","149.154.167.99","TCP","54","52862  >  443 [ACK] Seq=2181 Ack=1357 Win=65535 Len=0"
"115","34.681808","10.0.2.15","149.154.167.99","TLSv1.2","237","Application Data"
"116","34.682221","149.154.167.99","10.0.2.15","TCP","60","443  >  52862 [ACK] Seq=1357 Ack=2364 Win=65535 Len=0"
"117","34.759111","149.154.167.99","10.0.2.15","TLSv1.2","167","Application Data"
"118","34.759146","10.0.2.15","149.154.167.99","TCP","54","52862  >  443 [ACK] Seq=2364 Ack=1470 Win=65535 Len=0"
"125","36.119504","149.154.167.99","10.0.2.15","TLSv1.2","183","Application Data"
"126","36.119547","10.0.2.15","149.154.167.99","TCP","54","52862  >  443 [ACK] Seq=2364 Ack=1599 Win=65535 Len=0"
"129","37.767567","10.0.2.15","149.154.167.99","TLSv1.2","237","Application Data"
"130","37.767903","149.154.167.99","10.0.2.15","TCP","60","443  >  52862 [ACK] Seq=1599 Ack=2547 Win=65535 Len=0"
"131","37.860243","149.154.167.99","10.0.2.15","TLSv1.2","167","Application Data"
"132","37.860273","10.0.2.15","149.154.167.99","TCP","54","52862  >  443 [ACK] Seq=2547 Ack=1712 Win=65535 Len=0"
"137","38.631514","10.0.2.15","149.154.167.99","TCP","74","44248  >  443 [SYN] Seq=0 Win=64240 Len=0 MSS=1460 SACK_PERM TSval=4093890436 TSecr=0 WS=128"
"138","38.702197","149.154.167.99","10.0.2.15","TCP","60","443  >  44248 [SYN, ACK] Seq=0 Ack=1 Win=65535 Len=0 MSS=1460"
"139","38.702239","10.0.2.15","149.154.167.99","TCP","54","44248  >  443 [ACK] Seq=1 Ack=1 Win=64240 Len=0"
"140","38.705127","10.0.2.15","149.154.167.99","TLSv1.3","732","Client Hello"
"141","38.705878","149.154.167.99","10.0.2.15","TCP","60","443  >  44248 [ACK] Seq=1 Ack=679 Win=65535 Len=0"
"142","38.777482","149.154.167.99","10.0.2.15","TLSv1.3","1294","Server Hello, Change Cipher Spec, Application Data"
"143","38.777517","10.0.2.15","149.154.167.99","TCP","54","44248  >  443 [ACK] Seq=679 Ack=1241 Win=63240 Len=0"
"144","38.778064","149.154.167.99","10.0.2.15","TCP","2910","443  >  44248 [PSH, ACK] Seq=1241 Ack=679 Win=65535 Len=2856 [TCP segment of a reassembled PDU]"
"145","38.778078","10.0.2.15","149.154.167.99","TCP","54","44248  >  443 [ACK] Seq=679 Ack=4097 Win=63240 Len=0"
"146","38.782496","149.154.167.99","10.0.2.15","TLSv1.3","1294","Application Data"
"147","38.782509","10.0.2.15","149.154.167.99","TCP","54","44248  >  443 [ACK] Seq=679 Ack=5337 Win=63240 Len=0"
"148","38.782990","149.154.167.99","10.0.2.15","TLSv1.3","414","Application Data, Application Data"
"149","38.782999","10.0.2.15","149.154.167.99","TCP","54","44248  >  443 [ACK] Seq=679 Ack=5697 Win=63240 Len=0"
"150","38.784576","10.0.2.15","149.154.167.99","TLSv1.3","134","Change Cipher Spec, Application Data"
"151","38.784708","149.154.167.99","10.0.2.15","TCP","60","443  >  44248 [ACK] Seq=5697 Ack=759 Win=65535 Len=0"
"152","38.784790","10.0.2.15","149.154.167.99","TLSv1.3","224","Application Data"
"153","38.784809","10.0.2.15","149.154.167.99","TLSv1.3","323","Application Data"
"154","38.784894","149.154.167.99","10.0.2.15","TCP","60","443  >  44248 [ACK] Seq=5697 Ack=929 Win=65535 Len=0"
"155","38.784894","149.154.167.99","10.0.2.15","TCP","60","443  >  44248 [ACK] Seq=5697 Ack=1198 Win=65535 Len=0"
"156","38.858987","149.154.167.99","10.0.2.15","TLSv1.3","919","Application Data, Application Data, Application Data, Application Data"
"157","38.859479","10.0.2.15","149.154.167.99","TLSv1.3","85","Application Data"
"158","38.859636","149.154.167.99","10.0.2.15","TCP","60","443  >  44248 [ACK] Seq=6562 Ack=1229 Win=65535 Len=0"
"161","40.866353","10.0.2.15","149.154.167.99","TLSv1.2","237","Application Data"
"162","40.866840","149.154.167.99","10.0.2.15","TCP","60","443  >  52862 [ACK] Seq=1712 Ack=2730 Win=65535 Len=0"
"163","40.944245","149.154.167.99","10.0.2.15","TLSv1.2","167","Application Data"
"164","40.944276","10.0.2.15","149.154.167.99","TCP","54","52862  >  443 [ACK] Seq=2730 Ack=1825 Win=65535 Len=0"
"167","41.804784","149.154.167.99","10.0.2.15","TLSv1.2","183","Application Data"
"168","41.804906","10.0.2.15","149.154.167.99","TCP","54","52862  >  443 [ACK] Seq=2730 Ack=1954 Win=65535 Len=0"
"171","43.951029","10.0.2.15","149.154.167.99","TLSv1.2","237","Application Data"
"172","43.951445","149.154.167.99","10.0.2.15","TCP","60","443  >  52862 [ACK] Seq=1954 Ack=2913 Win=65535 Len=0"
"173","44.029747","149.154.167.99","10.0.2.15","TLSv1.2","167","Application Data"
"174","44.029776","10.0.2.15","149.154.167.99","TCP","54","52862  >  443 [ACK] Seq=2913 Ack=2067 Win=65535 Len=0"
"181","47.037279","10.0.2.15","149.154.167.99","TLSv1.2","237","Application Data"
"182","47.037625","149.154.167.99","10.0.2.15","TCP","60","443  >  52862 [ACK] Seq=2067 Ack=3096 Win=65535 Len=0"
"183","47.119266","149.154.167.99","10.0.2.15","TLSv1.2","167","Application Data"
"184","47.119297","10.0.2.15","149.154.167.99","TCP","54","52862  >  443 [ACK] Seq=3096 Ack=2180 Win=65535 Len=0"
"185","48.632301","10.0.2.15","34.117.237.239","TLSv1.2","93","Application Data"
"186","48.632622","34.117.237.239","10.0.2.15","TCP","60","443  >  37656 [ACK] Seq=1 Ack=40 Win=65535 Len=0"
"187","48.708587","34.117.237.239","10.0.2.15","TLSv1.2","93","Application Data"
"188","48.708625","10.0.2.15","34.117.237.239","TCP","54","37656  >  443 [ACK] Seq=40 Ack=40 Win=64028 Len=0"
"191","50.125657","10.0.2.15","149.154.167.99","TLSv1.2","237","Application Data"
"192","50.126031","149.154.167.99","10.0.2.15","TCP","60","443  >  52862 [ACK] Seq=2180 Ack=3279 Win=65535 Len=0"
"193","50.208363","149.154.167.99","10.0.2.15","TLSv1.2","167","Application Data"
"194","50.208393","10.0.2.15","149.154.167.99","TCP","54","52862  >  443 [ACK] Seq=3279 Ack=2293 Win=65535 Len=0"
"197","51.862023","149.154.167.99","10.0.2.15","TLSv1.2","183","Application Data"
"198","51.862061","10.0.2.15","149.154.167.99","TCP","54","52862  >  443 [ACK] Seq=3279 Ack=2422 Win=65535 Len=0"
"201","53.216828","10.0.2.15","149.154.167.99","TLSv1.2","237","Application Data"
"202","53.217214","149.154.167.99","10.0.2.15","TCP","60","443  >  52862 [ACK] Seq=2422 Ack=3462 Win=65535 Len=0"
"203","53.294656","149.154.167.99","10.0.2.15","TLSv1.2","167","Application Data"
"204","53.294684","10.0.2.15","149.154.167.99","TCP","54","52862  >  443 [ACK] Seq=3462 Ack=2535 Win=65535 Len=0"
"209","56.302764","10.0.2.15","149.154.167.99","TLSv1.2","237","Application Data"
"210","56.303255","149.154.167.99","10.0.2.15","TCP","60","443  >  52862 [ACK] Seq=2535 Ack=3645 Win=65535 Len=0"
"211","56.383367","149.154.167.99","10.0.2.15","TLSv1.2","167","Application Data"
"212","56.383396","10.0.2.15","149.154.167.99","TCP","54","52862  >  443 [ACK] Seq=3645 Ack=2648 Win=65535 Len=0"
"215","59.392981","10.0.2.15","149.154.167.99","TLSv1.2","237","Application Data"
"216","59.393225","149.154.167.99","10.0.2.15","TCP","60","443  >  52862 [ACK] Seq=2648 Ack=3828 Win=65535 Len=0"
"217","59.478780","149.154.167.99","10.0.2.15","TLSv1.2","167","Application Data"
"218","59.478811","10.0.2.15","149.154.167.99","TCP","54","52862  >  443 [ACK] Seq=3828 Ack=2761 Win=65535 Len=0"
"227","62.485762","10.0.2.15","149.154.167.99","TLSv1.2","237","Application Data"
"228","62.486272","149.154.167.99","10.0.2.15","TCP","60","443  >  52862 [ACK] Seq=2761 Ack=4011 Win=65535 Len=0"
"229","62.567585","149.154.167.99","10.0.2.15","TLSv1.2","167","Application Data"
"230","62.567613","10.0.2.15","149.154.167.99","TCP","54","52862  >  443 [ACK] Seq=4011 Ack=2874 Win=65535 Len=0"
"279","65.575850","10.0.2.15","149.154.167.99","TLSv1.2","237","Application Data"
"280","65.576277","149.154.167.99","10.0.2.15","TCP","60","443  >  52862 [ACK] Seq=2874 Ack=4194 Win=65535 Len=0"
"281","65.669874","149.154.167.99","10.0.2.15","TLSv1.2","167","Application Data"
"282","65.669916","10.0.2.15","149.154.167.99","TCP","54","52862  >  443 [ACK] Seq=4194 Ack=2987 Win=65535 Len=0"
"291","68.676237","10.0.2.15","149.154.167.99","TLSv1.2","237","Application Data"
"292","68.676552","149.154.167.99","10.0.2.15","TCP","60","443  >  52862 [ACK] Seq=2987 Ack=4377 Win=65535 Len=0"
"293","68.754652","149.154.167.99","10.0.2.15","TLSv1.2","167","Application Data"
"294","68.754678","10.0.2.15","149.154.167.99","TCP","54","52862  >  443 [ACK] Seq=4377 Ack=3100 Win=65535 Len=0"
"299","71.763174","10.0.2.15","149.154.167.99","TLSv1.2","237","Application Data"
"300","71.763536","149.154.167.99","10.0.2.15","TCP","60","443  >  52862 [ACK] Seq=3100 Ack=4560 Win=65535 Len=0"
"301","71.844707","149.154.167.99","10.0.2.15","TLSv1.2","167","Application Data"
"302","71.844732","10.0.2.15","149.154.167.99","TCP","54","52862  >  443 [ACK] Seq=4560 Ack=3213 Win=65535 Len=0"
"305","74.853931","10.0.2.15","149.154.167.99","TLSv1.2","237","Application Data"
"306","74.854337","149.154.167.99","10.0.2.15","TCP","60","443  >  52862 [ACK] Seq=3213 Ack=4743 Win=65535 Len=0"
"307","74.934764","149.154.167.99","10.0.2.15","TLSv1.2","167","Application Data"
"308","74.934792","10.0.2.15","149.154.167.99","TCP","54","52862  >  443 [ACK] Seq=4743 Ack=3326 Win=65535 Len=0"
"315","77.960183","10.0.2.15","149.154.167.99","TLSv1.2","237","Application Data"
"316","77.960696","149.154.167.99","10.0.2.15","TCP","60","443  >  52862 [ACK] Seq=3326 Ack=4926 Win=65535 Len=0"
"317","78.042679","149.154.167.99","10.0.2.15","TLSv1.2","167","Application Data"
"318","78.042706","10.0.2.15","149.154.167.99","TCP","54","52862  >  443 [ACK] Seq=4926 Ack=3439 Win=65535 Len=0"
"321","81.048689","10.0.2.15","149.154.167.99","TLSv1.2","237","Application Data"
"322","81.049071","149.154.167.99","10.0.2.15","TCP","60","443  >  52862 [ACK] Seq=3439 Ack=5109 Win=65535 Len=0"
"325","81.125074","149.154.167.99","10.0.2.15","TLSv1.2","167","Application Data"
"326","81.125100","10.0.2.15","149.154.167.99","TCP","54","52862  >  443 [ACK] Seq=5109 Ack=3552 Win=65535 Len=0"
"329","84.133075","10.0.2.15","149.154.167.99","TLSv1.2","237","Application Data"
"330","84.133564","149.154.167.99","10.0.2.15","TCP","60","443  >  52862 [ACK] Seq=3552 Ack=5292 Win=65535 Len=0"
"331","84.214761","149.154.167.99","10.0.2.15","TLSv1.2","167","Application Data"
"332","84.214789","10.0.2.15","149.154.167.99","TCP","54","52862  >  443 [ACK] Seq=5292 Ack=3665 Win=65535 Len=0"
"333","84.714454","149.154.167.91","10.0.2.15","TCP","60","[TCP Keep-Alive] 443  >  55888 [ACK] Seq=1 Ack=1 Win=65535 Len=1"
"334","84.714484","10.0.2.15","149.154.167.91","TCP","54","[TCP ZeroWindow] 55888  >  443 [ACK] Seq=1 Ack=1 Win=0 Len=0"
"343","87.222538","10.0.2.15","149.154.167.99","TLSv1.2","237","Application Data"
"344","87.222838","149.154.167.99","10.0.2.15","TCP","60","443  >  52862 [ACK] Seq=3665 Ack=5475 Win=65535 Len=0"
"345","87.303933","149.154.167.99","10.0.2.15","TLSv1.2","167","Application Data"
"346","87.303971","10.0.2.15","149.154.167.99","TCP","54","52862  >  443 [ACK] Seq=5475 Ack=3778 Win=65535 Len=0"
"349","90.312101","10.0.2.15","149.154.167.99","TLSv1.2","237","Application Data"
"350","90.312518","149.154.167.99","10.0.2.15","TCP","60","443  >  52862 [ACK] Seq=3778 Ack=5658 Win=65535 Len=0"
"351","90.392862","149.154.167.99","10.0.2.15","TLSv1.2","167","Application Data"
"352","90.392896","10.0.2.15","149.154.167.99","TCP","54","52862  >  443 [ACK] Seq=5658 Ack=3891 Win=65535 Len=0"
"357","93.400161","10.0.2.15","149.154.167.99","TLSv1.2","237","Application Data"
"358","93.400618","149.154.167.99","10.0.2.15","TCP","60","443  >  52862 [ACK] Seq=3891 Ack=5841 Win=65535 Len=0"
"359","93.482518","149.154.167.99","10.0.2.15","TLSv1.2","167","Application Data"
"360","93.482563","10.0.2.15","149.154.167.99","TCP","54","52862  >  443 [ACK] Seq=5841 Ack=4004 Win=65535 Len=0"
"365","96.502915","10.0.2.15","149.154.167.99","TLSv1.2","237","Application Data"
"366","96.503131","149.154.167.91","10.0.2.15","TCP","60","[TCP Keep-Alive] 443  >  59140 [ACK] Seq=1 Ack=1 Win=65535 Len=1"
"367","96.503169","10.0.2.15","149.154.167.91","TCP","54","[TCP ZeroWindow] 59140  >  443 [ACK] Seq=1 Ack=1 Win=0 Len=0"
"368","96.503348","149.154.167.99","10.0.2.15","TCP","60","443  >  52862 [ACK] Seq=4004 Ack=6024 Win=65535 Len=0"
"369","96.581048","149.154.167.99","10.0.2.15","TLSv1.2","167","Application Data"
"370","96.581079","10.0.2.15","149.154.167.99","TCP","54","52862  >  443 [ACK] Seq=6024 Ack=4117 Win=65535 Len=0"
"373","97.634235","10.0.2.15","149.154.167.99","TLSv1.3","93","Application Data"
"374","97.634814","149.154.167.99","10.0.2.15","TCP","60","443  >  44248 [ACK] Seq=6562 Ack=1268 Win=65535 Len=0"
"375","97.714527","149.154.167.99","10.0.2.15","TLSv1.3","93","Application Data"
"376","97.761523","10.0.2.15","149.154.167.99","TCP","54","44248  >  443 [ACK] Seq=1268 Ack=6601 Win=63240 Len=0"
"377","98.310336","10.0.2.15","149.154.167.99","TLSv1.2","221","Application Data"
"378","98.310800","149.154.167.99","10.0.2.15","TCP","60","443  >  52862 [ACK] Seq=4117 Ack=6191 Win=65535 Len=0"
"379","98.424098","149.154.167.99","10.0.2.15","TLSv1.2","167","Application Data"
"380","98.424141","10.0.2.15","149.154.167.99","TCP","54","52862  >  443 [ACK] Seq=6191 Ack=4230 Win=65535 Len=0"
"381","99.590622","10.0.2.15","149.154.167.99","TLSv1.2","237","Application Data"
"382","99.591034","149.154.167.99","10.0.2.15","TCP","60","443  >  52862 [ACK] Seq=4230 Ack=6374 Win=65535 Len=0"
"383","99.673952","149.154.167.99","10.0.2.15","TLSv1.2","167","Application Data"
"384","99.673981","10.0.2.15","149.154.167.99","TCP","54","52862  >  443 [ACK] Seq=6374 Ack=4343 Win=65535 Len=0"
